submission,subreddit,author,created,retrieved,edited,pinned,archived,locked,removed,deleted,is_self,is_video,is_original_content,link_flair_text,upvote_ratio,score,gilded,total_awards_received,num_comments,num_crossposts,thumbnail,shortlink,combined_text,sentiment,vader_score
tgspuh,litecoinmarkets,AutoModerator,1647576069,1647640588,0,0,0,0,0,0,1,0,0,,0.93,71,0,0,42,0,self,https://redd.it/tgspuh,Daily Discussion Friday March 18 2022 Welcome to the rLitecoinMarkets daily discussion thread Thread topics include but are not limited to General discussion related to the days events technical analysis trading ideas strategies,Positive,0.4587
tgw4x1,litecoinmarkets,NervousSuburb,1647589928,1647640588,0,0,0,0,1,0,1,0,0,,0.4,0,0,0,3,0,default,https://redd.it/tgw4x1,Does anyone have similar experiences with this new feature,Neutral,0.0
th2ps5,litecoinmarkets,easin_sujon,1647613906,1647663370,0,0,0,0,1,0,1,0,0,Inaccurate,1.0,1,0,0,0,0,default,https://redd.it/th2ps5,Evervoid When the universe is in your hands Build Fight Explore and Earn Develop your own Asteroid base construct buildings units and complete researchers venture on all kinds of missions compete with fair gamers for galactic domination Evervoid 20 is planned to be released on mobile de,Negative,-0.128
thfx06,litecoinmarkets,bitdex,1647639696,1647749834,0,0,0,0,0,0,0,0,0,Price Prediction,0.6,1,0,0,0,0,https://b.thumbs.redditmedia.com/t7MtS2X8SQOkenjecWGsxj06Yp4hiQFvnQJthk7q-rU.jpg,https://redd.it/thfx06,Litecoin Price Prediction March 18 LTCUSD Rebounds Above 110 Level,Neutral,0.0
thn3ye,litecoinmarkets,AutoModerator,1647662469,1647749837,0,0,0,0,0,0,1,0,0,,0.99,90,0,0,82,0,self,https://redd.it/thn3ye,Daily Discussion Saturday March 19 2022 Welcome to the rLitecoinMarkets daily discussion thread Thread topics include but are not limited to General discussion related to the days events technical analysis trading ideas strategies,Positive,0.4587
thvcv9,litecoinmarkets,monikaeva,1647697016,1647749837,0,0,0,0,1,0,1,0,0,Inaccurate,1.0,1,0,0,0,0,default,https://redd.it/thvcv9,Gravis Finance featured on Top Crypto Media Publishers,Positive,0.2023
ticpmg,litecoinmarkets,AutoModerator,1647748869,1648031205,0,0,0,0,0,0,1,0,0,,1.0,106,0,0,79,0,spoiler,https://redd.it/ticpmg,Daily Discussion Sunday March 20 2022 Welcome to the rLitecoinMarkets daily discussion thread Thread topics include but are not limited to General discussion related to the days events technical analysis trading ideas strategies,Positive,0.4587
tih4ez,litecoinmarkets,No-Pomelo6510,1647767589,1647836061,0,0,0,0,1,0,1,0,0,,0.3,0,0,0,2,0,default,https://redd.it/tih4ez,Who has similar experiences with this new feature,Neutral,0.0
tiiohe,litecoinmarkets,monikaeva,1647774240,1648031205,0,0,0,0,1,0,1,0,0,Inaccurate,1.0,1,0,0,0,0,default,https://redd.it/tiiohe,Gravis Finance featured on Top Crypto Media Publishers,Positive,0.2023
tiltzh,litecoinmarkets,Many_Rent6446,1647785232,1647836061,0,0,0,0,1,0,1,0,0,,0.33,0,0,0,2,0,default,https://redd.it/tiltzh,Big announcement from Zelcore,Neutral,0.0
tipjp8,litecoinmarkets,SeaLocal8398,1647795733,1647865417,0,0,0,0,1,0,1,0,0,,0.5,0,0,0,1,0,default,https://redd.it/tipjp8,Big announcement from The Zelcore Team,Neutral,0.0
tiu8vq,litecoinmarkets,bitdex,1647808590,1647865417,0,0,0,0,0,0,0,0,0,,0.5,0,0,0,0,0,https://a.thumbs.redditmedia.com/d2teaIVOQkjcm5LpMF-2w8ob0w2YKDkKZ8Gbex4_Ub8.jpg,https://redd.it/tiu8vq,Litecoin Price Prediction LTCUSD Retreats Below 120,Neutral,0.0
tj304y,litecoinmarkets,AutoModerator,1647835269,1647879749,0,0,0,0,0,0,1,0,0,,1.0,65,0,0,20,0,self,https://redd.it/tj304y,Daily Discussion Monday March 21 2022 Welcome to the rLitecoinMarkets daily discussion thread Thread topics include but are not limited to General discussion related to the days events technical analysis trading ideas strategies,Positive,0.4587
tjaj6a,litecoinmarkets,[deleted],1647865284,1647921815,0,0,0,0,1,1,0,0,0,price,0.4,0,0,0,1,0,default,https://redd.it/tjaj6a,LTC price on a steep rise,Neutral,0.0
tjfh0w,litecoinmarkets,[deleted],1647879357,1647989871,0,0,0,0,1,1,1,0,0,,0.63,2,0,0,1,0,default,https://redd.it/tjfh0w,Use LTC as a fake money in my game,Negative,-0.4767
tjiv2z,litecoinmarkets,Rickrhea,1647888353,1647989871,0,0,0,0,0,0,1,0,0,,0.92,17,0,0,1,0,https://b.thumbs.redditmedia.com/gFPl_8A7k-eFmonuzi940uIG1Oj3n79NCzidR9g0Gnc.jpg,https://redd.it/tjiv2z,Litecoin Haters Quick Reference Guide x200B,Negative,-0.4939
tjudrj,litecoinmarkets,AutoModerator,1647921668,1647989871,0,0,0,0,0,0,1,0,0,,1.0,93,0,0,98,0,self,https://redd.it/tjudrj,Daily Discussion Tuesday March 22 2022 Welcome to the rLitecoinMarkets daily discussion thread Thread topics include but are not limited to General discussion related to the days events technical analysis trading ideas strategies,Positive,0.4587
tjuepj,litecoinmarkets,123budget,1647921754,1647989871,0,0,0,0,1,0,1,0,0,,1.0,6,0,0,0,0,default,https://redd.it/tjuepj,ALGO adding privacy Litecoin hold my beer,Neutral,0.0
tkfg0g,litecoinmarkets,NightKnight_CZ,1647989468,1648094703,0,0,0,0,0,0,0,0,0,,1.0,22,0,0,2,0,https://b.thumbs.redditmedia.com/NiEttpzvgpWEg6yEPb5rMravgn41FmgFAndrrKclkZA.jpg,https://redd.it/tkfg0g,MEME We will survive together chickun winter flap flap,Neutral,0.0
tkgxcg,litecoinmarkets,bitdex,1647993650,1648094703,0,0,0,0,0,0,0,0,0,Price Prediction,0.63,2,0,0,2,0,https://b.thumbs.redditmedia.com/bGJoC1ZOVeYomNS8Rl9bKKt6N3hGWN0an_ebzE5Bk9g.jpg,https://redd.it/tkgxcg,Litecoin Price Prediction LTCUSD Ready to Cross Above 125 Level,Positive,0.3612
tklhr0,litecoinmarkets,AutoModerator,1648008070,1648094703,0,0,0,0,0,0,1,0,0,,1.0,89,0,0,60,0,self,https://redd.it/tklhr0,Daily Discussion Wednesday March 23 2022 Welcome to the rLitecoinMarkets daily discussion thread Thread topics include but are not limited to General discussion related to the days events technical analysis trading ideas strategies,Positive,0.4587
tkqsmi,litecoinmarkets,Popular_Can4451,1648030922,1648094703,0,0,0,0,1,0,1,0,0,,0.66,1,0,0,0,0,default,https://redd.it/tkqsmi,Incoming announcement from Zelcore,Neutral,0.0
tkslsb,litecoinmarkets,JuneReySuerte,1648037794,1648083362,0,0,0,0,1,0,0,0,0,,1.0,1,0,0,0,0,default,https://redd.it/tkslsb,Easy high income TRON cloud mining free registration 8888TRX daily 7 high yield iG only official website 500,Positive,0.7351
tl8n0o,litecoinmarkets,suriyabenterim,1648062450,1648136204,0,0,0,0,1,0,0,0,0,,1.0,1,0,0,0,0,default,https://redd.it/tl8n0o,GRAVIS FINANCE X MATIC LAUNCHPAD,Neutral,0.0
tlpewe,litecoinmarkets,Basic_Yogurtcloset78,1648082596,1648136204,0,0,0,0,1,0,1,0,0,,1.0,1,0,0,0,0,default,https://redd.it/tlpewe,I am sending you 1 Pi is a new digital currency developed by Stanford PhDs with over 25 million members worldwide To claim your Pi follow this link and use my username Cruiser1000 as your invitation code,Neutral,0.0
tlx65w,litecoinmarkets,AutoModerator,1648094468,1648159570,0,0,0,0,0,0,1,0,0,,1.0,86,0,1,79,0,self,https://redd.it/tlx65w,Daily Discussion Thursday March 24 2022 Welcome to the rLitecoinMarkets daily discussion thread Thread topics include but are not limited to General discussion related to the days events technical analysis trading ideas strategies,Positive,0.4587
tmgxec,litecoinmarkets,suriyabenterim,1648135585,1648181123,0,0,0,0,1,0,0,0,0,,1.0,1,0,0,0,0,default,https://redd.it/tmgxec,GRAVISFINANCE ID has gone live on TrustFi,Neutral,0.0
tmj64v,litecoinmarkets,suriyabenterim,1648137410,1648181123,0,0,0,0,1,0,0,0,0,,1.0,1,0,0,0,0,default,https://redd.it/tmj64v,GRAVISFINANCE ID has gone live on TrustFi,Neutral,0.0
tn6ow9,litecoinmarkets,bitdex,1648159173,1648267596,0,0,0,0,0,0,0,0,0,TA,0.81,6,0,0,0,0,https://b.thumbs.redditmedia.com/dQ6MyG8QBhO7XHLnYRssboupBTCvd8I3NpO978DZbLA.jpg,https://redd.it/tn6ow9,Litecoin Why this level is critical to regain a bullish edge,Negative,-0.3182
tndka3,litecoinmarkets,AutoModerator,1648180869,1648267597,0,0,0,0,0,0,1,0,0,,1.0,94,0,2,63,0,self,https://redd.it/tndka3,Daily Discussion Friday March 25 2022 Welcome to the rLitecoinMarkets daily discussion thread Thread topics include but are not limited to General discussion related to the days events technical analysis trading ideas strategies,Positive,0.4587
tniatw,litecoinmarkets,Federal_Relative6811,1648201378,1648267597,0,0,0,0,1,0,1,0,0,,0.33,0,0,0,1,0,default,https://redd.it/tniatw,Incoming announcement from Zelcore,Neutral,0.0
tnooyb,litecoinmarkets,[deleted],1648222911,1648267597,0,0,0,0,1,1,0,0,0,,1.0,1,0,0,0,0,default,https://redd.it/tnooyb,Analysis Of Litecoin Price LTC Above 130 More Gains Are Possible,Positive,0.4005
togfip,litecoinmarkets,AutoModerator,1648267269,1648352365,0,0,0,0,0,0,1,0,0,,0.99,83,0,0,55,0,self,https://redd.it/togfip,Daily Discussion Saturday March 26 2022 Welcome to the rLitecoinMarkets daily discussion thread Thread topics include but are not limited to General discussion related to the days events technical analysis trading ideas strategies,Positive,0.4587
toic59,litecoinmarkets,ElectionDesperate803,1648275036,1648352365,0,0,0,0,1,0,1,0,0,,0.5,0,0,0,0,0,default,https://redd.it/toic59,Announcing a new feature on Zelcore,Neutral,0.0
tolg6c,litecoinmarkets,Serious_Finish2042,1648289334,1648352365,0,0,0,0,0,0,0,0,0,price,1.0,8,0,0,3,0,https://a.thumbs.redditmedia.com/v0K5Enfi8vfnuk4OToYTviDftcep5UYXwAtU7PB6-T0.jpg,https://redd.it/tolg6c,Litecoin LTC gains 10 this week alone,Positive,0.1027
tpbo41,litecoinmarkets,bitdex,1648352313,1648440093,0,0,0,0,0,0,0,0,0,,0.75,2,0,0,0,0,https://b.thumbs.redditmedia.com/0448SVFpuAwSXu7JCxdu3IlUGgkf8Z9idIRCzuGcomA.jpg,https://redd.it/tpbo41,Litecoin Price Prediction LTCUSD May Spike Towards 130 Resistance,Neutral,0.0
tpc17c,litecoinmarkets,AutoModerator,1648353669,1648440093,0,0,0,0,0,0,1,0,0,,1.0,90,0,0,44,0,self,https://redd.it/tpc17c,Daily Discussion Sunday March 27 2022 Welcome to the rLitecoinMarkets daily discussion thread Thread topics include but are not limited to General discussion related to the days events technical analysis trading ideas strategies,Positive,0.4587
tpcd4t,litecoinmarkets,backwoodsweedguy,1648354970,1648440093,0,0,0,0,0,0,0,0,0,SMALL GAINS GANG ,0.87,39,0,0,3,0,https://a.thumbs.redditmedia.com/POIW5u9sAXOEZXVHoi7emwNdFaE_qcJrlHOt9Utc4y0.jpg,https://redd.it/tpcd4t,I LOVE LITECOIN,Positive,0.6369
tpoi7a,litecoinmarkets,mdrasel71,1648401539,1648477627,0,0,0,0,1,0,1,0,0,Inaccurate,1.0,1,0,0,0,0,default,https://redd.it/tpoi7a,Its time to talk about a new GRVS IDO platform,Neutral,0.0
tq0qt9,litecoinmarkets,AutoModerator,1648440069,1648496073,0,0,0,0,0,0,1,0,0,,1.0,96,0,1,66,0,self,https://redd.it/tq0qt9,Daily Discussion Monday March 28 2022 Welcome to the rLitecoinMarkets daily discussion thread Thread topics include but are not limited to General discussion related to the days events technical analysis trading ideas strategies,Positive,0.4587
tqaeh2,litecoinmarkets,NightKnight_CZ,1648477318,1648526697,0,0,0,0,0,0,0,0,0,MEME,0.91,45,0,0,9,0,https://b.thumbs.redditmedia.com/I_qrYyblSMVKdwTWvjeZtXIottz_GWG71MpN-dOATSU.jpg,https://redd.it/tqaeh2,Soon DAI soon 19,Neutral,0.0
tqfx8b,litecoinmarkets,NightKnight_CZ,1648492236,1648612958,1648492486,0,0,0,0,0,1,0,0,,0.78,18,0,0,5,0,self,https://redd.it/tqfx8b,We should be happy that we can buy LTC still cheap Hi everyone After 3 years of being out of crypto I started to buy from March 2022 heavily LTC I wanted to buy BTC only and just hodl it for years But somehow I accidentally opened LTCBTC chart and went completely OuO WHAT THE BTC has supply of max 21 mil LTC has supply of max 84 mil BTC has 34 of a halving cycle in front of us 625 3125 2024 LTC 125 625 2023 BTC is a store of value LTC is a store of value with 4x supply and it is silver to Bitcoin BUT according to everyone else it is just for payments rather buy other altcoins cuz LTC is dead WTF Lets not mention 100 network uptime almost 299 median transaction value ATH today 180 compared to BTC 500 It is fing UNDERVALUED it is a 2nd Bitcoin with 4x supply and 4x less size of the network availability Once BTC has full blocks LTC tends to skyrocket in network usage price WHY is LTC 130 when BTC is 47000 LTCBTC000277 It is because majority of people are blindsided by 100ks of cryptos I think that when BTC will rise above 100k people will start to realise that there is still LTC that they can buy super cheaply We might even struggle to get above 700 around mid 202324 But maybe just after another halving in 2027 6253125 LTCblock reward people might turn crazy and start to buy LTC once supply of BTC will be running out around 156 BTCblock 2028 Dont tell me that LTC cant literally 100x from today values and maybe be in 20312034 130LTC 13000LTC,Positive,0.2145
tqha4y,litecoinmarkets,No_Apricot2132,1648495893,1648612959,0,0,0,0,0,0,1,0,0,,1.0,4,0,0,3,0,self,https://redd.it/tqha4y,hey yall I am a rather small investor when it comes to crypto litecoin and this sudden rise in price is beginning to trouble me Do we think the spike will continue or will the crypto market shoot back down because of the ongoing conflict in Ukraine i am in college and need to make a decision fast on my investments cuz im broke lmao,Negative,-0.6486
tqkwyd,litecoinmarkets,RobCali509,1648506032,1648612959,0,0,0,0,0,0,0,0,0,,0.86,5,0,0,3,0,default,https://redd.it/tqkwyd,Thoughts on this theory,Neutral,0.0
tqr8j9,litecoinmarkets,AutoModerator,1648526468,1648612959,0,0,0,0,0,0,1,0,0,,1.0,96,0,0,122,0,self,https://redd.it/tqr8j9,Daily Discussion Tuesday March 29 2022 Welcome to the rLitecoinMarkets daily discussion thread Thread topics include but are not limited to General discussion related to the days events technical analysis trading ideas strategies,Positive,0.4587
trxtd7,litecoinmarkets,AutoModerator,1648612868,1648697034,0,0,0,0,0,0,1,0,0,,0.99,82,0,0,79,0,self,https://redd.it/trxtd7,Daily Discussion Wednesday March 30 2022 Welcome to the rLitecoinMarkets daily discussion thread Thread topics include but are not limited to General discussion related to the days events technical analysis trading ideas strategies,Positive,0.4587
tsohe3,litecoinmarkets,Previous_Tomatillo38,1648689996,1648742472,0,0,0,0,1,0,1,0,0,,1.0,1,0,0,0,0,default,https://redd.it/tsohe3,Do you want to earn the EASIEST but most LEGIT way SpaceGate is your solution One Token Farming Multi chain No Impermanent Loss 052 daily interest on your earnings,Positive,0.5598
tsq5vh,litecoinmarkets,bitdex,1648695471,1648742472,0,0,0,0,0,0,0,0,0,TA,0.76,4,0,0,0,0,https://b.thumbs.redditmedia.com/ZK7txhEWRa5pFyNPK0qoOjPimtkOGgX0F7ieUWV5YBo.jpg,https://redd.it/tsq5vh,Litecoin Price Prediction LTCUSD Price Increases in Rallying Motion,Neutral,0.0
tsrapw,litecoinmarkets,AutoModerator,1648699270,1648786151,0,0,0,0,0,0,1,0,0,,1.0,105,0,1,202,0,self,https://redd.it/tsrapw,Daily Discussion Thursday March 31 2022 Welcome to the rLitecoinMarkets daily discussion thread Thread topics include but are not limited to General discussion related to the days events technical analysis trading ideas strategies,Positive,0.4587
tsv2l5,litecoinmarkets,Previous_Tomatillo38,1648714784,1648786151,0,0,0,0,1,0,1,0,0,,1.0,1,0,0,0,0,default,https://redd.it/tsv2l5,Do you want to earn the EASIEST but most LEGIT way SpaceGate is your solution One Token Farming Multi chain No Impermanent Loss 052 daily interest on your earnings,Positive,0.5598
tsxk05,litecoinmarkets,billover1134,1648725726,1648786151,0,0,0,0,1,0,0,0,0,,1.0,1,0,0,0,0,default,https://redd.it/tsxk05,Bitcoin Exchange Trading BTC USD BTC EUR CEXIO,Neutral,0.0
tt2uky,litecoinmarkets,NightKnight_CZ,1648742052,1648786151,0,0,0,0,0,0,0,0,0,,0.84,35,0,0,8,0,https://b.thumbs.redditmedia.com/3dYPvxag7NiY8SBHrcJF9IWcMjolXl_Q69MXK5ELiBk.jpg,https://redd.it/tt2uky,Remember pepes 5000LTC,Neutral,0.0
tthrp3,litecoinmarkets,AutoModerator,1648785669,1648872929,0,0,0,0,0,0,1,0,0,,1.0,78,0,0,124,0,self,https://redd.it/tthrp3,Daily Discussion Friday April 01 2022 Welcome to the rLitecoinMarkets daily discussion thread Thread topics include but are not limited to General discussion related to the days events technical analysis trading ideas strategies,Positive,0.4587
ttoprz,litecoinmarkets,WarSpiritual9644,1648813564,1648872929,0,0,0,0,1,0,1,0,0,,1.0,1,0,0,0,0,default,https://redd.it/ttoprz,Ever wondered how our PrivacySwap DEX will compare to other established DEXs out there,Neutral,0.0
ttqjsx,litecoinmarkets,N0BLE-1,1648819332,1648872929,0,0,0,0,0,0,0,0,0,,0.8,12,0,0,7,0,https://b.thumbs.redditmedia.com/dBppwUBktzC0MKWcPiPIZHm4RLdDpiiFDwxZguIDDKc.jpg,https://redd.it/ttqjsx,like this what makes me more disappointed in LTC than I need to be,Negative,-0.2247
tu9xwg,litecoinmarkets,AutoModerator,1648872069,1648921771,0,0,0,0,0,0,1,0,0,,0.98,76,0,0,41,0,self,https://redd.it/tu9xwg,Daily Discussion Saturday April 02 2022 Welcome to the rLitecoinMarkets daily discussion thread Thread topics include but are not limited to General discussion related to the days events technical analysis trading ideas strategies,Positive,0.4587
tuobr4,litecoinmarkets,NightKnight_CZ,1648920635,1649007861,0,0,0,0,0,0,0,0,0,,0.97,28,0,0,4,0,https://b.thumbs.redditmedia.com/_LlfqZ2M7_aP1c3cTU6ktJrTmTidf7HfEZyovN7Wb-c.jpg,https://redd.it/tuobr4,MEME When people realise that there is only 14M LTC left,Neutral,0.0
tv0ffu,litecoinmarkets,AutoModerator,1648958470,1649007861,0,0,0,0,0,0,1,0,0,,1.0,73,0,0,33,0,self,https://redd.it/tv0ffu,Daily Discussion Sunday April 03 2022 Welcome to the rLitecoinMarkets daily discussion thread Thread topics include but are not limited to General discussion related to the days events technical analysis trading ideas strategies,Positive,0.4587
tvep62,litecoinmarkets,NightKnight_CZ,1649007127,1649105430,0,0,0,0,0,0,0,0,0,,0.92,21,0,0,1,0,https://b.thumbs.redditmedia.com/QRJUedWVJ6Eh_QIgvHJuCozRagGEfuge4vyM87c3x8s.jpg,https://redd.it/tvep62,MEME pwak pwak pwaaaak Hey chickun you flappin,Neutral,0.0
tvku2h,litecoinmarkets,RadishSubject7823,1649022176,1649105429,0,0,0,0,1,0,0,0,0,FUD,1.0,1,0,0,0,0,default,https://redd.it/tvku2h,Start mining crypto today The best offer for Crypto Mining Equipment,Positive,0.6369
tvsp5d,litecoinmarkets,AutoModerator,1649044869,1649105430,0,0,0,0,0,0,1,0,0,,1.0,98,0,2,76,0,self,https://redd.it/tvsp5d,Daily Discussion Monday April 04 2022 Welcome to the rLitecoinMarkets daily discussion thread Thread topics include but are not limited to General discussion related to the days events technical analysis trading ideas strategies,Positive,0.4587
twcg28,litecoinmarkets,bitdex,1649104833,1649156665,0,0,0,0,0,0,0,0,0,TA,0.4,0,0,0,0,0,https://a.thumbs.redditmedia.com/9gRCxwjG2IlRCQsefBSfywoqH1L2yQ08WQuHZ0HYtX0.jpg,https://redd.it/twcg28,Litecoin Price Prediction LTCUSD Slides Below 130,Neutral,0.0
twdlcl,litecoinmarkets,bitdex,1649107651,1649156665,0,0,0,0,0,0,0,0,0,TA,0.78,10,0,0,3,0,https://b.thumbs.redditmedia.com/WtDZrpcB2dVypWm6i3N0eHeDrG3NNL2VBaItIgsnvow.jpg,https://redd.it/twdlcl,Litecoin holders are in for a treat as LTC fractal forecasts a 45 ascent,Positive,0.4019
twm3zb,litecoinmarkets,AutoModerator,1649131269,1649218197,0,0,0,0,0,0,1,0,0,,1.0,90,0,2,91,0,self,https://redd.it/twm3zb,Daily Discussion Tuesday April 05 2022 Welcome to the rLitecoinMarkets daily discussion thread Thread topics include but are not limited to General discussion related to the days events technical analysis trading ideas strategies,Positive,0.4587
twn529,litecoinmarkets,NightKnight_CZ,1649134866,1649218199,0,0,0,0,0,0,0,0,0,,0.79,8,0,0,1,0,https://a.thumbs.redditmedia.com/2jq7Lo6KfyIzBNAZKrQ-xmsEp-rHYmmQT9TVAMq5Yt8.jpg,https://redd.it/twn529,MEME The Great Chickuning will come LTC 2,Positive,0.6249
tws8g7,litecoinmarkets,CBDoctor,1649156167,1649218199,0,0,0,0,0,0,0,0,0,MWEB,1.0,20,0,0,2,0,https://b.thumbs.redditmedia.com/Kqw4j5CipQjVIWkzN6p3Es2x19jMUwHO54UgWqZpZ9k.jpg,https://redd.it/tws8g7,Mimblewimble Progress Update Thread March,Positive,0.4215
twvilv,litecoinmarkets,mishmoigon2,1649166942,1649218199,0,0,0,0,0,0,0,0,0,,0.88,46,0,1,17,0,https://b.thumbs.redditmedia.com/Ly-eDZD_08Zlc4q0No9Y6cHOiGzr1l4a5vvAKFIrt2c.jpg,https://redd.it/twvilv,To all the mother FUDers out there who think LTC is dried up and finished consider that its price was even lower than it is now in the past The current market value of the coin does not reflect the coins actual value LTC is the future of crypto if you ask me its simply on sale at the moment,Positive,0.3818
txdeoj,litecoinmarkets,AutoModerator,1649217669,1649304797,0,0,0,0,0,0,1,0,0,,1.0,87,0,0,177,0,self,https://redd.it/txdeoj,Daily Discussion Wednesday April 06 2022 Welcome to the rLitecoinMarkets daily discussion thread Thread topics include but are not limited to General discussion related to the days events technical analysis trading ideas strategies,Positive,0.4587
txoso3,litecoinmarkets,unitys2011,1649258990,1649304797,0,0,0,0,0,0,0,0,0,,0.91,9,0,0,3,0,default,https://redd.it/txoso3,Litecoin LTC Rallies After Bullish Pattern,Neutral,0.0
ty143i,litecoinmarkets,Previous_Tomatillo38,1649293409,1649363783,0,0,0,0,1,0,1,0,0,,1.0,1,0,0,0,0,default,https://redd.it/ty143i,Join SpaceGate today and EARN passively with transparency One Token Farming Multi chain No Impermanent Loss 052 daily,Negative,-0.4588
ty1l88,litecoinmarkets,Previous_Tomatillo38,1649294919,1649363783,0,0,0,0,1,0,1,0,0,,1.0,1,0,0,0,0,default,https://redd.it/ty1l88,Do you want to earn the EASIEST but most LEGIT way SpaceGate is your solution One Token Farming Multi chain No Impermanent Loss 052 daily interest on your earnings,Positive,0.5598
ty2rv5,litecoinmarkets,Previous_Tomatillo38,1649298592,1649363783,0,0,0,0,1,0,1,0,0,,1.0,1,0,0,0,0,default,https://redd.it/ty2rv5,Hey there I thought youd be interested with this money making opportunity with SpaceGate,Positive,0.6705
ty3p5v,litecoinmarkets,John_Sknow,1649301504,1649363783,0,0,0,0,1,0,1,0,0,,1.0,1,0,0,0,0,default,https://redd.it/ty3p5v,I dont like the idea that Litecoin is tied Doge Coin through merge mining Seemingly I feel like I have to root for the success of a shitcoin as its failure would negatively effect Litecoin Am I wrong for thinking this way Is Elon shilling Doge a good thing for Litecoin Your thoughts,Negative,-0.4624
ty4gex,litecoinmarkets,AutoModerator,1649304069,1649363783,0,0,0,0,0,0,1,0,0,,1.0,87,0,1,63,0,self,https://redd.it/ty4gex,Daily Discussion Thursday April 07 2022 Welcome to the rLitecoinMarkets daily discussion thread Thread topics include but are not limited to General discussion related to the days events technical analysis trading ideas strategies,Positive,0.4587
tym6el,litecoinmarkets,NoCause2873,1649363741,1649477539,0,0,0,0,1,0,1,0,0,,1.0,1,0,0,0,0,default,https://redd.it/tym6el,KingShibaOne Launching Soon Top 5 Social Media Influencers Hired CommunityFocused deflationary Token You wont want to miss this Gem,Positive,0.2551
tyuw13,litecoinmarkets,AutoModerator,1649390469,1649477540,0,0,0,0,0,0,1,0,0,,1.0,90,0,0,75,0,self,https://redd.it/tyuw13,Daily Discussion Friday April 08 2022 Welcome to the rLitecoinMarkets daily discussion thread Thread topics include but are not limited to General discussion related to the days events technical analysis trading ideas strategies,Positive,0.4587
tywq9t,litecoinmarkets,WarSpiritual9644,1649397380,1649477540,0,0,0,0,1,0,1,0,0,,1.0,1,0,0,0,0,default,https://redd.it/tywq9t,Ever wondered how our PrivacySwap DEX will compare to other established DEXs out there,Neutral,0.0
tz0xcv,litecoinmarkets,Previous_Tomatillo38,1649415596,1649477540,0,0,0,0,1,0,1,0,0,,1.0,1,0,0,0,0,default,https://redd.it/tz0xcv,Hey there I thought youd be interested with this money making opportunity with SpaceGate,Positive,0.6705
tzl24r,litecoinmarkets,AutoModerator,1649476870,1649561014,0,0,0,0,0,0,1,0,0,,0.98,82,0,0,36,0,self,https://redd.it/tzl24r,Daily Discussion Saturday April 09 2022 Welcome to the rLitecoinMarkets daily discussion thread Thread topics include but are not limited to General discussion related to the days events technical analysis trading ideas strategies,Positive,0.4587
u08pav,litecoinmarkets,miseHegeCromonr,1649559738,1649650486,1649632159,0,0,0,0,0,1,0,0,Strategy,0.67,1,0,0,0,0,https://b.thumbs.redditmedia.com/mGaWuuwThc3kuMegtiKpc5c1cD8BLgv4zHwfrtHI53A.jpg,https://redd.it/u08pav,Investment Portfolio Tracker Template for Excel Cryptocurrencies Stocks Bonds ETFs REITs Live Data Calculations Digital Finance Tracker x200B       1 Portfolios Currency is selected 2 History is inputted either with a CSV file or manually Transactions Trades Dividends 3 Each investments information is specified Asset Class Region Sector etc 4 All data are then calculated automatically based on the above information x200B   For all Portfolio and Individual Investments EUR USD GBP CAD CHF AUD NZD GBX Only for Individual Investments x200B   wAutomatic calculation unless stated otherwise Dashboard Portfolio Desired Portfolio Manual Input Pies Allocation Tickers Info Manual Input Crypto Portfolio TransactionsTradesDividends History Manual Input Returns Dividends Calculators Valuation Screener Annual Reports Watchlist Manual Input Customization and Info Guide x200B   The workbook requires any version of Microsoft Excel excluding Google Sheets If the following error pops up in Office 2019 this means your version is not supported In that case you need to downgrade to an older version of Office 2019 If the following error pops up just click OK It should disappear once you input your History The workbook supports up to 40 current holdings x200B  ,Positive,0.7764
u09mri,litecoinmarkets,AutoModerator,1649563269,1649650486,0,0,0,0,0,0,1,0,0,,1.0,89,0,0,68,0,self,https://redd.it/u09mri,Daily Discussion Sunday April 10 2022 Welcome to the rLitecoinMarkets daily discussion thread Thread topics include but are not limited to General discussion related to the days events technical analysis trading ideas strategies,Positive,0.4587
