submission,subreddit,author,created,retrieved,edited,pinned,archived,locked,removed,deleted,is_self,is_video,is_original_content,link_flair_text,upvote_ratio,score,gilded,total_awards_received,num_comments,num_crossposts,thumbnail,shortlink,combined_text,sentiment,vader_score
x535r5,litecoinmarkets,ViMooney,1662234680,1662305633,0,0,0,0,0,0,0,0,0,FUD,0.85,22,0,0,3,0,https://b.thumbs.redditmedia.com/11eNp8Vt6M3d-IyY5XzAfW7l77GP0bTRKFBKg4zF8jE.jpg,https://redd.it/x535r5,Litecoin Retakes 60 as Pump to 75 Now in Sight,Neutral,0.0
x5ddju,litecoinmarkets,AutoModerator,1662264071,1662391544,0,0,0,0,0,0,1,0,0,,0.94,73,0,0,41,0,self,https://redd.it/x5ddju,Daily Discussion Sunday September 04 2022 Welcome to the rLitecoinMarkets daily discussion thread Thread topics include but are not limited to General discussion related to the days events technical analysis trading ideas strategies,Positive,0.4587
x5pr7l,litecoinmarkets,litecoin-master,1662305478,1662391544,0,0,0,0,1,0,0,0,0,,0.73,5,0,0,0,0,default,https://redd.it/x5pr7l,Litecoin Block Rewards Halving,Positive,0.0516
x66d8v,litecoinmarkets,AutoModerator,1662350468,1662396093,0,0,0,0,0,0,1,0,0,,0.97,61,0,1,28,0,self,https://redd.it/x66d8v,Daily Discussion Monday September 05 2022 Welcome to the rLitecoinMarkets daily discussion thread Thread topics include but are not limited to General discussion related to the days events technical analysis trading ideas strategies,Positive,0.4587
x6iecf,litecoinmarkets,AcrobaticBird72,1662390325,1662439376,0,0,0,0,0,0,0,0,0,,0.95,17,0,0,6,0,default,https://redd.it/x6iecf,Can Litecoin Still Be a Good Investment LTC Pros and Cons,Positive,0.4404
x6kpel,litecoinmarkets,Glass_Pace_2200,1662395915,1662497879,0,0,0,0,0,0,0,0,0,Price,0.71,7,0,0,4,0,https://b.thumbs.redditmedia.com/6qWkbi5TQ7NqsdYVPuMwGXMGvxtEDyeIkt7Z0a3tMRY.jpg,https://redd.it/x6kpel,Litecoin LTC Price Prediction 2022 Will LTC Hit 150 Soon,Neutral,0.0
x70gwp,litecoinmarkets,AutoModerator,1662436875,1662497879,0,0,0,0,0,0,1,0,0,,0.94,59,0,1,77,0,self,https://redd.it/x70gwp,Daily Discussion Tuesday September 06 2022 Welcome to the rLitecoinMarkets daily discussion thread Thread topics include but are not limited to General discussion related to the days events technical analysis trading ideas strategies,Positive,0.4587
x7dcko,litecoinmarkets,litecoin-master,1662477809,1662523716,0,0,0,0,0,0,0,0,0,,0.95,28,0,0,15,0,https://b.thumbs.redditmedia.com/vEBhok3RQyqemO7ue1apX8p_wxSzut_K18eJcAF6dcY.jpg,https://redd.it/x7dcko,Litecoin new address growth,Positive,0.3818
x7kwar,litecoinmarkets,samair8,1662496060,1662611328,0,0,0,0,0,0,0,0,0,ltc,0.83,8,0,0,1,0,https://b.thumbs.redditmedia.com/emSFTacg64Gb8wC8ZPQBGSG4oKuVXBLs7f6D_yn4-As.jpg,https://redd.it/x7kwar,How to add Litecoin to Metamask,Neutral,0.0
x7v266,litecoinmarkets,AutoModerator,1662523270,1662671594,0,0,0,0,0,0,1,0,0,,0.97,78,0,0,61,0,self,https://redd.it/x7v266,Daily Discussion Wednesday September 07 2022 Welcome to the rLitecoinMarkets daily discussion thread Thread topics include but are not limited to General discussion related to the days events technical analysis trading ideas strategies,Positive,0.4587
x7zx0e,litecoinmarkets,chloe123659,1662540380,1662671594,0,0,0,0,1,0,1,0,0,,1.0,1,0,0,0,0,default,https://redd.it/x7zx0e,My Full Plan for this Week 5 Earnings Plays 2 Economic Events 4 Stocks 1 Lotto 10x Play,Positive,0.5267
x8pwdb,litecoinmarkets,AutoModerator,1662609669,1662671593,0,0,0,0,0,0,1,0,0,,0.98,66,0,1,55,0,self,https://redd.it/x8pwdb,Daily Discussion Thursday September 08 2022 Welcome to the rLitecoinMarkets daily discussion thread Thread topics include but are not limited to General discussion related to the days events technical analysis trading ideas strategies,Positive,0.4587
x9axnl,litecoinmarkets,Esoteri7,1662669138,1662784103,0,0,0,0,1,0,0,0,0,,0.9,8,0,0,1,0,default,https://redd.it/x9axnl,LITECOIN TO THE MOON BABY,Neutral,0.0
x9l7gy,litecoinmarkets,AutoModerator,1662696069,1662784103,0,0,0,0,0,0,1,0,0,,0.98,74,0,0,50,0,self,https://redd.it/x9l7gy,Daily Discussion Friday September 09 2022 Welcome to the rLitecoinMarkets daily discussion thread Thread topics include but are not limited to General discussion related to the days events technical analysis trading ideas strategies,Positive,0.4587
x9pgt7,litecoinmarkets,CBDoctor,1662710396,1662784103,0,0,0,0,0,0,0,0,0,,0.83,26,0,0,3,0,https://b.thumbs.redditmedia.com/upens8Q1WHLmEo8D_KoF41IqJN6wmAWZu1Xood2aPbo.jpg,https://redd.it/x9pgt7,SatoshiLite Why is nooboody talking aboout this LitecoinSummit2022,Neutral,0.0
xaffyd,litecoinmarkets,AutoModerator,1662782470,1662845122,0,0,0,0,0,0,1,0,0,,0.97,72,0,0,43,0,self,https://redd.it/xaffyd,Daily Discussion Saturday September 10 2022 Welcome to the rLitecoinMarkets daily discussion thread Thread topics include but are not limited to General discussion related to the days events technical analysis trading ideas strategies,Positive,0.4587
xak0ic,litecoinmarkets,bakarainvest,1662798591,1662869272,0,0,0,0,1,0,0,0,0,,1.0,1,0,0,0,0,default,https://redd.it/xak0ic,Ethereums Merge Is Disrupting Crypto Trading and Lending,Neutral,0.0
xaz60t,litecoinmarkets,s618o,1662841650,1662922792,0,0,0,0,0,0,0,0,0,,0.87,17,0,1,6,0,default,https://redd.it/xaz60t,Litecoin Is It Still A Good Investment,Positive,0.4404
xb8ne7,litecoinmarkets,AutoModerator,1662868869,1662922792,0,0,0,0,0,0,1,0,0,,0.98,49,0,0,26,0,self,https://redd.it/xb8ne7,Daily Discussion Sunday September 11 2022 Welcome to the rLitecoinMarkets daily discussion thread Thread topics include but are not limited to General discussion related to the days events technical analysis trading ideas strategies,Positive,0.4587
xboqzj,litecoinmarkets,samair8,1662918308,1662967125,0,0,0,0,0,0,0,0,0,ltc,0.36,0,0,0,1,0,https://b.thumbs.redditmedia.com/KAAjeYGsbJJOJTHyRHFmb48sSnzJzAKv348w0y5j7Lw.jpg,https://redd.it/xboqzj,How to get free litecoin real,Positive,0.5106
xc2q73,litecoinmarkets,AutoModerator,1662955269,1663042069,0,0,0,0,0,0,1,0,0,,0.99,75,0,1,34,0,self,https://redd.it/xc2q73,Daily Discussion Monday September 12 2022 Welcome to the rLitecoinMarkets daily discussion thread Thread topics include but are not limited to General discussion related to the days events technical analysis trading ideas strategies,Positive,0.4587
xc4fvk,litecoinmarkets,Noobsicles,1662960901,1663042068,0,0,0,0,0,0,0,0,0,,0.67,2,0,0,1,0,https://b.thumbs.redditmedia.com/skKPqXLNzd0onqb8Zo3VgEJLTUxGC4DYU8aDjDeys7E.jpg,https://redd.it/xc4fvk,Texas Bitcoin Miners Use Enough Renewable Energy To Power 240k Homes,Positive,0.2732
xc5ttz,litecoinmarkets,PahadiForum,1662965867,1663042069,0,0,0,0,1,0,1,0,0,,0.75,2,0,0,1,0,default,https://redd.it/xc5ttz,Do you know the price of Litecoin might increase by the end of 2022 How Litecoin price prediction might touch at least 120 by the end of December 2022,Positive,0.3182
xcxeoy,litecoinmarkets,AutoModerator,1663041670,1663132511,0,0,0,0,0,0,1,0,0,,1.0,82,0,0,100,0,self,https://redd.it/xcxeoy,Daily Discussion Tuesday September 13 2022 Welcome to the rLitecoinMarkets daily discussion thread Thread topics include but are not limited to General discussion related to the days events technical analysis trading ideas strategies,Positive,0.4587
xdruml,litecoinmarkets,AutoModerator,1663128071,1663218090,0,0,0,0,0,0,1,0,0,,0.98,67,0,1,53,0,self,https://redd.it/xdruml,Daily Discussion Wednesday September 14 2022 Welcome to the rLitecoinMarkets daily discussion thread Thread topics include but are not limited to General discussion related to the days events technical analysis trading ideas strategies,Positive,0.4587
xemk3y,litecoinmarkets,AutoModerator,1663214470,1663261350,0,0,0,0,0,0,1,0,0,,0.98,50,0,0,24,0,self,https://redd.it/xemk3y,Daily Discussion Thursday September 15 2022 Welcome to the rLitecoinMarkets daily discussion thread Thread topics include but are not limited to General discussion related to the days events technical analysis trading ideas strategies,Positive,0.4587
xf0or0,litecoinmarkets,[deleted],1663258145,1663387801,0,0,0,0,1,1,1,0,0,,1.0,1,0,0,0,0,default,https://redd.it/xf0or0,,Neutral,0.0
xf0pm5,litecoinmarkets,Givefreehugs,1663258206,1663387801,0,0,0,0,0,0,0,0,0,,0.93,24,0,0,2,0,https://a.thumbs.redditmedia.com/IvfxcPfyBPtR2JHzLh3va4DfM_9xmXTCMIywtqKa9B0.jpg,https://redd.it/xf0pm5,China legal case opens the doors to Litecoin,Positive,0.128
xfgxza,litecoinmarkets,AutoModerator,1663300872,1663387801,0,0,0,0,0,0,1,0,0,,1.0,69,0,1,26,0,self,https://redd.it/xfgxza,Daily Discussion Friday September 16 2022 Welcome to the rLitecoinMarkets daily discussion thread Thread topics include but are not limited to General discussion related to the days events technical analysis trading ideas strategies,Positive,0.4587
xgc15o,litecoinmarkets,AutoModerator,1663387269,1663478056,0,0,0,0,0,0,1,0,0,,0.97,62,0,0,30,0,self,https://redd.it/xgc15o,Daily Discussion Saturday September 17 2022 Welcome to the rLitecoinMarkets daily discussion thread Thread topics include but are not limited to General discussion related to the days events technical analysis trading ideas strategies,Positive,0.4587
xh6hev,litecoinmarkets,AutoModerator,1663473671,1663649233,0,0,0,0,0,0,1,0,0,,0.98,64,0,1,55,0,self,https://redd.it/xh6hev,Daily Discussion Sunday September 18 2022 Welcome to the rLitecoinMarkets daily discussion thread Thread topics include but are not limited to General discussion related to the days events technical analysis trading ideas strategies,Positive,0.4587
xh7sl4,litecoinmarkets,No-Mission-962,1663477934,1663649233,0,0,0,0,0,0,0,0,0,,0.95,36,0,0,20,0,default,https://redd.it/xh7sl4,Quick survey How many of you that commented in the below post are still holding LTC and waiting for that 600,Neutral,0.0
xhccg5,litecoinmarkets,WhiteDogNC,1663493971,1663649233,0,0,0,0,0,0,1,0,0,,1.0,10,0,0,3,0,self,https://redd.it/xhccg5,Investors seek refuge from market chaos in cash despite surging inflation Even though inflation is eating away at every dollar fund managers are liquidating into cash positions In my opinion this points to large amounts of funds ready to buy stocks and crypto at fire sale levels October is historically a tough month for the markets and I believe this one will be disastrous Crypto is already at low levels Add another 30 drop and I believe we see a massive inflow of funds into BTC,Negative,-0.9042
xi19pz,litecoinmarkets,AutoModerator,1663560068,1663649232,0,0,0,0,0,0,1,0,0,,0.97,59,0,1,52,0,self,https://redd.it/xi19pz,Daily Discussion Monday September 19 2022 Welcome to the rLitecoinMarkets daily discussion thread Thread topics include but are not limited to General discussion related to the days events technical analysis trading ideas strategies,Positive,0.4587
xiyg7k,litecoinmarkets,AutoModerator,1663646473,1663733154,0,0,0,0,0,0,1,0,0,,0.98,65,0,1,48,0,self,https://redd.it/xiyg7k,Daily Discussion Tuesday September 20 2022 Welcome to the rLitecoinMarkets daily discussion thread Thread topics include but are not limited to General discussion related to the days events technical analysis trading ideas strategies,Positive,0.4587
xju86y,litecoinmarkets,AutoModerator,1663732870,1663819554,0,0,0,0,0,0,1,0,0,,0.99,69,0,1,60,0,self,https://redd.it/xju86y,Daily Discussion Wednesday September 21 2022 Welcome to the rLitecoinMarkets daily discussion thread Thread topics include but are not limited to General discussion related to the days events technical analysis trading ideas strategies,Positive,0.4587
xkqstl,litecoinmarkets,AutoModerator,1663819270,1663906052,0,0,0,0,0,0,1,0,0,,0.99,61,0,1,46,0,self,https://redd.it/xkqstl,Daily Discussion Thursday September 22 2022 Welcome to the rLitecoinMarkets daily discussion thread Thread topics include but are not limited to General discussion related to the days events technical analysis trading ideas strategies,Positive,0.4587
xlmvkf,litecoinmarkets,AutoModerator,1663905671,1663995042,0,0,0,0,0,0,1,0,0,,0.97,73,0,0,32,0,self,https://redd.it/xlmvkf,Daily Discussion Friday September 23 2022 Welcome to the rLitecoinMarkets daily discussion thread Thread topics include but are not limited to General discussion related to the days events technical analysis trading ideas strategies,Positive,0.4587
xlp7ho,litecoinmarkets,Glass_Pace_2200,1663913022,1663995042,0,0,0,0,0,0,0,0,0,,0.88,12,0,0,4,0,https://a.thumbs.redditmedia.com/ZxkZKxXyhAplPnT5fECqTDorGkqgnbrFuFF7bsmgDX4.jpg,https://redd.it/xlp7ho,Litecoin Price Analysis LTC Set To Be Bullish for the Next 24 Hours,Neutral,0.0
xmierd,litecoinmarkets,AutoModerator,1663992068,1664081156,0,0,0,0,0,0,1,0,0,,0.99,60,0,1,19,0,self,https://redd.it/xmierd,Daily Discussion Saturday September 24 2022 Welcome to the rLitecoinMarkets daily discussion thread Thread topics include but are not limited to General discussion related to the days events technical analysis trading ideas strategies,Positive,0.4587
xncwdo,litecoinmarkets,AutoModerator,1664078470,1664168451,0,0,0,0,0,0,1,0,0,,0.92,47,0,0,19,0,self,https://redd.it/xncwdo,Daily Discussion Sunday September 25 2022 Welcome to the rLitecoinMarkets daily discussion thread Thread topics include but are not limited to General discussion related to the days events technical analysis trading ideas strategies,Positive,0.4587
xndxuh,litecoinmarkets,DoUsmeLLit6,1664081827,1664168450,0,0,0,0,0,0,0,0,0,,0.78,37,0,0,15,0,https://b.thumbs.redditmedia.com/M3I2Gb10GOswQuaM01oQYkCIaurU9V6TPVT2K2DRG7w.jpg,https://redd.it/xndxuh,I can see Litecoin at 300 by 2023 once this begins to shift dont get left behind the speed boat is leaving soon,Neutral,0.0
xo8ig7,litecoinmarkets,AutoModerator,1664164870,1664253070,0,0,0,0,0,0,1,0,0,,0.97,70,0,0,21,0,self,https://redd.it/xo8ig7,Daily Discussion Monday September 26 2022 Welcome to the rLitecoinMarkets daily discussion thread Thread topics include but are not limited to General discussion related to the days events technical analysis trading ideas strategies,Positive,0.4587
xp5uu5,litecoinmarkets,AutoModerator,1664251269,1664338732,0,0,0,0,0,0,1,0,0,,0.98,65,0,0,30,0,self,https://redd.it/xp5uu5,Daily Discussion Tuesday September 27 2022 Welcome to the rLitecoinMarkets daily discussion thread Thread topics include but are not limited to General discussion related to the days events technical analysis trading ideas strategies,Positive,0.4587
xpcnwr,litecoinmarkets,CBDoctor,1664273664,1664338732,0,0,0,0,0,0,0,0,0,,1.0,21,0,0,1,0,https://b.thumbs.redditmedia.com/bMjCa7pvW2Q0zCBbD9BGkkclfl2JbNHAa-T9AIVfuNA.jpg,https://redd.it/xpcnwr,bbands Litecoin has been in a tight trading range for five months Now you can see a Squeeze on the weekly chart I will talk about this at the Litecoin summit,Neutral,0.0
xq268c,litecoinmarkets,AutoModerator,1664337672,1664425716,0,0,0,0,0,0,1,0,0,,0.99,50,0,0,28,0,self,https://redd.it/xq268c,Daily Discussion Wednesday September 28 2022 Welcome to the rLitecoinMarkets daily discussion thread Thread topics include but are not limited to General discussion related to the days events technical analysis trading ideas strategies,Positive,0.4587
xqcqb8,litecoinmarkets,luckfy,1664371603,1664425716,1664384969,0,0,0,0,0,1,0,0,Inaccurate,0.85,27,0,0,30,0,self,https://redd.it/xqcqb8,could LTC reach 500 in the next Bull market What are your thoughts,Neutral,0.0258
xqghc5,litecoinmarkets,shark1777,1664380737,1664425716,0,0,0,0,1,0,0,0,0,,0.66,1,0,0,0,0,default,https://redd.it/xqghc5,Please join here also,Positive,0.5423
xqxp8l,litecoinmarkets,AutoModerator,1664424073,1664511732,0,0,0,0,0,0,1,0,0,,0.98,60,0,0,21,0,self,https://redd.it/xqxp8l,Daily Discussion Thursday September 29 2022 Welcome to the rLitecoinMarkets daily discussion thread Thread topics include but are not limited to General discussion related to the days events technical analysis trading ideas strategies,Positive,0.4587
xrirhk,litecoinmarkets,bordoisse,1664484965,1664598784,0,0,0,0,0,0,0,0,0,,0.63,2,0,0,0,0,default,https://redd.it/xrirhk,1k invested into the Top 10 Cryptos on January 1st 2021 UP 70 Month 20 Check How LTC Performed in August,Positive,0.2023
xrros3,litecoinmarkets,AutoModerator,1664510470,1664598785,0,0,0,0,0,0,1,0,0,,0.98,62,0,0,26,0,self,https://redd.it/xrros3,Daily Discussion Friday September 30 2022 Welcome to the rLitecoinMarkets daily discussion thread Thread topics include but are not limited to General discussion related to the days events technical analysis trading ideas strategies,Positive,0.4587
xslhhs,litecoinmarkets,AutoModerator,1664596870,1664686329,0,0,0,0,0,0,1,0,0,,0.98,49,0,0,18,0,self,https://redd.it/xslhhs,Daily Discussion Saturday October 01 2022 Welcome to the rLitecoinMarkets daily discussion thread Thread topics include but are not limited to General discussion related to the days events technical analysis trading ideas strategies,Positive,0.4587
xtevo2,litecoinmarkets,AutoModerator,1664683272,1664770276,0,0,0,0,0,0,1,0,0,,0.94,49,0,0,21,0,self,https://redd.it/xtevo2,Daily Discussion Sunday October 02 2022 Welcome to the rLitecoinMarkets daily discussion thread Thread topics include but are not limited to General discussion related to the days events technical analysis trading ideas strategies,Positive,0.4587
xu8xce,litecoinmarkets,AutoModerator,1664769668,1664857856,0,0,0,0,0,0,1,0,0,,0.96,65,0,0,21,0,self,https://redd.it/xu8xce,Daily Discussion Monday October 03 2022 Welcome to the rLitecoinMarkets daily discussion thread Thread topics include but are not limited to General discussion related to the days events technical analysis trading ideas strategies,Positive,0.4587
xuky0k,litecoinmarkets,Oswalheartage,1664807214,1664857856,0,0,0,0,1,0,1,0,0,,0.29,0,0,0,1,0,default,https://redd.it/xuky0k,Now or never,Neutral,0.0
xv4spb,litecoinmarkets,AutoModerator,1664856070,1664943550,0,0,0,0,0,0,1,0,0,,0.94,61,0,0,43,0,self,https://redd.it/xv4spb,Daily Discussion Tuesday October 04 2022 Welcome to the rLitecoinMarkets daily discussion thread Thread topics include but are not limited to General discussion related to the days events technical analysis trading ideas strategies,Positive,0.4587
xw01j5,litecoinmarkets,AutoModerator,1664942473,1665013910,0,0,0,0,0,0,1,0,0,,0.97,57,0,0,27,0,self,https://redd.it/xw01j5,Daily Discussion Wednesday October 05 2022 Welcome to the rLitecoinMarkets daily discussion thread Thread topics include but are not limited to General discussion related to the days events technical analysis trading ideas strategies,Positive,0.4587
xwpr80,litecoinmarkets,Heman-pwr-of-theunvs,1665012332,1665119539,0,0,0,0,0,0,0,0,0,,0.69,5,0,0,1,0,https://b.thumbs.redditmedia.com/6hwAt_JuvELj7FaaPySlGHhpCU14EhMNxMqnTsXoR-A.jpg,https://redd.it/xwpr80,Im Crazy Bullish after seeing this tbh,Negative,-0.34
xwtdbe,litecoinmarkets,PracticalLavishness,1665022366,1665119539,0,0,0,0,0,0,0,0,0,,0.75,4,0,0,1,0,default,https://redd.it/xwtdbe,Coins with macro double tops LTC XMR ZRX XLM etc,Positive,0.5106
xwvk79,litecoinmarkets,AutoModerator,1665028869,1665119539,0,0,0,0,0,0,1,0,0,,0.97,62,0,0,26,0,self,https://redd.it/xwvk79,Daily Discussion Thursday October 06 2022 Welcome to the rLitecoinMarkets daily discussion thread Thread topics include but are not limited to General discussion related to the days events technical analysis trading ideas strategies,Positive,0.4587
xxp2i7,litecoinmarkets,AutoModerator,1665115271,1665279967,0,0,0,0,0,0,1,0,0,,0.98,63,0,0,27,0,self,https://redd.it/xxp2i7,Daily Discussion Friday October 07 2022 Welcome to the rLitecoinMarkets daily discussion thread Thread topics include but are not limited to General discussion related to the days events technical analysis trading ideas strategies,Positive,0.4587
xyiuf2,litecoinmarkets,AutoModerator,1665201673,1665291300,0,0,0,0,0,0,1,0,0,,0.94,56,0,0,12,0,self,https://redd.it/xyiuf2,Daily Discussion Saturday October 08 2022 Welcome to the rLitecoinMarkets daily discussion thread Thread topics include but are not limited to General discussion related to the days events technical analysis trading ideas strategies,Positive,0.4587
xzbz9s,litecoinmarkets,AutoModerator,1665288069,1665379564,0,0,0,0,0,0,1,0,0,,0.98,52,0,0,20,0,self,https://redd.it/xzbz9s,Daily Discussion Sunday October 09 2022 Welcome to the rLitecoinMarkets daily discussion thread Thread topics include but are not limited to General discussion related to the days events technical analysis trading ideas strategies,Positive,0.4587
xzfehj,litecoinmarkets,bakarainvest,1665300315,1665379564,0,0,0,0,1,0,0,0,0,,0.86,5,0,0,2,0,default,https://redd.it/xzfehj,Hackers steal 570m from worlds largest crypto exchange Binance A crosschain bridge linking with its BNB Chain was targeted and attackers withdrew 2 million BNB tokens Company says almost 100 million remains unrecoverable Cryptos Cryptocurency cryptotrading,Negative,-0.7845
y04wtj,litecoinmarkets,AutoModerator,1665374470,1665460978,0,0,0,0,0,0,1,0,0,,0.97,58,0,0,21,0,self,https://redd.it/y04wtj,Daily Discussion Monday October 10 2022 Welcome to the rLitecoinMarkets daily discussion thread Thread topics include but are not limited to General discussion related to the days events technical analysis trading ideas strategies,Positive,0.4587
y0z2rf,litecoinmarkets,AutoModerator,1665460869,1665548793,0,0,0,0,0,0,1,0,0,,0.94,53,0,0,39,0,self,https://redd.it/y0z2rf,Daily Discussion Tuesday October 11 2022 Welcome to the rLitecoinMarkets daily discussion thread Thread topics include but are not limited to General discussion related to the days events technical analysis trading ideas strategies,Positive,0.4587
y1tk75,litecoinmarkets,AutoModerator,1665547272,1665634179,0,0,0,0,0,0,1,0,0,,0.95,52,0,0,35,0,self,https://redd.it/y1tk75,Daily Discussion Wednesday October 12 2022 Welcome to the rLitecoinMarkets daily discussion thread Thread topics include but are not limited to General discussion related to the days events technical analysis trading ideas strategies,Positive,0.4587
y2os4n,litecoinmarkets,AutoModerator,1665633671,1665725317,0,0,0,0,0,0,1,0,0,,0.98,53,0,0,52,0,self,https://redd.it/y2os4n,Daily Discussion Thursday October 13 2022 Welcome to the rLitecoinMarkets daily discussion thread Thread topics include but are not limited to General discussion related to the days events technical analysis trading ideas strategies,Positive,0.4587
y2x73d,litecoinmarkets,VictorOgorodnov,1665663359,1665725317,0,0,0,0,0,0,0,0,0,,0.78,10,0,0,2,0,https://a.thumbs.redditmedia.com/S9O4zx7BwYut49Q_LBbdDmsuSymvV6QqE94EOhsyN68.jpg,https://redd.it/y2x73d,Someones filled his bag on Bitfinex lately I feel like 50 jump in one day coming Hard hold pays off,Positive,0.2732
y3jf07,litecoinmarkets,AutoModerator,1665720072,1665807001,0,0,0,0,0,0,1,0,0,,1.0,57,0,0,41,0,self,https://redd.it/y3jf07,Daily Discussion Friday October 14 2022 Welcome to the rLitecoinMarkets daily discussion thread Thread topics include but are not limited to General discussion related to the days events technical analysis trading ideas strategies,Positive,0.4587
y4dywm,litecoinmarkets,AutoModerator,1665806470,1665963426,0,0,0,0,0,0,1,0,0,,0.92,43,0,0,21,0,self,https://redd.it/y4dywm,Daily Discussion Saturday October 15 2022 Welcome to the rLitecoinMarkets daily discussion thread Thread topics include but are not limited to General discussion related to the days events technical analysis trading ideas strategies,Positive,0.4587
y4g2za,litecoinmarkets,Desperate_Falcon_775,1665813646,1665963426,0,0,0,0,0,0,1,0,0,,0.86,20,0,0,28,0,self,https://redd.it/y4g2za,whats your LTC average price are you guys loading up your bags,Neutral,0.0
y572of,litecoinmarkets,AutoModerator,1665892869,1666020113,0,0,0,0,0,0,1,0,0,,0.98,47,0,0,50,0,self,https://redd.it/y572of,Daily Discussion Sunday October 16 2022 Welcome to the rLitecoinMarkets daily discussion thread Thread topics include but are not limited to General discussion related to the days events technical analysis trading ideas strategies,Positive,0.4587
y59p38,litecoinmarkets,VictorOgorodnov,1665902110,1665979952,0,0,0,0,0,0,1,0,0,,0.45,0,0,0,0,0,self,https://redd.it/y59p38,reminder 2013 x200 2017 x100 2019 x7 202021 x20,Neutral,0.0
y59tgd,litecoinmarkets,Desperate_Falcon_775,1665902570,1665979952,1665902753,0,0,0,0,0,1,0,0,,0.8,6,0,0,2,0,self,https://redd.it/y59tgd,Litecoin Summit in Vegas what to expect price wise we all know LTC is so undervalued maybe the Vegas Summit will throw some light Anyways LOVE LTC sooner or later the sleeping giant is gonna wake up Peace,Positive,0.9106
y5gio4,litecoinmarkets,contrawarp,1665925979,1665979952,0,0,0,0,0,0,1,0,0,,0.87,45,0,1,9,0,self,https://redd.it/y5gio4,Super Bullish on Litecoin Longterm The returns for Litecoin are the largest to be had if we go back up to AllTime Highs keyword if BTC is 20k if it goes to its ATH of 69k thats a 35x return ETH is 1200 if it goes to its ATH of 5000 thats a 4x return Litecoin is currently at 50 if it returns to its ATH of 450 thats a 9x on your money Litecoin is very reliable fast and has tiny fees I dont care about some random obscure coin that can 100x your money There are millions of those and only 2 or 3 will succeed However with Litecoin its right there IN YOUR FACE It has the history and the reputation Are you too good for a 9x return I see 500 on the next bull run which will likely take place within the next 35 years Im all in LTC is my biggest concentration by far BULLISH ON LITECOIN LONG TERM,Positive,0.8112
y60vel,litecoinmarkets,AutoModerator,1665979270,1666060543,0,0,0,0,0,0,1,0,0,,0.97,61,0,0,31,0,self,https://redd.it/y60vel,Daily Discussion Monday October 17 2022 Welcome to the rLitecoinMarkets daily discussion thread Thread topics include but are not limited to General discussion related to the days events technical analysis trading ideas strategies,Positive,0.4587
y6nss4,litecoinmarkets,luckfy,1666043315,1666153788,0,0,0,0,0,0,1,0,0,FUD,0.9,34,0,0,6,0,self,https://redd.it/y6nss4,Bought some LTC If the price go lower Ill buy more and HODL,Negative,-0.6124
