submission,subreddit,author,created,retrieved,edited,pinned,archived,locked,removed,deleted,is_self,is_video,is_original_content,link_flair_text,upvote_ratio,score,gilded,total_awards_received,num_comments,num_crossposts,thumbnail,shortlink,combined_text,sentiment,vader_score
va3dco,litecoinmarkets,cryptoforumposting,1654971648,1655093689,0,0,0,0,1,0,1,0,0,,1.0,1,0,0,0,0,default,https://redd.it/va3dco,CFXN Token investing is a great way,Positive,0.6249
vadtkl,litecoinmarkets,AutoModerator,1655006470,1655093689,0,0,0,0,0,0,1,0,0,,0.95,102,0,1,169,0,self,https://redd.it/vadtkl,Daily Discussion Sunday June 12 2022 Welcome to the rLitecoinMarkets daily discussion thread Thread topics include but are not limited to General discussion related to the days events technical analysis trading ideas strategies,Positive,0.4587
vb3e6t,litecoinmarkets,AutoModerator,1655092868,1655155162,0,0,0,0,0,0,1,0,0,,0.98,85,0,3,204,0,self,https://redd.it/vb3e6t,Daily Discussion Monday June 13 2022 Welcome to the rLitecoinMarkets daily discussion thread Thread topics include but are not limited to General discussion related to the days events technical analysis trading ideas strategies,Positive,0.4587
vb7jkz,litecoinmarkets,WarSpiritual9644,1655109726,1655155162,0,0,0,0,1,0,1,0,0,,1.0,1,0,0,0,0,default,https://redd.it/vb7jkz,Eyes on here everyone PrivacySwap is giving away MEGA Giveaway ALERT ON TWITTER reward of 3000 worth of Privacycards,Positive,0.873
vb7nh7,litecoinmarkets,HabileJ_6,1655110236,1655155162,0,0,0,0,0,0,0,0,0,,0.95,18,0,0,11,0,https://b.thumbs.redditmedia.com/4Nj9308eoeVkKZRFWBiOTF4uHzWIMXR4F2qzFlHqmgU.jpg,https://redd.it/vb7nh7,Binance Declines Support for Litecoin LTC MimbleWimble Extension Block MWEB Update,Negative,-0.0516
vb7sk8,litecoinmarkets,Carrot792,1655110854,1655170305,0,0,0,0,0,0,1,0,0,FUD,0.94,15,0,0,25,0,self,https://redd.it/vb7sk8,Where is the Bottom Guys what do you think is our bottom Is it 35 or even lower Will we see single digits,Negative,-0.296
vb8ll8,litecoinmarkets,Firm-Pangolin5735,1655114359,1655170305,0,0,0,0,1,0,1,0,0,,1.0,1,0,0,0,0,default,https://redd.it/vb8ll8,Earn and enjoy Pokemine and invite your friends to play this AWESOME pokemons game,Positive,0.9441
vbmb78,litecoinmarkets,CBDoctor,1655154014,1655215914,0,0,0,0,0,0,0,0,0,,0.93,46,0,0,6,0,https://b.thumbs.redditmedia.com/7u2FK0-vUe5fiGNqKQpx9xovDPkN8H0VpLHt7iIbBDA.jpg,https://redd.it/vbmb78,Litecoinmarkets,Neutral,0.0
vbrbz1,litecoinmarkets,samair8,1655168431,1655215914,0,0,0,0,0,0,0,0,0,news,0.42,0,0,0,3,0,https://b.thumbs.redditmedia.com/w4reUJUXfoKchRxzsvWpcHBhdDrEtILcNx_0grfb6CQ.jpg,https://redd.it/vbrbz1,MWEB upgrade unable to have a positive impact on LTCs performance,Positive,0.5574
vbuomj,litecoinmarkets,AutoModerator,1655179270,1655267546,0,0,0,0,0,0,1,0,0,,0.99,92,0,0,102,0,self,https://redd.it/vbuomj,Daily Discussion Tuesday June 14 2022 Welcome to the rLitecoinMarkets daily discussion thread Thread topics include but are not limited to General discussion related to the days events technical analysis trading ideas strategies,Positive,0.4587
vc4226,litecoinmarkets,Known_Rub8010,1655214966,1655267546,0,0,0,0,0,0,0,0,0,Inaccurate,0.76,19,0,0,11,0,https://a.thumbs.redditmedia.com/9k7RMZieqkWiJv0bEwh74Ed9-t62gTbQx0IlrfDteA8.jpg,https://redd.it/vc4226,About time to sell,Neutral,0.0
vclo3w,litecoinmarkets,AutoModerator,1655265669,1655354291,0,0,0,0,0,0,1,0,0,,0.99,94,0,0,158,0,self,https://redd.it/vclo3w,Daily Discussion Wednesday June 15 2022 Welcome to the rLitecoinMarkets daily discussion thread Thread topics include but are not limited to General discussion related to the days events technical analysis trading ideas strategies,Positive,0.4587
vd17i3,litecoinmarkets,NFTkida20201,1655317683,1655372275,0,0,0,0,1,0,1,0,0,FUD,1.0,1,0,0,0,0,default,https://redd.it/vd17i3,OpenSea NFT Bidding Bot,Neutral,0.0
vdd09u,litecoinmarkets,AutoModerator,1655352070,1655396717,0,0,0,0,0,0,1,0,0,,0.99,71,0,2,50,0,self,https://redd.it/vdd09u,Daily Discussion Thursday June 16 2022 Welcome to the rLitecoinMarkets daily discussion thread Thread topics include but are not limited to General discussion related to the days events technical analysis trading ideas strategies,Positive,0.4587
vdet9b,litecoinmarkets,Parking_Apricot2,1655358552,1655426477,0,0,0,0,1,0,0,0,0,,1.0,1,0,0,0,0,default,https://redd.it/vdet9b,Litecoin LTC Price Analysis Crucial Juncture At 50,Neutral,0.0
vdhfbo,litecoinmarkets,calypsoangelica34,1655369405,1655426477,0,0,0,0,1,0,1,0,0,,1.0,1,0,0,0,0,default,https://redd.it/vdhfbo,79city Play Here Win Here Welcome to the Global Blockchain FREE 3 Spin Everyday Lottery Platform Make ur deposit QUICK and SIMPLE REGISTER IT NOW 79city,Positive,0.9222
vdpit8,litecoinmarkets,Domie109,1655395880,1655516442,0,0,0,0,0,0,1,0,0,Convo,0.82,25,0,0,7,0,self,https://redd.it/vdpit8,Now is a perfect opportunity for those that are not in Everyone thats been hesitant needs to act if they have the means If you have the funds available try to reach 84 LTC Hodl Strong,Positive,0.836
vdzm6e,litecoinmarkets,PracticalLavishness,1655424073,1655516442,0,0,0,0,0,0,1,0,0,,0.9,8,0,0,6,0,self,https://redd.it/vdzm6e,What would it take for the LTCN fund to go bankrupt Im interested in adding LTCN to my Roth IRA at some point LTCN is currently a 70M fund and its down 80 since inception I see a lot of value in getting in during this bear cycle At the same time how safe are these smaller grayscale funds when prices collapse If LTCN were to trade under one dollar for instance,Positive,0.0516
ve0aa5,litecoinmarkets,WarSpiritual9644,1655426184,1655516442,0,0,0,0,1,0,1,0,0,,1.0,1,0,0,0,0,default,https://redd.it/ve0aa5,Stoked to announce our partnership with wateenswap,Neutral,0.0
ve0si9,litecoinmarkets,paradisemorlam,1655427810,1655516441,0,0,0,0,0,0,0,0,0,,0.67,1,0,0,7,0,default,https://redd.it/ve0si9,Bitkub Notice of Litecoin LTC Delisting on 23062022 at 0600 PM GMT7,Neutral,0.0
ve3bti,litecoinmarkets,Firm-Pangolin5735,1655435901,1655516442,0,0,0,0,1,0,1,0,0,,1.0,1,0,0,0,0,default,https://redd.it/ve3bti,Enjoy this awesome card battling game in Pokemine and together we explore and unlock this exciting adventure,Positive,0.9052
ve447v,litecoinmarkets,AutoModerator,1655438469,1655516441,0,0,0,0,0,0,1,0,0,,0.98,84,0,0,72,0,self,https://redd.it/ve447v,Daily Discussion Friday June 17 2022 Welcome to the rLitecoinMarkets daily discussion thread Thread topics include but are not limited to General discussion related to the days events technical analysis trading ideas strategies,Positive,0.4587
vev0si,litecoinmarkets,John_Sknow,1655514893,1655609221,0,0,0,0,0,0,0,0,0,,0.95,16,0,0,22,0,https://b.thumbs.redditmedia.com/DLYfyYw7U8YKr4EvmJPuAlsn1RwBYD7CZcU8Vf5GO3Q.jpg,https://redd.it/vev0si,Big spike in Longs Is this good or bad for price Will the whales tank the price to liquidate them or are these the whales longing and the price will go up Your thoughts,Negative,-0.058
vevzwi,litecoinmarkets,Skank_cunt_42,1655518307,1655609220,0,0,0,0,0,0,1,0,0,,0.92,10,0,0,19,0,self,https://redd.it/vevzwi,Hypothetically speaking If BTC were to fall to the absolute bear case of 12k where do you think LTC would fall to,Neutral,0.0
vexuq3,litecoinmarkets,AutoModerator,1655524870,1655609221,0,0,0,0,0,0,1,0,0,,0.96,78,0,0,133,0,self,https://redd.it/vexuq3,Daily Discussion Saturday June 18 2022 Welcome to the rLitecoinMarkets daily discussion thread Thread topics include but are not limited to General discussion related to the days events technical analysis trading ideas strategies,Positive,0.4587
vflx0e,litecoinmarkets,Empire_Union,1655608101,1655686373,0,0,0,0,0,0,1,0,0,,1.0,10,0,0,2,0,self,https://redd.it/vflx0e,Only around 170000 Wallets have more then 10 LTC Are these stats accurate,Neutral,0.0
vfmsbg,litecoinmarkets,AutoModerator,1655611270,1655686372,0,0,0,0,0,0,1,0,0,,0.99,105,0,1,118,0,self,https://redd.it/vfmsbg,Daily Discussion Sunday June 19 2022 Welcome to the rLitecoinMarkets daily discussion thread Thread topics include but are not limited to General discussion related to the days events technical analysis trading ideas strategies,Positive,0.4587
vfreqh,litecoinmarkets,cozystgrvozy32,1655630698,1655686373,0,0,0,0,1,0,1,0,0,,1.0,1,0,0,0,0,default,https://redd.it/vfreqh,79city Play Here Win Here Welcome to the Global Blockchain FREE 3 Spin Everyday Lottery Platform Make ur deposit QUICK and SIMPLE REGISTER IT NOW 79city,Positive,0.9222
vfud35,litecoinmarkets,Ok_Acanthisitta_2843,1655642533,1655686373,0,0,0,0,0,0,0,0,0,trading,0.81,23,0,0,13,0,https://a.thumbs.redditmedia.com/v0K5Enfi8vfnuk4OToYTviDftcep5UYXwAtU7PB6-T0.jpg,https://redd.it/vfud35,LTC on a surge,Neutral,0.0
vg90y9,litecoinmarkets,TCr0wn,1655686139,1655735468,0,0,0,0,0,0,0,0,0,,0.93,11,0,0,0,2,https://b.thumbs.redditmedia.com/9RF7gYA_ohpZ13QTI3Kh_rkaqEEdKcaYCKNSW1jHKGE.jpg,https://redd.it/vg90y9,LITECOIN ADA flexing in the blood,Neutral,0.0
vgcg8m,litecoinmarkets,AutoModerator,1655697671,1655748283,0,0,0,0,0,0,1,0,0,,0.98,87,0,1,43,0,self,https://redd.it/vgcg8m,Daily Discussion Monday June 20 2022 Welcome to the rLitecoinMarkets daily discussion thread Thread topics include but are not limited to General discussion related to the days events technical analysis trading ideas strategies,Positive,0.4587
vgg7sx,litecoinmarkets,Firm-Pangolin5735,1655712041,1655782742,0,0,0,0,1,0,1,0,0,,1.0,1,0,0,0,0,default,https://redd.it/vgg7sx,Enjoy this awesome card battling game in Pokemine and together we explore and unlock this exciting adventure,Positive,0.9052
vghnvv,litecoinmarkets,CBDoctor,1655718158,1655782742,0,0,0,0,0,0,0,0,0,,0.82,34,0,0,17,0,https://b.thumbs.redditmedia.com/Yev7Fvz7AR6gQCI75_f9QvQocd7XD7CsrB3BogbF2pw.jpg,https://redd.it/vghnvv,Litecoinmarkets,Neutral,0.0
vgibsr,litecoinmarkets,Zestyclose-Parsnip40,1655720868,1655782742,0,0,0,0,1,0,1,0,0,,1.0,1,0,0,0,0,default,https://redd.it/vgibsr,Welcome to the FREEPUP CASINO FREE 3 Spin Everyday Cryptocurency Slot Platform Registration Reward Daily Signin Reward Refer Reward,Positive,0.9592
vgmlly,litecoinmarkets,letsexchange_io,1655734805,1655782742,0,0,0,0,0,0,0,0,0,Comparison,0.78,5,0,0,5,0,https://b.thumbs.redditmedia.com/JcvRdWbb2XGZzPb8IEIVzHJ6uEWJxvgmfoCHyULU96E.jpg,https://redd.it/vgmlly,Litecoin vs Ethereum In Which to Invest in 2022,Neutral,0.0
vgqqph,litecoinmarkets,libretumente,1655745748,1655872292,0,0,0,0,0,0,0,0,0,,0.86,10,0,0,1,0,default,https://redd.it/vgqqph,When the Chikuns are hungry,Neutral,0.0
vh309i,litecoinmarkets,John_Sknow,1655780111,1655872293,0,0,0,0,0,0,0,0,0,,0.78,5,0,0,9,0,https://b.thumbs.redditmedia.com/aBH5LCIn3nqndKsLIpWVecho8hFvz1cIYJ2twkUSPjc.jpg,https://redd.it/vh309i,Its been ranging in 1 to 2 dollars in this range the whole day I want to say its a strong signal that it will break to the up side but who knows I could have trading at this range and made a killing but kept thinking this time its going to dump further smh,Negative,-0.9032
vh48m5,litecoinmarkets,AutoModerator,1655784070,1655872292,0,0,0,0,0,0,1,0,0,,0.98,94,0,0,57,0,self,https://redd.it/vh48m5,Daily Discussion Tuesday June 21 2022 Welcome to the rLitecoinMarkets daily discussion thread Thread topics include but are not limited to General discussion related to the days events technical analysis trading ideas strategies,Positive,0.4587
vh86md,litecoinmarkets,Firm-Pangolin5735,1655799019,1655872293,0,0,0,0,1,0,1,0,0,,1.0,1,0,0,0,0,default,https://redd.it/vh86md,Have fun and play this card battling game in Pokemine and together we explore and unlock this exciting adventure,Positive,0.8641
vhvyws,litecoinmarkets,AutoModerator,1655870469,1655958419,0,0,0,0,0,0,1,0,0,,0.97,80,0,0,71,0,self,https://redd.it/vhvyws,Daily Discussion Wednesday June 22 2022 Welcome to the rLitecoinMarkets daily discussion thread Thread topics include but are not limited to General discussion related to the days events technical analysis trading ideas strategies,Positive,0.4587
vhy0hg,litecoinmarkets,WarSpiritual9644,1655877680,1655958419,0,0,0,0,1,0,1,0,0,,1.0,1,0,0,0,0,default,https://redd.it/vhy0hg,Why launch your token with PrivacySwap,Neutral,0.0
vi10qu,litecoinmarkets,Firm-Pangolin5735,1655889618,1655958419,0,0,0,0,1,0,1,0,0,,1.0,1,0,0,0,0,default,https://redd.it/vi10qu,Hello PokemineGo trainers im inviting you all to defeat the evil bosses every 900 PM to 930 PM daily,Negative,-0.7269
vi28f2,litecoinmarkets,vagabondare,1655894438,1655958419,0,0,0,0,0,0,0,0,0,,0.56,1,0,0,1,0,https://a.thumbs.redditmedia.com/3QeD5U6NwC57XxrSui-FRAnF3CKafK2kQ57W2v41-F8.jpg,https://redd.it/vi28f2,he calls yesterdays pump the westwood pum which I think is not the case but its nice to see people getting pumped for ltc as they should,Positive,0.5719
vi4g4n,litecoinmarkets,Ready-Pack-4377,1655901973,1655958419,0,0,0,0,0,0,1,0,0,,0.93,68,0,5,39,0,self,https://redd.it/vi4g4n,Just put half my savings into litecoin 5000 or about 100 coinRisky play or possible we could see 200300 coin in the next year or 2 Ive been watching litecoin for a while and missed the boat in November of 2020 around the 70 mark then it exploded to 150 Didnt wanna make the same mistake,Negative,-0.296
vinghb,litecoinmarkets,WarSpiritual9644,1655955544,1656030646,0,0,0,0,1,0,1,0,0,,1.0,1,0,0,0,0,default,https://redd.it/vinghb,MEGA Giveaway ALERT ON TWITTER,Positive,0.4466
vinv3g,litecoinmarkets,AutoModerator,1655956870,1656030645,0,0,0,0,0,0,1,0,0,,0.99,76,0,1,72,0,self,https://redd.it/vinv3g,Daily Discussion Thursday June 23 2022 Welcome to the rLitecoinMarkets daily discussion thread Thread topics include but are not limited to General discussion related to the days events technical analysis trading ideas strategies,Positive,0.4587
viod7g,litecoinmarkets,tomylin,1655958567,1656030646,0,0,0,0,0,0,0,0,0,,1.0,19,0,0,8,0,https://b.thumbs.redditmedia.com/rt9hUnmCUhAKTWTFjRxardLmMHrjbKxy2MDOCfVYfbY.jpg,https://redd.it/viod7g,Price Prediction Crypto Litecoin LTCUSDT 22062022 What you think,Neutral,0.0
vivmgt,litecoinmarkets,Ok_Needleworker919,1655986809,1656035221,0,0,0,0,1,0,0,0,0,,1.0,1,0,0,0,0,default,https://redd.it/vivmgt,Do Kwon Says Hes No Fraudster and Has Great Confidence in Terra 20,Positive,0.4019
vjazdg,litecoinmarkets,Domie109,1656029310,1656131186,0,0,0,0,0,0,1,0,0,,0.89,13,0,0,18,0,self,https://redd.it/vjazdg,To become a whale how many coins should you strive to attain,Neutral,0.0
vjcuaq,litecoinmarkets,WarSpiritual9644,1656035130,1656131187,0,0,0,0,1,0,1,0,0,,1.0,1,0,0,0,0,default,https://redd.it/vjcuaq,MEGA Giveaway ALERT ON TWITTER,Positive,0.4466
vjfcve,litecoinmarkets,AutoModerator,1656043269,1656131187,0,0,0,0,0,0,1,0,0,,0.96,72,0,0,57,0,self,https://redd.it/vjfcve,Daily Discussion Friday June 24 2022 Welcome to the rLitecoinMarkets daily discussion thread Thread topics include but are not limited to General discussion related to the days events technical analysis trading ideas strategies,Positive,0.4587
vjgrgq,litecoinmarkets,John_Sknow,1656048043,1656131187,0,0,0,0,0,0,1,0,0,,0.43,0,0,0,1,0,https://b.thumbs.redditmedia.com/-AUvporck3ffGQKHRjwFQh25nokf_5Bc7kI1zwZMHmM.jpg,https://redd.it/vjgrgq,Possible Wycoff Distribution pattern and path prediction If true we wont drop lower than that bottom 50ish and then bounce back up around 5556 before heading down to test the recen low of 40xx Its possible 57xx isnt the top but maybe a little closer to 60 Not financial advice Just fun TA x200B,Positive,0.7472
vjmyfk,litecoinmarkets,Particular-Fish6830,1656072516,1656131187,0,0,0,0,1,0,1,0,0,,1.0,1,0,0,0,0,default,https://redd.it/vjmyfk,Earn by sharing your DeFi Yield farming strategies with your followers,Positive,0.4215
vk6dcq,litecoinmarkets,AutoModerator,1656129670,1656217317,0,0,0,0,0,0,1,0,0,,0.99,84,0,0,170,0,self,https://redd.it/vk6dcq,Daily Discussion Saturday June 25 2022 Welcome to the rLitecoinMarkets daily discussion thread Thread topics include but are not limited to General discussion related to the days events technical analysis trading ideas strategies,Positive,0.4587
vk9p17,litecoinmarkets,Khanshahe,1656142370,1656217318,0,0,0,0,1,0,0,0,0,,1.0,1,0,0,0,0,default,https://redd.it/vk9p17,how to start affiliate marketing what is affiliate marketing,Neutral,0.0
vkjef5,litecoinmarkets,pintunft,1656176500,1656292105,0,0,0,0,1,0,1,0,0,Inaccurate,1.0,1,0,0,0,0,default,https://redd.it/vkjef5,NFTuloan is a DeFi protocol tailored for NFT that gives you access to instant flash loans using your NFT as collateral,Neutral,0.0
vkw2al,litecoinmarkets,AutoModerator,1656216069,1656302671,0,0,0,0,0,0,1,0,0,,0.99,77,0,0,56,0,self,https://redd.it/vkw2al,Daily Discussion Sunday June 26 2022 Welcome to the rLitecoinMarkets daily discussion thread Thread topics include but are not limited to General discussion related to the days events technical analysis trading ideas strategies,Positive,0.4587
vli0gj,litecoinmarkets,WarSpiritual9644,1656288172,1656374751,0,0,0,0,1,0,1,0,0,,1.0,1,0,0,0,0,default,https://redd.it/vli0gj,MEGA Giveaway ALERT ON TWITTER,Positive,0.4466
vlmhnj,litecoinmarkets,AutoModerator,1656302470,1656390245,0,0,0,0,0,0,1,0,0,,0.97,82,0,1,92,0,self,https://redd.it/vlmhnj,Daily Discussion Monday June 27 2022 Welcome to the rLitecoinMarkets daily discussion thread Thread topics include but are not limited to General discussion related to the days events technical analysis trading ideas strategies,Positive,0.4587
vm7lbi,litecoinmarkets,hipvox,1656369738,1656463540,0,0,0,0,1,0,1,0,0,Donation,1.0,1,0,0,0,0,default,https://redd.it/vm7lbi,guys i live in third world country i want 10 in ltc and i want to store it until 2030,Positive,0.1531
vmaoud,litecoinmarkets,Firm-Pangolin5735,1656378800,1656463540,0,0,0,0,1,0,1,0,0,,1.0,1,0,0,0,0,default,https://redd.it/vmaoud,Dear Pokeminers trainers we are happy to invite you all to defeat the evil bosses every 900 PM to 930 PM daily to save the DEME universe from the wicked plot,Negative,-0.1779
vmdwxd,litecoinmarkets,AutoModerator,1656388871,1656475644,0,0,0,0,0,0,1,0,0,,0.94,71,0,0,110,0,self,https://redd.it/vmdwxd,Daily Discussion Tuesday June 28 2022 Welcome to the rLitecoinMarkets daily discussion thread Thread topics include but are not limited to General discussion related to the days events technical analysis trading ideas strategies,Positive,0.4587
vmeeql,litecoinmarkets,Odd_Purple8866,1656390527,1656475644,0,0,0,0,0,0,0,0,0,,0.79,11,0,0,0,0,https://b.thumbs.redditmedia.com/m3RyPZeYruT1mV1c2Wcrzbz3g5uCqmSVZLKqsuMLrQE.jpg,https://redd.it/vmeeql,What is Litecoin and how does it work A Beginners Guide,Neutral,0.0
vn1bw0,litecoinmarkets,WarSpiritual9644,1656459860,1656528562,0,0,0,0,1,0,1,0,0,,1.0,1,0,0,0,0,default,https://redd.it/vn1bw0,PrivacySwap is the only crypto project that utilizes foreign banks to process and make the PrivacyCards work like magic,Positive,0.3612
vn6f4s,litecoinmarkets,AutoModerator,1656475271,1656528562,0,0,0,0,0,0,1,0,0,,1.0,74,0,0,61,0,self,https://redd.it/vn6f4s,Daily Discussion Wednesday June 29 2022 Welcome to the rLitecoinMarkets daily discussion thread Thread topics include but are not limited to General discussion related to the days events technical analysis trading ideas strategies,Positive,0.4587
vnmcmz,litecoinmarkets,No-Blackberry5877,1656526562,1656650738,0,0,0,0,0,0,0,0,0,,0.86,10,0,0,4,0,spoiler,https://redd.it/vnmcmz,LTC ATM,Neutral,0.0
vntw37,litecoinmarkets,WarSpiritual9644,1656546353,1656641815,0,0,0,0,1,0,1,0,0,,1.0,1,0,0,0,0,default,https://redd.it/vntw37,When you crossfarm with PrivacySwap,Neutral,0.0
vnvgvn,litecoinmarkets,Firm-Pangolin5735,1656551006,1656641815,0,0,0,0,1,0,1,0,0,,1.0,1,0,0,0,0,default,https://redd.it/vnvgvn,Happy Thursday enjoy and play the pokemine game and earn rewards by downloading the app,Positive,0.9081
vnyz7n,litecoinmarkets,AutoModerator,1656561669,1656650738,0,0,0,0,0,0,1,0,0,,0.99,80,0,1,109,0,self,https://redd.it/vnyz7n,Daily Discussion Thursday June 30 2022 Welcome to the rLitecoinMarkets daily discussion thread Thread topics include but are not limited to General discussion related to the days events technical analysis trading ideas strategies,Positive,0.4587
voodqt,litecoinmarkets,WarSpiritual9644,1656638629,1656716587,0,0,0,0,1,0,1,0,0,,1.0,1,0,0,0,0,default,https://redd.it/voodqt,    ,Neutral,0.0
vopste,litecoinmarkets,Zestyclose-Parsnip40,1656642897,1656716587,0,0,0,0,1,0,1,0,0,,1.0,1,0,0,0,0,default,https://redd.it/vopste,79city Play Here Win Here Welcome to the Global Blockchain FREE 3 Spin Everyday Lottery Platform Make ur deposit QUICK and SIMPLE REGISTER IT NOW,Positive,0.9222
vorgeu,litecoinmarkets,AutoModerator,1656648071,1656735248,0,0,0,0,0,0,1,0,0,,0.99,78,0,0,60,0,self,https://redd.it/vorgeu,Daily Discussion Friday July 01 2022 Welcome to the rLitecoinMarkets daily discussion thread Thread topics include but are not limited to General discussion related to the days events technical analysis trading ideas strategies,Positive,0.4587
vpbnm5,litecoinmarkets,SuperLeroy,1656711297,1656822494,0,0,0,0,1,0,1,0,0,,1.0,1,0,0,0,0,default,https://redd.it/vpbnm5,LTC Market Cap now greater than BCH and BSV caps combined,Positive,0.3612
vpj0yj,litecoinmarkets,AutoModerator,1656734471,1656822494,0,0,0,0,0,0,1,0,0,,0.98,76,0,0,53,0,self,https://redd.it/vpj0yj,Daily Discussion Saturday July 02 2022 Welcome to the rLitecoinMarkets daily discussion thread Thread topics include but are not limited to General discussion related to the days events technical analysis trading ideas strategies,Positive,0.4587
vq8vec,litecoinmarkets,AutoModerator,1656820868,1656906085,0,0,0,0,0,0,1,0,0,,1.0,67,0,0,55,0,self,https://redd.it/vq8vec,Daily Discussion Sunday July 03 2022 Welcome to the rLitecoinMarkets daily discussion thread Thread topics include but are not limited to General discussion related to the days events technical analysis trading ideas strategies,Positive,0.4587
vqr4qx,litecoinmarkets,EricjIvers,1656882493,1656928443,0,0,0,0,1,0,1,0,0,,1.0,1,0,0,0,0,default,https://redd.it/vqr4qx,Ways to recover lost coin,Negative,-0.3182
vquj0a,litecoinmarkets,WarSpiritual9644,1656892991,1656967462,0,0,0,0,1,0,1,0,0,,1.0,1,0,0,0,0,default,https://redd.it/vquj0a,PrivacySwaps card loading platform is almost here,Neutral,0.0
vqxnp0,litecoinmarkets,No-Blackberry5877,1656903640,1656967462,0,0,0,0,0,0,0,0,0,,0.5,0,0,0,4,0,https://b.thumbs.redditmedia.com/IyCm77hjas6eipsv36VWDaGKeQA4gRQcm0KhbaetWaY.jpg,https://redd.it/vqxnp0,LTCAuctions dry bones are rattling Lord thank goodness,Positive,0.6705
vqyf8y,litecoinmarkets,No-Blackberry5877,1656906401,1656967461,0,0,0,0,1,0,0,0,0,,0.75,2,0,0,2,0,default,https://redd.it/vqyf8y,Beta Release soon,Neutral,0.0
vqyo89,litecoinmarkets,AutoModerator,1656907271,1656967461,0,0,0,0,0,0,1,0,0,,0.99,70,0,0,19,0,self,https://redd.it/vqyo89,Daily Discussion Monday July 04 2022 Welcome to the rLitecoinMarkets daily discussion thread Thread topics include but are not limited to General discussion related to the days events technical analysis trading ideas strategies,Positive,0.4587
vqzimj,litecoinmarkets,No-Blackberry5877,1656910397,1656967462,0,0,0,0,0,0,0,0,0,,0.56,1,0,0,1,0,https://b.thumbs.redditmedia.com/JQaY5C7GmjhDI9rIk-6WlPxkdxJfUNXIUfWiPIJl9vs.jpg,https://redd.it/vqzimj,User Control Panel ltca,Neutral,0.0
vr0luc,litecoinmarkets,No-Blackberry5877,1656914519,1656967462,0,0,0,0,0,0,0,0,0,,0.67,3,0,0,1,0,https://a.thumbs.redditmedia.com/yypjABSvSoQ1h6F-tl8M0trip-j-L4jCNhnqn0XVGc4.jpg,https://redd.it/vr0luc,LTCA API services clearly a milestone goal,Positive,0.4019
vr2p7l,litecoinmarkets,Royal-Ad-9815,1656923416,1656977306,0,0,0,0,1,0,1,0,0,,1.0,1,0,0,0,0,default,https://redd.it/vr2p7l,guowengui,Neutral,0.0
vr2prn,litecoinmarkets,Royal-Ad-9815,1656923483,1656977306,0,0,0,0,1,0,0,0,0,,1.0,1,0,0,0,0,default,https://redd.it/vr2prn,guo,Neutral,0.0
vr2ran,litecoinmarkets,Royal-Ad-9815,1656923670,1656977306,0,0,0,0,1,0,1,0,0,,1.0,1,0,0,0,0,default,https://redd.it/vr2ran,GTV10,Neutral,0.0
vr2s8a,litecoinmarkets,Royal-Ad-9815,1656923786,1656977306,0,0,0,0,1,0,1,0,0,,1.0,1,0,0,0,0,default,https://redd.it/vr2s8a,guo,Neutral,0.0
vr2t16,litecoinmarkets,Royal-Ad-9815,1656923888,1656977306,0,0,0,0,1,0,1,0,0,,1.0,1,0,0,0,0,default,https://redd.it/vr2t16,,Neutral,0.0
vr2tim,litecoinmarkets,Royal-Ad-9815,1656923952,1656977306,0,0,0,0,1,0,1,0,0,,1.0,1,0,0,0,0,default,https://redd.it/vr2tim,,Neutral,0.0
vr2tyh,litecoinmarkets,Royal-Ad-9815,1656924009,1656977306,0,0,0,0,1,0,1,0,0,,1.0,1,0,0,0,0,default,https://redd.it/vr2tyh,,Neutral,0.0
vr2utu,litecoinmarkets,Royal-Ad-9815,1656924118,1656977306,0,0,0,0,1,0,1,0,0,,1.0,1,0,0,0,0,default,https://redd.it/vr2utu, ,Neutral,0.0
vr2vcd,litecoinmarkets,Royal-Ad-9815,1656924186,1656977306,0,0,0,0,1,0,1,0,0,,1.0,1,0,0,0,0,default,https://redd.it/vr2vcd,,Neutral,0.0
vr2vqz,litecoinmarkets,Royal-Ad-9815,1656924236,1656977306,0,0,0,0,1,0,1,0,0,,1.0,1,0,0,0,0,default,https://redd.it/vr2vqz,,Neutral,0.0
vr2w62,litecoinmarkets,Royal-Ad-9815,1656924290,1656977306,0,0,0,0,1,0,1,0,0,,1.0,1,0,0,0,0,default,https://redd.it/vr2w62,,Neutral,0.0
vr2x3v,litecoinmarkets,Royal-Ad-9815,1656924407,1656977306,0,0,0,0,1,0,1,0,0,,1.0,1,0,0,0,0,default,https://redd.it/vr2x3v,,Neutral,0.0
vr2y6g,litecoinmarkets,Royal-Ad-9815,1656924541,1656977306,0,0,0,0,1,0,1,0,0,,1.0,1,0,0,0,0,default,https://redd.it/vr2y6g, ,Neutral,0.0
vr2yl4,litecoinmarkets,Royal-Ad-9815,1656924593,1656977306,0,0,0,0,1,0,1,0,0,,1.0,1,0,0,0,0,default,https://redd.it/vr2yl4,,Neutral,0.0
vr2z38,litecoinmarkets,Royal-Ad-9815,1656924653,1656977306,0,0,0,0,1,0,1,0,0,,1.0,1,0,0,0,0,default,https://redd.it/vr2z38,,Neutral,0.0
vr2zip,litecoinmarkets,Royal-Ad-9815,1656924699,1656977306,0,0,0,0,1,0,1,0,0,,1.0,1,0,0,0,0,default,https://redd.it/vr2zip,,Neutral,0.0
vr2zz3,litecoinmarkets,Royal-Ad-9815,1656924754,1656977306,0,0,0,0,1,0,1,0,0,,1.0,1,0,0,0,0,default,https://redd.it/vr2zz3,,Neutral,0.0
vr30ww,litecoinmarkets,Royal-Ad-9815,1656924865,1656977306,0,0,0,0,1,0,1,0,0,,1.0,1,0,0,0,0,default,https://redd.it/vr30ww,,Neutral,0.0
