submission,subreddit,author,created,retrieved,edited,pinned,archived,locked,removed,deleted,is_self,is_video,is_original_content,link_flair_text,upvote_ratio,score,gilded,total_awards_received,num_comments,num_crossposts,thumbnail,shortlink,combined_text,sentiment,vader_score
rtbzb6,litecoinmarkets,AutoModerator,1641013271,1641221288,0,0,0,0,0,0,1,0,0,,0.99,92,0,0,96,0,self,https://redd.it/rtbzb6,Daily Discussion Saturday January 01 2022 Welcome to the rLitecoinMarkets daily discussion thread Thread topics include but are not limited to General discussion related to the days events technical analysis trading ideas strategies,Positive,0.4587
rtvqw5,litecoinmarkets,allspoetry,1641080156,1641221288,0,0,0,0,0,0,1,0,0,,0.88,12,0,0,19,0,https://a.thumbs.redditmedia.com/f0rzr8CoN4mDIDiSbd4FFBb8-K4JlqjI4G0cZo4ADt8.jpg,https://redd.it/rtvqw5,Litecoin banner update for main sub Been hearing some requests for an update of the banner in the main litecoin sub so Ive tried to tweak it Which one do you prefer Option 1 above new one Option 2 below current one If people like option 1 Ill send a message to the mods and see if they can update it View Poll,Negative,-0.0772
ru23u6,litecoinmarkets,AutoModerator,1641099675,1641221288,0,0,0,0,0,0,1,0,0,,1.0,98,0,1,66,0,self,https://redd.it/ru23u6,Daily Discussion Sunday January 02 2022 Welcome to the rLitecoinMarkets daily discussion thread Thread topics include but are not limited to General discussion related to the days events technical analysis trading ideas strategies,Positive,0.4587
ru73iq,litecoinmarkets,allspoetry,1641119629,1641221288,0,0,0,0,0,0,0,0,0,,0.95,41,0,0,84,0,https://b.thumbs.redditmedia.com/aHKG5df5bsd794D_J1463vzDx42FETOyzgtJwldAvhU.jpg,https://redd.it/ru73iq,Banner continued options please reply which one you prefer 9 in total,Positive,0.3182
ruls1g,litecoinmarkets,Critical_Leather_703,1641163861,1641241548,0,0,0,0,1,0,0,0,0,,0.17,0,0,0,0,0,default,https://redd.it/ruls1g,Trading Signal Bitcoin 0745 0201,Neutral,0.0
rutj9h,litecoinmarkets,AutoModerator,1641186074,1641241548,0,0,0,0,0,0,1,0,0,,0.99,84,0,0,59,0,self,https://redd.it/rutj9h,Daily Discussion Monday January 03 2022 Welcome to the rLitecoinMarkets daily discussion thread Thread topics include but are not limited to General discussion related to the days events technical analysis trading ideas strategies,Positive,0.4587
rvb2je,litecoinmarkets,allspoetry,1641241455,1641289189,0,0,0,0,0,0,1,0,0,,1.0,15,0,0,11,0,https://b.thumbs.redditmedia.com/BFs_haCDLduD7-TyI45nNjk-lCp-YviUu6AwF71Fgik.jpg,https://redd.it/rvb2je,Final banner poll logo adjusted according to ltc guidelines number 2 and 3 contain an offbrand royal blue colour Havent heard anything from the mods yet but someone pointed out we should follow the official logo guidelines so I adjusted accordingly Number 2 and 3 contain an offbrand royal blue colour and I decided to include them since thats the colour from the poll winner Which option do you prefer View Poll,Positive,0.8018
rvjf7i,litecoinmarkets,VictorOgorodnov,1641264087,1641308865,0,0,0,0,1,0,1,0,0,,1.0,1,0,0,0,0,default,https://redd.it/rvjf7i,Litecoin 100X prospect,Positive,0.296
rvm64f,litecoinmarkets,AutoModerator,1641272473,1641359196,0,0,0,0,0,0,1,0,0,,0.98,111,0,0,93,0,self,https://redd.it/rvm64f,Daily Discussion Tuesday January 04 2022 Welcome to the rLitecoinMarkets daily discussion thread Thread topics include but are not limited to General discussion related to the days events technical analysis trading ideas strategies,Positive,0.4587
rvq4py,litecoinmarkets,TRAcademy,1641287240,1641359195,0,0,0,0,0,0,0,0,0,,1.0,1,0,0,1,0,https://b.thumbs.redditmedia.com/MpDiX-uIG7JD37JcGcVpL3AQRiRjuQ5tluQhYSLDAAo.jpg,https://redd.it/rvq4py,Litecoin Technical Analysis for January 4 2022 LTC,Neutral,0.0
rvqkn0,litecoinmarkets,[deleted],1641289146,1641359196,0,0,0,0,1,0,1,0,0,,0.5,0,0,0,1,0,default,https://redd.it/rvqkn0,Cryptocom Visa Debit card 25 instant bonus free Spotify and 2 cashback on all purchases,Positive,0.7783
rvw7rr,litecoinmarkets,Critical_Leather_703,1641308177,1641359196,0,0,0,0,1,0,0,0,0,,1.0,1,0,0,0,0,default,https://redd.it/rvw7rr,Trading Signal Japan225 0055 0301,Neutral,0.0
rw0zfp,litecoinmarkets,kabrinjohn,1641320515,1641377204,0,0,0,0,1,0,0,0,0,,0.25,0,0,0,1,0,default,https://redd.it/rw0zfp,Check out jumbo ticket today,Neutral,0.0
rweoxq,litecoinmarkets,AutoModerator,1641358874,1641419296,0,0,0,0,0,0,1,0,0,,0.98,93,0,1,102,0,self,https://redd.it/rweoxq,Daily Discussion Wednesday January 05 2022 Welcome to the rLitecoinMarkets daily discussion thread Thread topics include but are not limited to General discussion related to the days events technical analysis trading ideas strategies,Positive,0.4587
rwjgr0,litecoinmarkets,TRAcademy,1641377062,1641425919,0,0,0,0,0,0,0,0,0,,1.0,5,0,0,1,0,default,https://redd.it/rwjgr0,Litecoin Technical Analysis for January 5 2022 LTC,Neutral,0.0
rwr87r,litecoinmarkets,Joe59,1641401335,1641445603,1641409980,0,0,0,1,0,1,0,0,,1.0,2,0,0,3,0,default,https://redd.it/rwr87r,Gemini Earn LTC rates,Neutral,0.0
rwslsk,litecoinmarkets,AudreyForReal,1641404990,1641453365,0,0,0,0,1,0,1,0,0,Inaccurate,1.0,1,0,0,0,0,default,https://redd.it/rwslsk,NFT Music Stream,Neutral,0.0
rwxe74,litecoinmarkets,cryptomir,1641418425,1641476427,0,0,0,0,0,0,0,0,0,,0.67,6,0,0,6,0,https://b.thumbs.redditmedia.com/EdfoBPQfi_Sjpc7dBZxrL-TINN2ugx5Joz-w1exDIYI.jpg,https://redd.it/rwxe74,LTC Rectangle Pattern Confirmed This Is What That Means for Litecoin,Neutral,0.0
rx06lf,litecoinmarkets,CreepingPawn,1641425814,1641476427,0,0,0,0,0,0,1,0,0,,0.89,13,0,0,9,0,self,https://redd.it/rx06lf,Volume increases 64 buy 36 sell price declines Whats going on with Litecoin,Neutral,0.0
rx65bu,litecoinmarkets,AutoModerator,1641445270,1641520588,0,0,0,0,0,0,1,0,0,,1.0,95,0,1,130,0,self,https://redd.it/rx65bu,Daily Discussion Thursday January 06 2022 Welcome to the rLitecoinMarkets daily discussion thread Thread topics include but are not limited to General discussion related to the days events technical analysis trading ideas strategies,Positive,0.4587
rx8gn5,litecoinmarkets,TRAcademy,1641453223,1641520588,0,0,0,0,0,0,0,0,0,,1.0,2,0,0,4,0,default,https://redd.it/rx8gn5,Litecoin Technical Analysis for January 6 2022 LTC,Neutral,0.0
rxessg,litecoinmarkets,AdaptiveStrike1,1641476290,1641520588,0,0,0,0,1,0,0,0,0,,0.5,0,0,0,1,0,default,https://redd.it/rxessg,Its heartbreaking to see an industry overrun,Negative,-0.4588
rxgydi,litecoinmarkets,[deleted],1641482292,1641532048,0,0,0,0,1,1,0,0,0,,1.0,1,0,0,0,0,default,https://redd.it/rxgydi,LegendsofMitra IDOs are almost there it will be on Redkite OxBull and GameFi Whitelisting and Gleam competition at Redkite and GameFi are now ongoing dont miss it Are you not aware what is it Legends of Mitra is a multichain free to play to earn strategy defense game BeLegandary,Positive,0.768
rxvc60,litecoinmarkets,AdaasCapital,1641520241,1641592728,0,0,0,0,0,0,0,0,0,,0.77,7,0,0,5,0,https://b.thumbs.redditmedia.com/DsWfQjcRIiShIQScVuF2fzo_dCHw-Df2Bxrky0O5E5s.jpg,https://redd.it/rxvc60,Litecoin LTC Price Prediction for 2022 2023 2024 2025,Neutral,0.0
rxz922,litecoinmarkets,AutoModerator,1641531670,1641592728,0,0,0,0,0,0,1,0,0,,0.99,97,0,1,139,0,self,https://redd.it/rxz922,Daily Discussion Friday January 07 2022 Welcome to the rLitecoinMarkets daily discussion thread Thread topics include but are not limited to General discussion related to the days events technical analysis trading ideas strategies,Positive,0.4587
ryj5nh,litecoinmarkets,Pumpitordumpyourself,1641592710,1641670068,0,0,0,0,0,0,1,0,0,Inaccurate,0.95,15,0,0,5,0,self,https://redd.it/ryj5nh,Grayscale Litecoin Trust Maby its just a too big if but lets say you throw in something now wouldnt that be a nice opportunity if we manage to retrace only half to the previous high,Positive,0.4314
ryrwjz,litecoinmarkets,AutoModerator,1641618074,1641670068,0,0,0,0,0,0,1,0,0,,0.98,90,0,0,135,0,self,https://redd.it/ryrwjz,Daily Discussion Saturday January 08 2022 Welcome to the rLitecoinMarkets daily discussion thread Thread topics include but are not limited to General discussion related to the days events technical analysis trading ideas strategies,Positive,0.4587
rz7lma,litecoinmarkets,panickynl,1641669675,1641791175,0,0,0,0,1,0,0,0,0,,1.0,1,0,0,0,0,default,https://redd.it/rz7lma,Anyone using litecoins to gamble on this provably fair dApp casino It is fully decentralized and has onchain transactions supports ltc mainnet while having 5 games It has integrated Chainlinks VRF Oracles to achieve a fair and an unbiased outcome,Positive,0.7184
rzc85f,litecoinmarkets,Aggravating_One8942,1641681810,1641772965,0,0,0,0,1,0,0,0,0,,1.0,1,0,0,0,0,default,https://redd.it/rzc85f,Litecoin Could Have Limited Upside Without DeFi Apps and Uses,Negative,-0.2263
rzjxlw,litecoinmarkets,AutoModerator,1641704471,1641791175,0,0,0,0,0,0,1,0,0,,1.0,110,0,3,124,0,self,https://redd.it/rzjxlw,Daily Discussion Sunday January 09 2022 Welcome to the rLitecoinMarkets daily discussion thread Thread topics include but are not limited to General discussion related to the days events technical analysis trading ideas strategies,Positive,0.4587
s05e6l,litecoinmarkets,MrSpiderwebman,1641772599,1641877620,0,0,0,0,1,0,0,0,0,,1.0,1,0,0,0,0,default,https://redd.it/s05e6l,Trading Signal WIN Bitcoin 1555 0901,Positive,0.6739
s0bntn,litecoinmarkets,AutoModerator,1641790876,1641877620,0,0,0,0,0,0,1,0,0,,1.0,127,0,3,179,0,self,https://redd.it/s0bntn,Daily Discussion Monday January 10 2022 Welcome to the rLitecoinMarkets daily discussion thread Thread topics include but are not limited to General discussion related to the days events technical analysis trading ideas strategies,Positive,0.4587
s0cngs,litecoinmarkets,DiscombobulatedAd629,1641794125,1641877620,0,0,0,0,0,0,0,1,0,Inaccurate,0.87,39,0,0,6,0,https://b.thumbs.redditmedia.com/1BfUbIMYjC-1xdr6XQ1qOIkQ6HpiOMK5oSgl5BYc2dQ.jpg,https://redd.it/s0cngs,trippy ltc by me,Neutral,0.0
s14rmw,litecoinmarkets,AutoModerator,1641877281,1642066696,0,0,0,0,0,0,1,0,0,,1.0,112,0,0,108,0,self,https://redd.it/s14rmw,Daily Discussion Tuesday January 11 2022 Welcome to the rLitecoinMarkets daily discussion thread Thread topics include but are not limited to General discussion related to the days events technical analysis trading ideas strategies,Positive,0.4587
s1b1ur,litecoinmarkets,TRAcademy,1641901374,1642066696,0,0,0,0,0,0,0,0,0,,0.67,2,0,0,3,0,https://b.thumbs.redditmedia.com/WuGQ_FywV24bbOwCbdW55GcXt57BN4aJxdNfBV1BEvw.jpg,https://redd.it/s1b1ur,Litecoin Technical Analysis for January 11 2022 LTC,Neutral,0.0
s1s69i,litecoinmarkets,bitdex,1641947122,1642066695,0,0,0,0,0,0,0,0,0,Analysis,0.23,0,0,0,5,0,https://b.thumbs.redditmedia.com/zmPs3RygsPZmGHsACSP7GOhaWYQjNWR-mBUZ13zeSXA.jpg,https://redd.it/s1s69i,Litecoin sinks below key area of support but can it see a recovery at 110,Positive,0.2144
s1xvmf,litecoinmarkets,AutoModerator,1641963672,1642066695,0,0,0,0,0,0,1,0,0,,1.0,127,0,2,169,0,self,https://redd.it/s1xvmf,Daily Discussion Wednesday January 12 2022 Welcome to the rLitecoinMarkets daily discussion thread Thread topics include but are not limited to General discussion related to the days events technical analysis trading ideas strategies,Positive,0.4587
s20e4b,litecoinmarkets,TRAcademy,1641972478,1642066695,0,0,0,0,0,0,0,0,0,,1.0,2,0,0,1,0,default,https://redd.it/s20e4b,Litecoin Technical Analysis for January 12 2022 LTC,Neutral,0.0
s27cv6,litecoinmarkets,maturehelm23,1641997162,1642066695,0,0,0,0,0,0,1,0,0,,1.0,14,0,0,8,0,self,https://redd.it/s27cv6,Do you follow any crypto buying guides Hello everybody x200B How many of you follow different guides related to purchasing Bitcoins Etherum and other cryptocurrencies x200B To be honest Im a rookie in all this cryptocurrency trading and stuff like this Besides I know that its better not to touch this water if you are not an expert Still Im interested in investing my savings somewhere to multiply them in the future Indeed I always hear in the news that Bitcoins value is growing Even despite the recent significant drop in the market the value of Bitcoin continues to grow Besides even if you check out the graph from the Bitcoins launch and the current moment you will see how the value has increased I would even say there are some enormous numbers So I can say for sure that those early birds who purchased Bitcoins for a reasonable price now definitely can allow themselves not to work if they want to x200B Besides I could spot the same tendency with other cryptos too Usually financial analytics compare Bitcoin and Etherum They are pretty similar Still I stick to the point that all cryptos are somehow linked to Bitcoin This financial asset is brand new on the market So no one knows where all these things go in the end Some experts state that it is impossible to mine cryptos forever and all this mining will stop at some point So the price of other cryptocurrencies somehow is affected by Bitcoins trends x200B But on the other hand there are some factors too that affect the price of any altcoin or token For instance when I was doing a little research on this potential investment I came across this guide I was literally shocked by how many detailed instructions they posted on different cryptos They state that there are 50 coins in their database Im sorry I dunno how else I should call it But I wonder if anyone uses any guidelines on purchasing cryptos How do you choose them and are they worth our trust x200B Im sorry if Im wrong somewhere in my discussion Im doing research and quite interested in your opinion about different guidelines and investing in altcoins in general,Positive,0.9572
s2dzxe,litecoinmarkets,BrianAtSantiment,1642014063,1642068549,0,0,0,0,0,0,0,0,0,Whales,0.97,23,0,0,4,0,https://b.thumbs.redditmedia.com/WjIV2OY8weRlh5U9pp9f6S_yuFejBW6ItTnh7cHGiUc.jpg,https://redd.it/s2dzxe,Litecoins Whale Addresses Holding 10k to 1m LTC Have Accumulated an Extra 5 of the Assets Supply Since Late September,Positive,0.1779
s2r3g4,litecoinmarkets,AutoModerator,1642050076,1642120709,0,0,0,0,0,0,1,0,0,,1.0,93,0,3,103,0,self,https://redd.it/s2r3g4,Daily Discussion Thursday January 13 2022 Welcome to the rLitecoinMarkets daily discussion thread Thread topics include but are not limited to General discussion related to the days events technical analysis trading ideas strategies,Positive,0.4587
s2w4eh,litecoinmarkets,Serious_Finish2042,1642068502,1642120709,0,0,0,0,0,0,0,0,0,markets,0.43,0,0,0,2,0,https://a.thumbs.redditmedia.com/70JT7z_N4EXtWDdilGMc5Fn1oyL0nb-LW8FvtUv-OO8.jpg,https://redd.it/s2w4eh,Litecoin LTC on a pump again,Neutral,0.0
s2y84h,litecoinmarkets,NFTMUSICSTREAM7456,1642076482,1642120709,0,0,0,0,1,0,1,0,0,,1.0,1,0,0,0,0,default,https://redd.it/s2y84h,NFT,Neutral,0.0
s3ec7o,litecoinmarkets,A_Servant777,1642120429,1642205178,0,0,0,0,0,0,0,0,0,,0.94,32,0,1,4,0,https://b.thumbs.redditmedia.com/5z4dzAkp_NqmjZxCxPGd_Qfzb-GTO2yB181iVJ5OV8c.jpg,https://redd.it/s3ec7o,Shoutout from Coin bureau,Neutral,0.0
s3jwk6,litecoinmarkets,AutoModerator,1642136471,1642205178,0,0,0,0,0,0,1,0,0,,0.99,119,0,1,147,0,self,https://redd.it/s3jwk6,Daily Discussion Friday January 14 2022 Welcome to the rLitecoinMarkets daily discussion thread Thread topics include but are not limited to General discussion related to the days events technical analysis trading ideas strategies,Positive,0.4587
s3pvub,litecoinmarkets,qaseemiqbal,1642158589,1642205178,0,0,0,0,0,0,1,0,0,,0.67,3,0,0,5,0,self,https://redd.it/s3pvub,Accurate Price Prediction Tell me a coin and I will give you accurate price prediction I will then keep track of the price and update you when the price targets have met,Neutral,0.0
s46fxt,litecoinmarkets,Overall_Leg9894,1642204688,1642259270,0,0,0,0,0,0,1,0,0,,0.9,21,0,0,21,0,self,https://redd.it/s46fxt,Price potential Im new to crypto so I decided to buy around 5k when it launched on PayPal160 ish I think it was One thing I dont understand with litecoin is why is it so cheap Its been around a while dirt cheap transfer fees secure Its basically just a copy of Bitcoin but with 4x the supply So if Bitcoin is currently at 40k then what is the reason why we are not 10k Or at least somewhere in that area Theres no way most of the shitcoins with higher market cap have better utility,Positive,0.3182
s4b6hz,litecoinmarkets,litecoin-master,1642218956,1642276096,0,0,0,0,1,0,0,1,0,,1.0,1,0,0,0,0,default,https://redd.it/s4b6hz,Litecoin about to breakout of a 9 year triangle Massive move potential Similar to what doge did in 2020,Neutral,0.0
s4ce9o,litecoinmarkets,AutoModerator,1642222878,1642276096,0,0,0,0,0,0,1,0,0,,1.0,107,0,0,55,0,self,https://redd.it/s4ce9o,Daily Discussion Saturday January 15 2022 Welcome to the rLitecoinMarkets daily discussion thread Thread topics include but are not limited to General discussion related to the days events technical analysis trading ideas strategies,Positive,0.4587
s4cnly,litecoinmarkets,cute-tortoise,1642223728,1642276096,0,0,0,0,0,0,1,0,0,,0.9,8,0,0,5,0,self,https://redd.it/s4cnly,Last chance to accumulate below 150 There is an increase in volume past few days Mweb is also expected to launch soon Hodl tight and enjoy the ride,Positive,0.7579
s4g422,litecoinmarkets,TRAcademy,1642236742,1642290444,0,0,0,0,0,0,0,0,0,,1.0,2,0,0,0,0,default,https://redd.it/s4g422,Litecoin Technical Analysis for January 15 2022 LTC,Neutral,0.0
s4gzsa,litecoinmarkets,Mission-Food526,1642240350,1642290444,0,0,0,0,0,0,0,0,0,trading,0.97,21,0,0,4,0,https://a.thumbs.redditmedia.com/70JT7z_N4EXtWDdilGMc5Fn1oyL0nb-LW8FvtUv-OO8.jpg,https://redd.it/s4gzsa,Litecoin LTC on a steep rise up,Neutral,0.0
s4m5pn,litecoinmarkets,barcode972,1642258994,1642309654,0,0,0,0,0,0,0,0,0,,1.0,1,0,0,1,0,https://b.thumbs.redditmedia.com/HUs9PegfpEm8P-ux4YlsBBRhzyMHmI63Jmd9oW8X1Ms.jpg,https://redd.it/s4m5pn,CoinCurrently FearGreed Index and Global Market,Neutral,0.0
s4sfv4,litecoinmarkets,TCr0wn,1642275904,1642352174,0,0,0,0,0,0,0,0,0,,0.78,5,0,0,3,0,https://b.thumbs.redditmedia.com/Uw1xw3JbnpMeFKVGJmd9KSHSUEtziKAo2cLJunbAb5Q.jpg,https://redd.it/s4sfv4,Cryptocurrency Market Update 2022,Neutral,0.0
s4spv0,litecoinmarkets,N1K5_,1642276670,1642352174,0,0,0,0,0,0,0,0,0,Analysis,0.94,13,0,0,4,0,https://b.thumbs.redditmedia.com/8Px7Z_IjKMZczstky92iSG85HmvTZ-P-diMT8zw0bQg.jpg,https://redd.it/s4spv0,Litecoin LTC Worth Charged Up In the direction of 160 Bulls Wants To Validate Above 100 SMA,Positive,0.3818
s4xp8n,litecoinmarkets,Academic-Ad2674,1642290025,1642352174,0,0,0,0,1,0,0,0,0,crypto,0.67,1,0,0,0,0,default,https://redd.it/s4xp8n,The most profitable Crypto Mining Equipment on the market Huge discounts,Positive,0.6697
s4y8jg,litecoinmarkets,BNieman,1642291503,1642352174,0,0,0,0,0,0,0,0,0,,1.0,2,0,0,2,0,default,https://redd.it/s4y8jg,My 2022 LITECOIN LTC Prediction,Neutral,0.0
s5426n,litecoinmarkets,AutoModerator,1642309273,1642396033,0,0,0,0,0,0,1,0,0,,0.99,106,0,0,69,0,self,https://redd.it/s5426n,Daily Discussion Sunday January 16 2022 Welcome to the rLitecoinMarkets daily discussion thread Thread topics include but are not limited to General discussion related to the days events technical analysis trading ideas strategies,Positive,0.4587
s5fuwr,litecoinmarkets,Substantial_Boat_198,1642351815,1642396033,0,0,0,0,1,0,0,0,0,mining,1.0,1,0,0,0,0,default,https://redd.it/s5fuwr,Get the best Deal for Almost Every Crypto Mining Equipment,Positive,0.6369
s5fxel,litecoinmarkets,bordoisse,1642352011,1642396033,0,0,0,0,1,0,0,0,0,,0.4,0,0,0,2,0,default,https://redd.it/s5fxel,Losing nearly a third of its value Litecoin fell the most down 30 Tracking Top Ten 2018 Cryptocurrencies Four Year Report,Positive,0.1531
s5vizj,litecoinmarkets,AutoModerator,1642395671,1642440414,0,0,0,0,0,0,1,0,0,,1.0,99,0,0,104,0,self,https://redd.it/s5vizj,Daily Discussion Monday January 17 2022 Welcome to the rLitecoinMarkets daily discussion thread Thread topics include but are not limited to General discussion related to the days events technical analysis trading ideas strategies,Positive,0.4587
s5wyty,litecoinmarkets,investold,1642400387,1642482349,0,0,0,0,0,0,0,0,0,trading,0.97,33,0,0,4,0,https://a.thumbs.redditmedia.com/70JT7z_N4EXtWDdilGMc5Fn1oyL0nb-LW8FvtUv-OO8.jpg,https://redd.it/s5wyty,Litecoin LTC grows 15 past seven days,Neutral,0.0
s63nzj,litecoinmarkets,Futuur,1642424908,1642482349,0,0,0,0,1,0,1,0,0,,1.0,2,0,0,1,0,default,https://redd.it/s63nzj,What will be Litecoins market cap at the end of January 2022,Neutral,0.0
s64fmc,litecoinmarkets,rubyjoseph05,1642427320,1642482349,0,0,0,0,1,0,1,0,0,,1.0,1,0,0,0,0,default,https://redd.it/s64fmc,Which is the SuperRare clone very special,Positive,0.4576
s69dry,litecoinmarkets,FloppySeaPanda,1642440317,1642488517,0,0,0,0,0,0,0,0,0,FUD,0.84,4,0,0,0,0,https://b.thumbs.redditmedia.com/PirIDR3T3ePVmus1hDZSD8Xl5oxYA2pLLtjPM_Ed-sk.jpg,https://redd.it/s69dry,CRYPTOcom has experienced a hacker attack and a small amount of accounts have been compromised even those with 2FA,Negative,-0.4767
s6p88v,litecoinmarkets,AutoModerator,1642482070,1642568814,0,0,0,0,0,0,1,0,0,,0.98,124,0,1,148,0,self,https://redd.it/s6p88v,Daily Discussion Tuesday January 18 2022 Welcome to the rLitecoinMarkets daily discussion thread Thread topics include but are not limited to General discussion related to the days events technical analysis trading ideas strategies,Positive,0.4587
s6qpip,litecoinmarkets,amanaluis21,1642486970,1642568814,0,0,0,0,1,0,0,0,0,,1.0,1,0,0,0,0,default,https://redd.it/s6qpip,LTC LITECOIN 2022 PRICE PREDICTION ANALYSIS BREAKDOWN,Neutral,0.0
s6r3zf,litecoinmarkets,KaiserofHellandHell,1642488438,1642568814,0,0,0,0,1,0,1,0,0,,1.0,1,0,0,2,0,default,https://redd.it/s6r3zf,Survey on Cryptocurrency,Neutral,0.0
s6siu6,litecoinmarkets,fischersfix,1642493770,1642568814,0,0,0,0,0,0,1,0,0,,0.6,1,0,0,3,0,self,https://redd.it/s6siu6,Whats everyones thoughts on the notion that there is a serious bear market every four years and at year 2022 we are supposedly due for one again Looking forward to hearing the interesting takes from those holding andor interested in LTC,Positive,0.6249
s6sohu,litecoinmarkets,Lime_Singularity,1642494437,1642568814,0,0,0,0,0,0,0,0,0,,0.81,28,0,0,4,0,https://a.thumbs.redditmedia.com/VF6OZKeOwxRTsvbsuwl_j57b-89uKcxz_D0QhzqFkz0.jpg,https://redd.it/s6sohu,Random sample of 2000 people and 69 are bearish on LTC Bullish signal to me the majority are usually wrong,Negative,-0.4767
s6vliu,litecoinmarkets,Mission-Food526,1642506018,1642568814,0,0,0,0,0,0,0,0,0,markets,1.0,1,0,0,1,0,https://a.thumbs.redditmedia.com/70JT7z_N4EXtWDdilGMc5Fn1oyL0nb-LW8FvtUv-OO8.jpg,https://redd.it/s6vliu,LitecoinLTC on a bull run this week,Neutral,0.0
s6wax8,litecoinmarkets,blersion,1642508547,1642568814,0,0,0,0,0,0,0,0,0,,0.67,2,0,0,10,0,https://b.thumbs.redditmedia.com/FndSRrNNg46vJr0jiTM-Slx3o8yOMIMHs1jMgfFYrdM.jpg,https://redd.it/s6wax8,Can Litecoin LTC Stay Above 100,Neutral,0.0
s6wl66,litecoinmarkets,TRAcademy,1642509573,1642568814,0,0,0,0,0,0,0,0,0,,0.75,2,0,0,0,0,https://b.thumbs.redditmedia.com/LllcDm_lzyT5wAuC9DhmWhZaABaJWDISaB-EQ3V7lJM.jpg,https://redd.it/s6wl66,Litecoin Technical Analysis for January 18 2022 LTC,Neutral,0.0
s71e34,litecoinmarkets,FloppySeaPanda,1642523274,1642568814,0,0,0,0,0,0,0,0,0,FUD,1.0,3,0,0,1,0,https://b.thumbs.redditmedia.com/V27Bj-3oIdbKNay26bPzGNWuT5gGAedus_qZQUZGAdE.jpg,https://redd.it/s71e34,Cryptocom Hack Report 15 Million Stolen and washed via Tornado Cash Withdrawals back live No customer funds lost,Negative,-0.7717
s7i3c5,litecoinmarkets,AutoModerator,1642568470,1642617560,0,0,0,0,0,0,1,0,0,,0.99,84,0,1,95,0,self,https://redd.it/s7i3c5,Daily Discussion Wednesday January 19 2022 Welcome to the rLitecoinMarkets daily discussion thread Thread topics include but are not limited to General discussion related to the days events technical analysis trading ideas strategies,Positive,0.4587
s7thz1,litecoinmarkets,LeviMcguire88,1642608479,1642655240,0,0,0,0,0,0,0,0,0,,0.78,5,0,0,0,0,https://b.thumbs.redditmedia.com/BXerMevNXIqgoqfojW5GH9q6cbwWnBZCuwBonp76qjI.jpg,https://redd.it/s7thz1,Rocket to The Moon Litecoin Edition,Neutral,0.0
s7u67w,litecoinmarkets,Changehero_io,1642610235,1642655240,0,0,0,0,0,0,0,0,0,,1.0,12,0,0,1,0,https://b.thumbs.redditmedia.com/QjbU23te5XlIykhhB1nMHBM_lnL1b4L4Em7-ir2vEng.jpg,https://redd.it/s7u67w,Litecoin Network for Beginners Infographic by ChangeHero,Neutral,0.0
s7x1kb,litecoinmarkets,WhataGuy84,1642617492,1642699051,0,0,0,0,0,0,0,0,0,,0.97,60,0,0,13,0,https://b.thumbs.redditmedia.com/7bwyvJAHK6zMvRdvASK3NGf4OPPBucO3J6trxCG6eKM.jpg,https://redd.it/s7x1kb,MWEB is Coming Spread the good word Discretely,Positive,0.4404
s8aqd8,litecoinmarkets,AutoModerator,1642654875,1642699051,0,0,0,0,0,0,1,0,0,,1.0,91,0,0,40,0,self,https://redd.it/s8aqd8,Daily Discussion Thursday January 20 2022 Welcome to the rLitecoinMarkets daily discussion thread Thread topics include but are not limited to General discussion related to the days events technical analysis trading ideas strategies,Positive,0.4587
s8bzf9,litecoinmarkets,TRAcademy,1642658954,1642721290,0,0,0,0,0,0,0,0,0,,0.5,0,0,0,0,0,default,https://redd.it/s8bzf9,Litecoin Technical Analysis for January 20 2022 LTC,Neutral,0.0
s8nsns,litecoinmarkets,Changehero_io,1642698690,1642759687,0,0,0,0,0,0,0,0,0,,0.94,28,0,0,1,0,https://b.thumbs.redditmedia.com/zCngsFHqWqrS18IztHRFkHXzOfRr6TNDCkRPyQriC1I.jpg,https://redd.it/s8nsns,MimbleWimble is a new edge for Litecoin and improves users privacy Crypto community feels excited about it Why Read in our blog,Positive,0.6369
s8vvh7,litecoinmarkets,tngcoin,1642721114,1642886238,0,0,0,0,0,0,1,0,0,,0.78,5,0,0,7,0,self,https://redd.it/s8vvh7,Happy New Year From Tong Jerky We at Tong Jerky would like to wish all of our fellow Litecoin users a happy new year and remind everyone that we accept LTC as a payment For all of you wonderful people that might be interested in our products you can use the discount code LTC for 20 off at checkout Visit our website for more,Positive,0.9666
