submission,subreddit,author,created,retrieved,edited,pinned,archived,locked,removed,deleted,is_self,is_video,is_original_content,link_flair_text,upvote_ratio,score,gilded,total_awards_received,num_comments,num_crossposts,thumbnail,shortlink,combined_text,sentiment,vader_score
tbdth9,bitcoinmarkets,sjmuir_Hdfrger4576,1646959818,1647019887,0,0,0,0,1,0,1,0,0,"Removed - Belongs in /r/bitcoin, /r/btc or /r/BitcoinSerious",0.8,24,0,1,3,0,default,https://redd.it/tbdth9,How safe is ZenGo crypto wallet,Positive,0.4404
tbf5g5,bitcoinmarkets,ImFrizey,1646964066,1647019888,0,0,0,0,1,0,0,0,0,,1.0,1,0,0,0,0,default,https://redd.it/tbf5g5,Anyone else saving 1000 FLUX for a Flux NODE,Neutral,0.0
tbfvve,bitcoinmarkets,[deleted],1646966476,1647019888,0,0,0,0,1,0,1,0,0,,0.99,1,0,0,0,0,default,https://redd.it/tbfvve,JUST IN Global payments giant stripe now supports payments in Bitcoin and crypto,Positive,0.3612
tbfzt5,bitcoinmarkets,[deleted],1646966821,1647019888,0,0,0,0,1,0,1,0,0,,1.0,1,0,0,0,0,default,https://redd.it/tbfzt5,HOW TO DO TRIANGLE ARBITRAGE IN BINANCE NO LIMIT INVOVLED 2022 ARBITRAGE OPPORTUNITIES,Positive,0.1027
tbidwd,bitcoinmarkets,AutoModerator,1646974811,1647036831,0,0,0,0,0,0,1,0,0,Daily Discussion,0.97,41,0,1,250,0,self,https://redd.it/tbidwd,Daily Discussion Friday March 11 2022 Thread topics include but are not limited to General discussion related to the days events Technical analysis trading ideas strategies Quick questions that do not warrant a separate post Thread guidelines Be excellent to each other Do not make posts outside of the daily thread for the topics mentioned above Other ways to interact Get an invite to live chat on our Slack group,Positive,0.838
tbjx7p,bitcoinmarkets,thecryptoape0,1646980628,1647036831,0,0,0,0,1,0,1,0,0,,1.0,1,0,0,0,0,default,https://redd.it/tbjx7p,Types of Cryptocurrency Exchanges and Its Business Ideas,Neutral,0.0
tbk6ih,bitcoinmarkets,ccchiew12,1646981641,1647036831,0,0,0,0,1,0,1,0,0,,1.0,1,0,0,0,0,default,https://redd.it/tbk6ih,Im new to crypto and have been investing in btc recently Can anyone explain why bitcoin prices are affected by events such as the RussiaUkraine conflict what exactly are the variables in these scenarios that has a direct impact on bitcoin value as well as other cryptocurrencies,Positive,0.1531
tbktw8,bitcoinmarkets,Ituglobal,1646984256,1647036831,0,0,0,0,1,0,1,0,0,,1.0,1,0,0,0,0,default,https://redd.it/tbktw8,Bitcoin Is Unstable Above 40000 As It Threatens To Fall Further Below It,Negative,-0.6249
tbn8mn,bitcoinmarkets,Irish_Silver_Fox,1646994423,1647062141,0,0,0,0,1,0,1,0,0,,1.0,1,0,0,0,0,default,https://redd.it/tbn8mn,Bitcoin Dump To 20K Is On The Horizon,Negative,-0.3818
tbna2n,bitcoinmarkets,Matej_2334,1646994594,1647062141,0,0,0,0,1,0,1,0,0,,1.0,1,0,0,0,0,default,https://redd.it/tbna2n,Send bitcoin,Neutral,0.0
tbnbki,bitcoinmarkets,eyeball2021,1646994762,1647062141,0,0,0,0,1,0,1,0,0,,1.0,1,0,0,0,0,default,https://redd.it/tbnbki,2125US 15 OFFHigh Quality LIHUA 5KW three phase AVR For EC6500 Gasoline Generator3 Phase Automatic Voltage Regulator3 Phase generator avravr programmeravr forgenerator waterproof AliExpress,Neutral,0.0
tbq8eh,bitcoinmarkets,Minimum_Razzmatazz35,1647005601,1647062141,0,0,0,0,1,0,1,0,0,,1.0,1,0,0,0,0,default,https://redd.it/tbq8eh,Bitcoin Price BTC Cryptocurrency Prediction and Analysis March 11 2022,Neutral,0.0
tbrnbp,bitcoinmarkets,16431879196842,1647009927,1647062141,0,0,0,0,0,0,1,0,0,,0.87,26,0,0,14,0,self,https://redd.it/tbrnbp,Hedge Fund Fir Tree Bets Big With Short of Stablecoin Tether Fir Tree Capital Management is making a substantial short wager on Tether the stablecoin thats under intense scrutiny from regulators The 4 billion hedge fund founded by Jeff Tannenbaum constructed a way to short Tether in an asymmetric trade meaning the downside risk is small and potential to make money is great according to clients of the firm Thats a feat that other firms have struggled to figure out Fir Tree is betting that its short wager could see a payday within 12 months and its thesis against Tether centers around the coins roughly 24 billion in highyield commercial paper much of it the firm believes is tied to Chinese real estate developers Fir Tree started looking at shorting Tether in July and did research including hiring thirdparty experts the investors said It is considering setting up a separate fund for the sole purpose of shorting Tether if there is enough client interest,Positive,0.5719
tbugwk,bitcoinmarkets,serban1313,1647017796,1647062141,0,0,0,0,0,0,0,0,0,,0.4,0,0,0,0,0,default,https://redd.it/tbugwk,How to improve your HODLing with a little Technical Analysis,Positive,0.4404
tc1e4z,bitcoinmarkets,Som3_Dud3_,1647036332,1647148042,0,0,0,0,1,0,1,0,0,,0.73,17,0,0,2,0,default,https://redd.it/tc1e4z,Invest in real estate with at little as 100 Revolutionizing the Future of property Investment and Ownership Earn a Passive income Limited Whitelist Now Open,Neutral,-0.0258
tc8we0,bitcoinmarkets,AutoModerator,1647061210,1647148042,0,0,0,0,0,0,1,0,0,Daily Discussion,0.92,36,0,0,144,0,self,https://redd.it/tc8we0,Daily Discussion Saturday March 12 2022 Thread topics include but are not limited to General discussion related to the days events Technical analysis trading ideas strategies Quick questions that do not warrant a separate post Thread guidelines Be excellent to each other Do not make posts outside of the daily thread for the topics mentioned above Other ways to interact Get an invite to live chat on our Slack group,Positive,0.838
tcbps3,bitcoinmarkets,ApprehensiveGoal6221,1647072582,1647130487,0,0,0,0,1,0,0,0,0,,1.0,1,0,0,0,0,default,https://redd.it/tcbps3,Meet the global demand today Sign up for a merchant account with PayBolt,Negative,-0.128
tcfo36,bitcoinmarkets,Afraid-Brush-7986,1647089112,1647148046,0,0,0,0,1,0,1,0,0,,1.0,1,0,0,0,0,default,https://redd.it/tcfo36,Russia moves to regulate the trading of cryptocurrency forex and bitcoin,Neutral,0.0
tcg93b,bitcoinmarkets,olaver1837,1647091205,1647148046,0,0,0,0,1,0,1,0,0,,1.0,1,0,0,0,0,default,https://redd.it/tcg93b,CFXN worlds best Crypto and Fiat Exchange ll Next Generation Exchange CFXN,Positive,0.6369
tchq7b,bitcoinmarkets,SweetlyPast,1647095964,1647148046,0,0,0,0,1,0,1,0,0,,0.66,1,0,0,0,0,default,https://redd.it/tchq7b,Share your opinion on Zelcore please,Positive,0.5423
tcoga8,bitcoinmarkets,animated932,1647112142,1647158748,0,0,0,0,1,0,1,0,0,,1.0,1,0,0,0,0,default,https://redd.it/tcoga8,nft,Neutral,0.0
tcu6k5,bitcoinmarkets,Vast_Bath_826,1647129211,1647178332,0,0,0,0,1,0,1,0,0,,1.0,1,0,0,0,0,default,https://redd.it/tcu6k5,Few Months Ago Bitcoin hasnt boomed So Why Isnt It Booming,Neutral,0.0
tczgpo,bitcoinmarkets,AutoModerator,1647147610,1647230799,0,0,0,0,0,0,1,0,0,Daily Discussion,0.88,39,0,1,222,0,self,https://redd.it/tczgpo,Daily Discussion Sunday March 13 2022 Thread topics include but are not limited to General discussion related to the days events Technical analysis trading ideas strategies Quick questions that do not warrant a separate post Thread guidelines Be excellent to each other Do not make posts outside of the daily thread for the topics mentioned above Other ways to interact Get an invite to live chat on our Slack group,Positive,0.838
td1tcs,bitcoinmarkets,crypto_ziyan,1647157183,1647212711,0,0,0,0,1,0,1,0,0,,1.0,1,0,0,0,0,default,https://redd.it/td1tcs,Good Morning Redit Family,Positive,0.4404
td466e,bitcoinmarkets,coinpro8877,1647167357,1647212711,0,0,0,0,1,0,1,0,0,,1.0,1,0,0,0,0,default,https://redd.it/td466e,hello,Neutral,0.0
td6nd1,bitcoinmarkets,StreetAd3361,1647177152,1647228583,0,0,0,0,1,0,1,0,0,,1.0,1,0,0,0,0,default,https://redd.it/td6nd1,CFXN worlds best Crypto and Fiat Exchange ll Next Generation Exchange CFXN,Positive,0.6369
td8gts,bitcoinmarkets,MusicGuy2002,1647182986,1647228583,0,0,0,0,1,0,1,0,0,,1.0,1,0,0,0,0,default,https://redd.it/td8gts,get 25 BTC,Neutral,0.0
tdb92o,bitcoinmarkets,Fit_Weird_9825,1647190972,1647240541,0,0,0,0,1,0,1,0,0,,1.0,1,0,0,0,0,default,https://redd.it/tdb92o,2022moon,Neutral,0.0
tdcih6,bitcoinmarkets,shahyasir5500,1647194500,1647240541,0,0,0,0,1,0,1,0,0,,1.0,1,0,0,0,0,default,https://redd.it/tdcih6,Ive just skimmed through the whole market,Neutral,0.0
tdiciz,bitcoinmarkets,returnIIspace,1647210654,1647259493,0,0,0,0,1,0,1,0,0,,1.0,1,0,0,0,0,default,https://redd.it/tdiciz,Looking to expand my list of regular BITCOIN TA sources other quality cryptocurrency content,Positive,0.3182
tdnmco,bitcoinmarkets,[deleted],1647227074,1647301640,0,0,0,0,1,0,1,0,0,,1.0,1,0,0,0,0,default,https://redd.it/tdnmco,Bitcoin is a Civil Right,Neutral,0.0
tdoluc,bitcoinmarkets,AutoModerator,1647230413,1647317389,0,0,0,0,0,0,1,0,0,Daily Discussion,0.93,51,0,2,292,0,self,https://redd.it/tdoluc,Daily Discussion Monday March 14 2022 Thread topics include but are not limited to General discussion related to the days events Technical analysis trading ideas strategies Quick questions that do not warrant a separate post Thread guidelines Be excellent to each other Do not make posts outside of the daily thread for the topics mentioned above Other ways to interact Get an invite to live chat on our Slack group,Positive,0.838
tdqxht,bitcoinmarkets,ApprehensiveGoal6221,1647239280,1647301640,0,0,0,0,1,0,0,0,0,,1.0,1,0,0,0,0,default,https://redd.it/tdqxht,We are happy to announce that PayBolt is one of the top 30 companies that have completed the KYC processed audit with Certik CertiKTech This will add more legitimacy to the business and build more trust among the investors Web3 Crypto PaymentGateway Blockchain,Positive,0.8439
tdqyfo,bitcoinmarkets,thecryptoape0,1647239391,1647301640,0,0,0,0,1,0,1,0,0,,1.0,1,0,0,0,0,default,https://redd.it/tdqyfo,Cyrpto Products Based on Ehtereum,Neutral,0.0
tdvdm4,bitcoinmarkets,Samuel_Sutts,1647257459,1647304922,0,0,0,0,1,0,1,0,0,,1.0,1,0,0,0,0,default,https://redd.it/tdvdm4,Crypto Quantum Leap,Neutral,0.0
tdviot,bitcoinmarkets,StreetAd3361,1647257985,1647304922,0,0,0,0,1,0,1,0,0,,1.0,1,0,0,0,0,default,https://redd.it/tdviot,CFXN worlds best Crypto and Fiat Exchange ll Next Generation Exchange CFXN,Positive,0.6369
tdwdpg,bitcoinmarkets,Fit_Weird_9825,1647261008,1647317390,0,0,0,0,1,0,1,0,0,,1.0,1,0,0,0,0,default,https://redd.it/tdwdpg,2022moon,Neutral,0.0
tean9m,bitcoinmarkets,Responsible_Way1381,1647299858,1647356373,0,0,0,0,1,0,1,0,0,,1.0,1,0,0,1,0,default,https://redd.it/tean9m,Ukraine needs help,Positive,0.4019
tebvq0,bitcoinmarkets,elliottwavemonitor,1647303506,1647356373,0,0,0,0,1,0,1,0,0,,1.0,1,0,0,0,0,default,https://redd.it/tebvq0,Bitcoin Forecast Imminent Collapse To 26000,Negative,-0.4939
teg7j1,bitcoinmarkets,AutoModerator,1647316810,1647403804,0,0,0,0,0,0,1,0,0,Daily Discussion,0.92,45,0,1,324,0,self,https://redd.it/teg7j1,Daily Discussion Tuesday March 15 2022 Thread topics include but are not limited to General discussion related to the days events Technical analysis trading ideas strategies Quick questions that do not warrant a separate post Thread guidelines Be excellent to each other Do not make posts outside of the daily thread for the topics mentioned above Other ways to interact Get an invite to live chat on our Slack group,Positive,0.838
tej447,bitcoinmarkets,genetotti,1647327856,1647397291,0,0,0,0,1,0,1,0,0,,1.0,1,0,0,0,0,default,https://redd.it/tej447,NEW Airdrop,Neutral,0.0
tekwdg,bitcoinmarkets,Ituglobal,1647335866,1647397291,0,0,0,0,1,0,1,0,0,,1.0,1,0,0,0,0,default,https://redd.it/tekwdg,Bitcoin is in a Range Bound Move Fighting Resistance at 39000,Negative,-0.3612
teqcx8,bitcoinmarkets,BaldisDetentionToken,1647354791,1647403805,0,0,0,0,1,0,1,0,0,,1.0,1,0,0,0,0,default,https://redd.it/teqcx8,Coinbases Stock Is Tanking What Does That Mean for Bitcoin,Neutral,0.0
ter2ez,bitcoinmarkets,Any_Dimension1107,1647356742,1647403805,0,0,0,0,1,0,1,0,0,,1.0,1,0,0,0,0,default,https://redd.it/ter2ez,DegenPump VIP Premium Lifetime VIP Signals HOT 24h OFFER,Positive,0.8429
terz9p,bitcoinmarkets,RonTate,1647359199,1647403805,0,0,0,0,1,0,1,0,0,,1.0,1,0,0,0,0,default,https://redd.it/terz9p,Southeast Asias Largest Online Sneaker Marketplace Now Accepts Bitcoin,Positive,0.3182
tf6isa,bitcoinmarkets,Ituglobal,1647395912,1647441244,0,0,0,0,1,0,1,0,0,,1.0,1,0,0,0,0,default,https://redd.it/tf6isa,The exit of a super trader and a worldrenowned trading coach,Positive,0.5994
tf8ry1,bitcoinmarkets,AutoModerator,1647403209,1647489647,0,0,0,0,0,0,1,0,0,Daily Discussion,0.91,49,0,0,302,0,self,https://redd.it/tf8ry1,Daily Discussion Wednesday March 16 2022 Thread topics include but are not limited to General discussion related to the days events Technical analysis trading ideas strategies Quick questions that do not warrant a separate post Thread guidelines Be excellent to each other Do not make posts outside of the daily thread for the topics mentioned above Other ways to interact Get an invite to live chat on our Slack group,Positive,0.838
tf9iky,bitcoinmarkets,[deleted],1647405820,1647459449,0,0,0,0,1,0,1,0,0,,1.0,1,0,0,0,0,default,https://redd.it/tf9iky,Positive divergence,Positive,0.5574
tfbvcj,bitcoinmarkets,[deleted],1647415250,1647462341,0,0,0,0,1,0,1,0,0,,1.0,1,0,0,0,0,default,https://redd.it/tfbvcj,Bitcoin stealing malware Bitter reminder for crypto users to stay vigilant,Negative,-0.7003
tfgnoa,bitcoinmarkets,olaver1837,1647434094,1647485020,0,0,0,0,1,0,1,0,0,,1.0,1,0,0,0,0,default,https://redd.it/tfgnoa,Energy Mining Comparison Of Different Blockchains,Positive,0.2732
tfhflh,bitcoinmarkets,hanrythomus,1647436563,1647485020,0,0,0,0,1,0,1,0,0,,1.0,1,0,0,0,0,default,https://redd.it/tfhflh,The HOW TO OCSC DEMO,Neutral,0.0
tficrv,bitcoinmarkets,BusyPush4211,1647439292,1647485020,0,0,0,0,1,0,1,0,0,,1.0,1,0,0,0,0,default,https://redd.it/tficrv,Up on the monthly twice,Neutral,0.0
tfkymv,bitcoinmarkets,Fit_Weird_9825,1647445931,1647489650,0,0,0,0,1,0,1,0,0,,1.0,1,0,0,0,0,default,https://redd.it/tfkymv,2022moon,Neutral,0.0
tfpwv6,bitcoinmarkets,anna_34,1647457674,1647504330,0,0,0,0,1,0,1,0,0,,1.0,1,0,0,0,0,default,https://redd.it/tfpwv6,How did Elon Musk and Tesla become the fastest growing brand globally without advertising,Positive,0.1779
tfpx7t,bitcoinmarkets,anna_34,1647457701,1647504330,0,0,0,0,1,0,1,0,0,,1.0,1,0,0,0,0,default,https://redd.it/tfpx7t,How did Elon Musk and Tesla become the fastest growing brand globally without advertising,Positive,0.1779
tfrptj,bitcoinmarkets,AKOSIABETAR,1647460857,1647517855,0,0,0,0,1,0,1,0,0,,1.0,1,0,0,0,0,default,https://redd.it/tfrptj,2022m,Neutral,0.0
tfuh22,bitcoinmarkets,Tiny-Detail4408,1647468357,1647517855,0,0,0,0,1,0,1,0,0,,1.0,1,0,0,0,0,default,https://redd.it/tfuh22,Make Money Online with bitcoin Earn Free Bitcoin,Positive,0.5106
tfzhta,bitcoinmarkets,[deleted],1647483277,1647538478,0,0,0,0,1,0,1,0,0,,1.0,1,0,0,0,0,default,https://redd.it/tfzhta,Hedge fund Fir Tree bets big on stablecoin Tether,Neutral,0.0
tg1exw,bitcoinmarkets,AutoModerator,1647489610,1647576981,0,0,0,0,0,0,1,0,0,Daily Discussion,0.91,44,0,1,208,0,self,https://redd.it/tg1exw,Daily Discussion Thursday March 17 2022 Thread topics include but are not limited to General discussion related to the days events Technical analysis trading ideas strategies Quick questions that do not warrant a separate post Thread guidelines Be excellent to each other Do not make posts outside of the daily thread for the topics mentioned above Other ways to interact Get an invite to live chat on our Slack group,Positive,0.838
tg4q42,bitcoinmarkets,Ok-Recover-7433,1647502708,1647547770,0,0,0,0,1,0,1,0,0,,1.0,1,0,0,0,0,default,https://redd.it/tg4q42,survey,Neutral,0.0
tg7wd9,bitcoinmarkets,olaver1837,1647516002,1647567909,0,0,0,0,1,0,1,0,0,,1.0,1,0,0,0,0,default,https://redd.it/tg7wd9,A truly interoperable blockchain Libonomy,Positive,0.4404
tg8wqd,bitcoinmarkets,thecryptoape0,1647519551,1647567909,0,0,0,0,1,0,1,0,0,,1.0,1,0,0,0,0,default,https://redd.it/tg8wqd,Benefits of Using Paxful Clone Script,Positive,0.3818
tger57,bitcoinmarkets,Electronic-Goal-120,1647536197,1647595111,0,0,0,0,1,0,1,0,0,,1.0,1,0,0,0,0,default,https://redd.it/tger57,New AutoClaim FreeBitcoin With Google Chrome Etc make btc easy 1000 Work,Positive,0.4404
tghy7r,bitcoinmarkets,youngbzfrmthe40,1647544805,1647595111,0,0,0,0,1,0,1,0,0,,1.0,1,0,0,0,0,default,https://redd.it/tghy7r,Selling 13 ETH for Cheap message me,Neutral,0.0
tgize5,bitcoinmarkets,vlanett1,1647547591,1647595111,0,0,0,0,1,0,1,0,0,,1.0,1,0,0,0,0,default,https://redd.it/tgize5,SELL ACCOUNTS ON COINLIST,Neutral,0.0
tgl62q,bitcoinmarkets,AdaptiveStrike1,1647553461,1647613783,0,0,0,0,1,0,0,0,0,,0.66,1,0,0,0,0,default,https://redd.it/tgl62q,Im really tired of this space being taken over by MLM scams,Negative,-0.8786
tgpnkd,bitcoinmarkets,[deleted],1647566353,1647613783,0,0,0,0,1,0,1,0,0,,1.0,1,0,0,0,0,default,https://redd.it/tgpnkd,Hello community I need your altruistic collaboration,Neutral,0.0
tgrc59,bitcoinmarkets,AdSuitable926,1647571579,1647625106,0,0,0,0,1,0,1,0,0,,1.0,1,0,0,0,0,default,https://redd.it/tgrc59,Hello Portuguese Bitcoin Holders,Neutral,0.0
tgsp0h,bitcoinmarkets,AutoModerator,1647576010,1647640962,0,0,0,0,0,0,1,0,0,Daily Discussion,0.94,41,0,0,209,0,self,https://redd.it/tgsp0h,Daily Discussion Friday March 18 2022 Thread topics include but are not limited to General discussion related to the days events Technical analysis trading ideas strategies Quick questions that do not warrant a separate post Thread guidelines Be excellent to each other Do not make posts outside of the daily thread for the topics mentioned above Other ways to interact Get an invite to live chat on our Slack group,Positive,0.838
tgwuhz,bitcoinmarkets,pratickdas,1647593137,1647639829,0,0,0,0,1,0,0,0,0,,1.0,1,0,0,0,0,default,https://redd.it/tgwuhz,Weekly Synopsis of Blockchains Security Week 10,Positive,0.34
th1kqz,bitcoinmarkets,Ituglobal,1647610827,1647657000,0,0,0,0,1,0,1,0,0,,1.0,1,0,0,0,0,default,https://redd.it/th1kqz,Bitcoin Recaptures the Psychological 40000 Mark CantThe Bulls Overcome Resistance at 45000,Neutral,0.0
th1qae,bitcoinmarkets,daviddme,1647611273,1647657000,0,0,0,0,1,0,1,0,0,,1.0,1,0,0,0,0,default,https://redd.it/th1qae,366 PROFIT in 6 Months Golden Pocket Trading Strategy TradingView Support Resistance,Positive,0.7456
th63lv,bitcoinmarkets,Mcoolest01,1647622301,1647697389,0,0,0,0,1,0,1,0,0,,1.0,1,0,0,0,0,default,https://redd.it/th63lv,Bitcoin Profit Secrets,Positive,0.4404
thf20g,bitcoinmarkets,wyatttvp,1647637254,1647697389,0,0,0,0,1,0,1,0,0,,1.0,1,0,0,0,0,default,https://redd.it/thf20g,Does anyone have a ant miner s9 for sale,Neutral,0.0
thf45s,bitcoinmarkets,Afraid-Brush-7986,1647637405,1647697389,0,0,0,0,1,0,1,0,0,,1.0,1,0,0,0,0,default,https://redd.it/thf45s,bitcoin has risen in price amid the Feds decision to raise the key rat,Neutral,0.0
thf4er,bitcoinmarkets,Afraid-Brush-7986,1647637425,1647697389,0,0,0,0,1,0,1,0,0,,1.0,1,0,0,0,0,default,https://redd.it/thf4er,bitcoin has risen in price amid the Feds decision to raise the key rat,Neutral,0.0
