submission,subreddit,author,created,retrieved,edited,pinned,archived,locked,removed,deleted,is_self,is_video,is_original_content,link_flair_text,upvote_ratio,score,gilded,total_awards_received,num_comments,num_crossposts,thumbnail,shortlink,combined_text,sentiment,vader_score
wsxn7i,bitcoinmarkets,AutoModerator,1660968011,1661038854,0,0,0,0,0,0,1,0,0,Daily Discussion,0.83,21,0,1,139,0,self,https://redd.it/wsxn7i,Daily Discussion Saturday August 20 2022 Thread topics include but are not limited to General discussion related to the days events Technical analysis trading ideas strategies Quick questions that do not warrant a separate post Thread guidelines Be excellent to each other Do not make posts outside of the daily thread for the topics mentioned above Other ways to interact Get an invite to live chat on our Slack group,Positive,0.838
wt1frg,bitcoinmarkets,HarrisonChinonye,1660981640,1661035269,0,0,0,0,1,0,1,0,0,,1.0,1,0,0,0,0,default,https://redd.it/wt1frg,AquaTank,Neutral,0.0
wt1k7r,bitcoinmarkets,HarrisonChinonye,1660982137,1661035269,0,0,0,0,1,0,1,0,0,,1.0,1,0,0,0,0,default,https://redd.it/wt1k7r,AquaTank,Neutral,0.0
wt46m2,bitcoinmarkets,Vishal_techh,1660992520,1661035269,0,0,0,0,1,0,1,0,0,,1.0,1,0,0,0,0,default,https://redd.it/wt46m2,Bitcoin As Reserve Currency,Neutral,0.0
wtg9jo,bitcoinmarkets,BlackberryNo1850,1661026224,1661089905,0,0,0,0,1,0,1,0,0,,1.0,1,0,0,0,0,default,https://redd.it/wtg9jo,GetFreeBTCwithKuCoin Crypto Market Crash Should You Buy the Dip,Negative,-0.4019
wtkppg,bitcoinmarkets,Marjers,1661038430,1661103197,0,0,0,0,1,0,1,0,0,,0.53,1,0,0,0,0,default,https://redd.it/wtkppg,Playing Binary Options with BNBUSD Pair Live on Twitch running a trading Bot,Positive,0.2023
wtnso0,bitcoinmarkets,Odd-Assistant9738,1661047485,1661103212,0,0,0,0,1,0,0,0,0,,1.0,1,0,0,0,0,default,https://redd.it/wtnso0,I saw this post and i thought that it was fake but no its true and i gain lots of money yehooo,Positive,0.6652
wtpzzl,bitcoinmarkets,AutoModerator,1661054410,1661103197,0,0,0,0,0,0,1,0,0,Daily Discussion,0.81,15,0,0,81,0,self,https://redd.it/wtpzzl,Daily Discussion Sunday August 21 2022 Thread topics include but are not limited to General discussion related to the days events Technical analysis trading ideas strategies Quick questions that do not warrant a separate post Thread guidelines Be excellent to each other Do not make posts outside of the daily thread for the topics mentioned above Other ways to interact Get an invite to live chat on our Slack group,Positive,0.838
wtso61,bitcoinmarkets,dikafradana,1661063558,1661113508,0,0,0,0,1,0,1,0,0,,1.0,1,0,0,0,0,default,https://redd.it/wtso61,FANTIGER MUSIC NFT,Neutral,0.0
wty4a6,bitcoinmarkets,ARFASOFTECH,1661083833,1661135956,0,0,0,0,1,0,1,0,0,,1.0,1,0,0,0,0,default,https://redd.it/wty4a6,The Future of UIUX Design Creativity on the Rise,Positive,0.3818
wu0ahb,bitcoinmarkets,distcrypto,1661090412,1661142765,0,0,0,0,1,0,1,0,0,,1.0,1,0,0,0,0,default,https://redd.it/wu0ahb,The Bitcoins price prediction for the end of 2022,Neutral,0.0
wu55a1,bitcoinmarkets,BravePromotion2887,1661102984,1661178595,0,0,0,0,1,0,1,0,0,,1.0,1,0,0,0,0,default,https://redd.it/wu55a1,Massive income for life,Neutral,0.0
wu57ai,bitcoinmarkets,Successful_Fereet,1661103112,1661227511,0,0,0,0,1,0,1,0,0,,0.44,0,0,0,1,0,default,https://redd.it/wu57ai,Crypto Stocks Slide in PreMarket Trading as Bitcoin Slumps to 216K More Downtrend Expected,Neutral,0.0
wu85wo,bitcoinmarkets,Michellesis,1661110602,1661178595,0,0,0,0,1,0,1,0,0,,1.0,1,0,0,0,0,default,https://redd.it/wu85wo,Making money while Bitcoin crashes,Neutral,0.0
wudyts,bitcoinmarkets,Living-Kindly,1661125534,1661178595,0,0,0,0,1,0,1,0,0,,1.0,1,0,0,0,0,default,https://redd.it/wudyts,Important price levels to watch in BTC,Positive,0.2023
wugcph,bitcoinmarkets,Top_Tip_3470,1661132129,1661192701,0,0,0,0,1,0,1,0,0,,1.0,1,0,0,0,0,default,https://redd.it/wugcph,Bitcoin Mining,Neutral,0.0
wujazg,bitcoinmarkets,AutoModerator,1661140813,1661227511,0,0,0,0,0,0,1,0,0,Daily Discussion,0.93,42,0,0,219,0,self,https://redd.it/wujazg,Daily Discussion Monday August 22 2022 Thread topics include but are not limited to General discussion related to the days events Technical analysis trading ideas strategies Quick questions that do not warrant a separate post Thread guidelines Be excellent to each other Do not make posts outside of the daily thread for the topics mentioned above Other ways to interact Get an invite to live chat on our Slack group,Positive,0.838
wutf0u,bitcoinmarkets,Gson07,1661174245,1661227512,0,0,0,0,1,0,1,0,0,,1.0,1,0,0,0,0,default,https://redd.it/wutf0u,STEP INTO THE REALM OF ESPORTS 30 BLOCKCHAIN GAMING,Neutral,0.0
wuz28c,bitcoinmarkets,tchance5,1661187769,1661248904,0,0,0,0,1,0,1,0,0,,1.0,1,0,0,0,0,default,https://redd.it/wuz28c,BTC Price Live Data,Neutral,0.0
wv2g0i,bitcoinmarkets,Medical-Twist4313,1661195782,1661248904,0,0,0,0,1,0,0,0,0,,1.0,1,0,0,1,0,default,https://redd.it/wv2g0i,Eranetworkmining Discover the most profitable mining Discovery,Positive,0.4927
wveln4,bitcoinmarkets,AutoModerator,1661227213,1661314135,0,0,0,0,0,0,1,0,0,Daily Discussion,0.93,34,0,0,158,0,self,https://redd.it/wveln4,Daily Discussion Tuesday August 23 2022 Thread topics include but are not limited to General discussion related to the days events Technical analysis trading ideas strategies Quick questions that do not warrant a separate post Thread guidelines Be excellent to each other Do not make posts outside of the daily thread for the topics mentioned above Other ways to interact Get an invite to live chat on our Slack group,Positive,0.838
wvj448,bitcoinmarkets,pratickdas,1661242980,1661290618,0,0,0,0,1,0,0,0,0,,1.0,1,0,0,0,0,default,https://redd.it/wvj448,Tornado Cash Rise and Fallout,Neutral,0.0
wvw1lc,bitcoinmarkets,Wdm0423,1661278933,1661330892,0,0,0,0,1,0,1,0,0,,1.0,1,0,0,0,0,default,https://redd.it/wvw1lc,BITBANK HAS SEIZED MY FUNDS,Neutral,0.0
wvy8x2,bitcoinmarkets,vnzdesiigner,1661284296,1661330892,0,0,0,0,1,0,1,0,0,,1.0,1,0,0,0,0,default,https://redd.it/wvy8x2,Is it an intelligent decision to make trades off of predictions of crypto pioneers such as Davincij15,Positive,0.4588
ww0t7e,bitcoinmarkets,StrikingThing8104,1661290522,1661337410,0,0,0,0,1,0,1,0,0,,1.0,1,0,0,0,0,default,https://redd.it/ww0t7e,Fundamentally Strong Do not forget to follow the thread,Positive,0.608
ww0zs7,bitcoinmarkets,superspiffychef,1661290975,1661337410,0,0,0,0,1,0,0,0,0,,1.0,1,0,0,0,0,default,https://redd.it/ww0zs7,DCI30 REPORT 08232022,Neutral,0.0
ww69w9,bitcoinmarkets,Qasim57,1661304868,1661373164,0,0,0,0,1,0,1,0,0,,1.0,1,0,0,0,0,default,https://redd.it/ww69w9,Suggestion Daily threads should be made at GMT 0000,Neutral,0.0
ww94mk,bitcoinmarkets,Flipmasterflex,1661313128,1661373164,0,0,0,0,1,0,1,0,0,,1.0,1,0,0,0,0,default,https://redd.it/ww94mk,You need help investing btceth currency message me Great opportunity best for the low income,Positive,0.9136
ww9adj,bitcoinmarkets,AutoModerator,1661313611,1661401407,0,0,0,0,0,0,1,0,0,Daily Discussion,0.84,33,0,1,167,0,self,https://redd.it/ww9adj,Daily Discussion Wednesday August 24 2022 Thread topics include but are not limited to General discussion related to the days events Technical analysis trading ideas strategies Quick questions that do not warrant a separate post Thread guidelines Be excellent to each other Do not make posts outside of the daily thread for the topics mentioned above Other ways to interact Get an invite to live chat on our Slack group,Positive,0.838
wwdza4,bitcoinmarkets,TheFlaridaMan,1661329924,1661401409,0,0,0,0,1,0,1,0,0,,0.22,0,0,0,6,0,default,https://redd.it/wwdza4,Need help with coinbase exchange I made a large mistake Offering 250k profit for immediate assistance,Positive,0.4939
wwfpth,bitcoinmarkets,btclovermyfriend,1661336196,1661401409,0,0,0,0,1,0,1,0,0,,1.0,1,0,0,0,0,default,https://redd.it/wwfpth,what will happen bitcoin,Neutral,0.0
wwfq18,bitcoinmarkets,btclovermyfriend,1661336220,1661401409,0,0,0,0,1,0,1,0,0,,1.0,1,0,0,0,0,default,https://redd.it/wwfq18,what is happen,Neutral,0.0
wwj6cu,bitcoinmarkets,wollet223,1661346623,1661401409,0,0,0,0,1,0,1,0,0,,1.0,1,0,0,0,0,default,https://redd.it/wwj6cu,TEAM LIJANCOIN,Neutral,0.0
wwqygi,bitcoinmarkets,BlackberryNo1850,1661365764,1661418338,0,0,0,0,1,0,1,0,0,,1.0,1,0,0,0,0,default,https://redd.it/wwqygi,Huobi USDT Standard Contract Trading,Neutral,0.0
wx3zge,bitcoinmarkets,AutoModerator,1661400010,1661489325,0,0,0,0,0,0,1,0,0,Daily Discussion,0.84,31,0,1,107,0,self,https://redd.it/wx3zge,Daily Discussion Thursday August 25 2022 Thread topics include but are not limited to General discussion related to the days events Technical analysis trading ideas strategies Quick questions that do not warrant a separate post Thread guidelines Be excellent to each other Do not make posts outside of the daily thread for the topics mentioned above Other ways to interact Get an invite to live chat on our Slack group,Positive,0.838
wx7wlp,bitcoinmarkets,ARFASOFTECH,1661413502,1661465175,0,0,0,0,1,0,1,0,0,,1.0,1,0,0,0,0,default,https://redd.it/wx7wlp,eCommerce Success in 2022 Futuristic,Positive,0.5719
wxcnl6,bitcoinmarkets,LightCompetitive5713,1661429728,1661489327,0,0,0,0,1,0,1,0,0,,1.0,1,0,0,0,0,default,https://redd.it/wxcnl6,THE POWER OF AI FOR FREE,Positive,0.5106
wxl8qd,bitcoinmarkets,Appropriate_Ad4087,1661451106,1661501120,0,0,0,0,1,0,0,0,0,,1.0,1,0,0,0,0,default,https://redd.it/wxl8qd,Antpool Were not happy until your not happy,Negative,-0.7181
wxor79,bitcoinmarkets,Okeyio,1661459703,1661519607,0,0,0,0,1,0,1,0,0,,1.0,1,0,0,0,0,default,https://redd.it/wxor79,Remint,Neutral,0.0
wxy9qt,bitcoinmarkets,Valuable_Kale_7519,1661484653,1661553741,0,0,0,0,1,0,1,0,0,,1.0,1,0,0,0,0,default,https://redd.it/wxy9qt,Anyone Have Tried Using EazyBot Crypto Trading Bot Is it working,Neutral,0.0
wxyuxl,bitcoinmarkets,AutoModerator,1661486411,1661574553,0,0,0,0,0,0,1,0,0,Daily Discussion,0.88,32,0,0,337,0,self,https://redd.it/wxyuxl,Daily Discussion Friday August 26 2022 Thread topics include but are not limited to General discussion related to the days events Technical analysis trading ideas strategies Quick questions that do not warrant a separate post Thread guidelines Be excellent to each other Do not make posts outside of the daily thread for the topics mentioned above Other ways to interact Get an invite to live chat on our Slack group,Positive,0.838
wy1y4s,bitcoinmarkets,xiaoheige,1661496444,1661553741,0,0,0,0,1,0,1,0,0,,1.0,1,0,0,0,0,default,https://redd.it/wy1y4s,How to Automate any Trading Strategy with TradingView and TVCbotTV Aler,Neutral,0.0
wy7q9r,bitcoinmarkets,guardarian_com,1661516379,1661574554,0,0,0,0,1,0,1,0,0,,1.0,1,0,0,0,0,default,https://redd.it/wy7q9r,Bitcoin has now transferred the equivalent of 100000000000000 without using a single bank,Neutral,0.0
wy7sbm,bitcoinmarkets,BigResponsible2335,1661516529,1661574554,0,0,0,0,1,0,1,0,0,,1.0,1,0,0,0,0,default,https://redd.it/wy7sbm,how to make money online trading crypto currency,Neutral,0.0
wy9nrl,bitcoinmarkets,mrginopalacca,1661521592,1661574554,0,0,0,0,0,0,0,0,0,,0.6,1,0,0,0,0,default,https://redd.it/wy9nrl,Option expiry settlement does not happen according to the PL chart,Neutral,0.0
wyjw3e,bitcoinmarkets,Franciisx4,1661547024,1661614323,0,0,0,0,1,0,1,0,0,,1.0,1,0,0,0,0,default,https://redd.it/wyjw3e,Over 41BTC was just liquidated Approx 850K Another massive claim Be careful out there,Positive,0.1531
wyniep,bitcoinmarkets,mix-bitcoin,1661556574,1661614323,0,0,0,0,1,0,1,0,0,,1.0,1,0,0,0,0,default,https://redd.it/wyniep,Stay anonymous Maintain your privacy on the Bitcoin network with our mixing service,Neutral,0.0
wysq02,bitcoinmarkets,cobet777,1661572046,1661619325,0,0,0,0,1,0,1,0,0,,1.0,1,0,0,0,0,default,https://redd.it/wysq02,Jackpot Mega crypoto Lotto,Neutral,0.0
wysyla,bitcoinmarkets,AutoModerator,1661572809,1661660829,0,0,0,0,0,0,1,0,0,Daily Discussion,0.92,34,0,2,256,0,self,https://redd.it/wysyla,Daily Discussion Saturday August 27 2022 Thread topics include but are not limited to General discussion related to the days events Technical analysis trading ideas strategies Quick questions that do not warrant a separate post Thread guidelines Be excellent to each other Do not make posts outside of the daily thread for the topics mentioned above Other ways to interact Get an invite to live chat on our Slack group,Positive,0.838
wz33ab,bitcoinmarkets,ARFASOFTECH,1661607465,1661660834,0,0,0,0,1,0,1,0,0,,1.0,1,0,0,0,0,default,https://redd.it/wz33ab,Metaverse and Cybersecurity On the Bank of Web Domination,Negative,-0.0516
wz7220,bitcoinmarkets,fhjxghjhvccc,1661617739,1661664740,0,0,0,0,1,0,1,0,0,,1.0,1,0,0,0,0,default,https://redd.it/wz7220,invest in Bitcoin today and change your life usdt is worth blowing mind WhatsApp 1 205 2259280,Positive,0.2263
wz727g,bitcoinmarkets,fhjxghjhvccc,1661617751,1661664740,0,0,0,0,1,0,1,0,0,,1.0,1,0,0,0,0,default,https://redd.it/wz727g,invest in Bitcoin today and change your life usdt is worth blowing mind WhatsApp 1 205 2259280,Positive,0.2263
wz72fk,bitcoinmarkets,fhjxghjhvccc,1661617769,1661664740,0,0,0,0,1,0,1,0,0,,1.0,1,0,0,0,0,default,https://redd.it/wz72fk,invest in Bitcoin today and change your life usdt is worth blowing mind WhatsApp 1 205 2259280,Positive,0.2263
wzl338,bitcoinmarkets,Diligent-Rub-9207,1661656504,1661725296,0,0,0,0,1,0,1,0,0,,0.66,1,0,0,0,0,default,https://redd.it/wzl338,Kevin OLeary reveals on Next Crypto Bull Run Bitcoin and Ethereum News,Neutral,0.0
wzly2t,bitcoinmarkets,AutoModerator,1661659212,1661745706,0,0,0,0,0,0,1,0,0,Daily Discussion,0.86,34,0,1,296,0,self,https://redd.it/wzly2t,Daily Discussion Sunday August 28 2022 Thread topics include but are not limited to General discussion related to the days events Technical analysis trading ideas strategies Quick questions that do not warrant a separate post Thread guidelines Be excellent to each other Do not make posts outside of the daily thread for the topics mentioned above Other ways to interact Get an invite to live chat on our Slack group,Positive,0.838
wzmxez,bitcoinmarkets,Tanima46,1661662452,1661725296,0,0,0,0,1,0,1,0,0,,1.0,1,0,0,0,0,default,https://redd.it/wzmxez,TridentProtocol,Neutral,0.0
wzr2ir,bitcoinmarkets,Sharp_9659,1661677956,1661745708,0,0,0,0,1,0,1,0,0,,1.0,1,0,0,0,0,default,https://redd.it/wzr2ir,So funny a thingso Bitcoin,Positive,0.4927
x05bx6,bitcoinmarkets,[deleted],1661718805,1661794571,0,0,0,0,1,1,0,0,0,,1.0,1,0,0,0,0,default,https://redd.it/x05bx6,Inflation Hedge or Not Bitcoins True Value Is Separation of Money and State,Negative,-0.5216
x0ey7e,bitcoinmarkets,AutoModerator,1661745613,1661794571,0,0,0,0,0,0,1,0,0,Daily Discussion,0.91,33,0,1,143,0,self,https://redd.it/x0ey7e,Daily Discussion Monday August 29 2022 Thread topics include but are not limited to General discussion related to the days events Technical analysis trading ideas strategies Quick questions that do not warrant a separate post Thread guidelines Be excellent to each other Do not make posts outside of the daily thread for the topics mentioned above Other ways to interact Get an invite to live chat on our Slack group,Positive,0.838
x0ho4t,bitcoinmarkets,Argus_News,1661754921,1661821523,0,0,0,0,1,0,1,0,0,,1.0,1,0,0,0,0,default,https://redd.it/x0ho4t,Bitcoin plunges below 20K may reach 10K level this year,Neutral,0.0258
x0u48o,bitcoinmarkets,AccidentalArbitrage,1661793089,1662026226,0,0,0,0,0,0,1,0,0,,0.64,4,0,0,3,0,self,https://redd.it/x0u48o,Would you use a BitcoinMarkets Discord This would replace the slack that is mostly dead if we decided to create one Moderation would be minimal other than fighting spam View Poll,Negative,-0.872
x12pdh,bitcoinmarkets,cyberfare,1661814198,1662026226,0,0,0,0,1,0,1,0,0,,1.0,1,0,0,1,0,default,https://redd.it/x12pdh,Bitcoin Updates,Neutral,0.0
x192o7,bitcoinmarkets,AutoModerator,1661832010,1662026226,0,0,0,0,0,0,1,0,0,Daily Discussion,0.91,40,0,0,280,0,self,https://redd.it/x192o7,Daily Discussion Tuesday August 30 2022 Thread topics include but are not limited to General discussion related to the days events Technical analysis trading ideas strategies Quick questions that do not warrant a separate post Thread guidelines Be excellent to each other Do not make posts outside of the daily thread for the topics mentioned above Other ways to interact Get an invite to live chat on our Slack group,Positive,0.838
x1cu3u,bitcoinmarkets,Mkplrh,1661845147,1662024468,0,0,0,0,0,0,0,0,0,,0.31,0,0,0,6,0,default,https://redd.it/x1cu3u,Will The 140000 BTC From Mt Gox Flood The Market Soon,Neutral,0.0
x23nx2,bitcoinmarkets,AutoModerator,1661918413,1662024468,0,0,0,0,0,0,1,0,0,Daily Discussion,0.94,42,0,2,235,0,self,https://redd.it/x23nx2,Daily Discussion Wednesday August 31 2022 Thread topics include but are not limited to General discussion related to the days events Technical analysis trading ideas strategies Quick questions that do not warrant a separate post Thread guidelines Be excellent to each other Do not make posts outside of the daily thread for the topics mentioned above Other ways to interact Get an invite to live chat on our Slack group,Positive,0.838
x2jtpm,bitcoinmarkets,Simple_Learn,1661967940,1662089243,0,0,0,0,0,0,0,0,0,,0.43,0,0,0,2,0,default,https://redd.it/x2jtpm,Bitcoin price prediction,Neutral,0.0
x2xo10,bitcoinmarkets,AutoModerator,1662004811,1662089243,0,0,0,0,0,0,1,0,0,Daily Discussion,0.92,39,0,0,156,0,self,https://redd.it/x2xo10,Daily Discussion Thursday September 01 2022 Thread topics include but are not limited to General discussion related to the days events Technical analysis trading ideas strategies Quick questions that do not warrant a separate post Thread guidelines Be excellent to each other Do not make posts outside of the daily thread for the topics mentioned above Other ways to interact Get an invite to live chat on our Slack group,Positive,0.838
x339fv,bitcoinmarkets,Alternative-Reason13,1662025235,1662089244,0,0,0,0,1,0,1,0,0,,1.0,1,0,0,0,0,default,https://redd.it/x339fv,UNCTAD,Neutral,0.0
x344il,bitcoinmarkets,AntAndStillStruggle,1662028315,1662089244,0,0,0,0,1,0,1,0,0,,1.0,1,0,0,0,0,default,https://redd.it/x344il,Hoping for the best,Positive,0.7906
x36ht7,bitcoinmarkets,Valuable_Kale_7519,1662035586,1662089244,0,0,0,0,1,0,0,0,0,,1.0,1,0,0,0,0,default,https://redd.it/x36ht7,Koen App Crypto Trading Bot Review How Koen Crypto Trading Bot Works and What Makes it Different from Other Crypto Trading Bots Available in the Market These Days,Neutral,0.0
x380su,bitcoinmarkets,poshcoin2022,1662039766,1662089244,0,0,0,0,1,0,1,0,0,,1.0,1,0,0,0,0,default,https://redd.it/x380su,POSHCOIN The Payment Token For Poshmarket,Neutral,0.0
x3bfy3,bitcoinmarkets,Nathanielgt69,1662048323,1662111572,0,0,0,0,1,0,1,0,0,,1.0,1,0,0,0,0,default,https://redd.it/x3bfy3,uzzimyftporg,Neutral,0.0
x3fg49,bitcoinmarkets,[deleted],1662058455,1662111572,0,0,0,0,1,0,1,0,0,,1.0,1,0,0,0,0,default,https://redd.it/x3fg49,I am happy with bulk tears,Positive,0.4215
x3gwln,bitcoinmarkets,Alternative-Reason13,1662062121,1662111572,0,0,0,0,1,0,1,0,0,,1.0,1,0,0,0,0,default,https://redd.it/x3gwln,ONU,Neutral,0.0
x3qwf9,bitcoinmarkets,MsVxxen,1662088994,1662133357,0,0,0,0,0,0,0,0,0,,0.4,0,0,0,1,0,default,https://redd.it/x3qwf9,HEADS UP BTC Down Rhyme Pattern Spotted 09012022,Neutral,0.0
x3rf9s,bitcoinmarkets,Ituglobal,1662090591,1662152121,0,0,0,0,1,0,1,0,0,,1.0,1,0,0,0,0,default,https://redd.it/x3rf9s,Bitcoin Struggles below 20500 as Sellers Resume Selling Pressure,Negative,-0.5719
x3rmmk,bitcoinmarkets,AutoModerator,1662091211,1662178988,0,0,0,0,0,0,1,0,0,Daily Discussion,0.91,45,0,0,161,0,self,https://redd.it/x3rmmk,Daily Discussion Friday September 02 2022 Thread topics include but are not limited to General discussion related to the days events Technical analysis trading ideas strategies Quick questions that do not warrant a separate post Thread guidelines Be excellent to each other Do not make posts outside of the daily thread for the topics mentioned above Other ways to interact Get an invite to live chat on our Slack group,Positive,0.838
x3wna3,bitcoinmarkets,Alternative-Reason13,1662109473,1662161202,0,0,0,0,1,0,1,0,0,,1.0,1,0,0,0,0,default,https://redd.it/x3wna3,Tokenizao,Neutral,0.0
x3yt1n,bitcoinmarkets,poshcoin2022,1662117193,1662178991,0,0,0,0,1,0,1,0,0,,1.0,1,0,0,0,0,default,https://redd.it/x3yt1n,POSHCOIN The Payment Token For Poshmarket,Neutral,0.0
x40qpc,bitcoinmarkets,sdccanuto,1662123032,1662178991,0,0,0,0,1,0,1,0,0,,1.0,1,0,0,0,0,default,https://redd.it/x40qpc,Artificial Intelligence for Predicting BTC prices,Positive,0.4767
x44n5g,bitcoinmarkets,[deleted],1662133116,1662178991,0,0,0,0,1,1,0,0,0,,0.5,0,0,0,0,0,default,https://redd.it/x44n5g,Simple Guide to Cryptocurrency Arbitrage,Neutral,0.0
x4avac,bitcoinmarkets,Alternative-Reason13,1662148613,1662196721,0,0,0,0,1,0,1,0,0,,1.0,1,0,0,0,0,default,https://redd.it/x4avac,Metais preciosos,Neutral,0.0
x4es1j,bitcoinmarkets,BroadviewDev2020,1662158845,1662211001,0,0,0,0,1,0,1,0,0,,1.0,1,0,0,0,0,default,https://redd.it/x4es1j,The Best Script Ever,Positive,0.6369
x4kyyt,bitcoinmarkets,AutoModerator,1662177613,1662265432,0,0,0,0,0,0,1,0,0,Daily Discussion,0.83,23,0,1,114,0,self,https://redd.it/x4kyyt,Daily Discussion Saturday September 03 2022 Thread topics include but are not limited to General discussion related to the days events Technical analysis trading ideas strategies Quick questions that do not warrant a separate post Thread guidelines Be excellent to each other Do not make posts outside of the daily thread for the topics mentioned above Other ways to interact Get an invite to live chat on our Slack group,Positive,0.838
x4oia0,bitcoinmarkets,Upbeat_Somewhere454,1662190264,1662254660,0,0,0,0,1,0,1,0,0,,0.66,1,0,0,0,0,default,https://redd.it/x4oia0,What is NFT Bitcoin Insurance,Neutral,0.0
x4pwzl,bitcoinmarkets,Alternative-Reason13,1662195889,1662254660,0,0,0,0,1,0,1,0,0,,1.0,1,0,0,0,0,default,https://redd.it/x4pwzl,Ferrovia verde,Neutral,0.0
x4q08m,bitcoinmarkets,Wisdom1812,1662196246,1662254660,0,0,0,0,1,0,1,0,0,,1.0,1,0,0,0,0,default,https://redd.it/x4q08m,FTX boss Sam BankmanFried believes that Bitcoin will soon recover why,Neutral,0.0
x4srom,bitcoinmarkets,Cryptoify-News,1662206559,1662254660,0,0,0,0,1,0,1,0,0,,1.0,1,0,0,0,0,default,https://redd.it/x4srom,Bitcoin Price Since 2016 7Year BTC Prices,Neutral,0.0
x4ucrc,bitcoinmarkets,Franzel-Pure-Net,1662211396,1662265432,0,0,0,0,0,0,1,0,0,,0.57,1,0,0,1,0,self,https://redd.it/x4ucrc,Looking for forex broker with a cent or micro account that offers BTCUSD with low spreads I have been looking around for forex brokers with a cent or micro account that offer BTCUSD with low spreads But all I have found so far are brokers with such ridiculous high spreads that a trader will be unable to even think of making any money or testing a strategy on a cent or micro account Does anyone know of any good brokers with low spreads for BTCUSD on cent or micro accounts,Negative,-0.4854
x52280,bitcoinmarkets,Alternative-Reason13,1662231737,1662284680,0,0,0,0,1,0,1,0,0,,1.0,1,0,0,0,0,default,https://redd.it/x52280,Hidrognio verde,Neutral,0.0
x58y6h,bitcoinmarkets,kingzmarketing,1662250608,1662306307,0,0,0,0,1,0,1,0,0,,1.0,1,0,0,0,0,default,https://redd.it/x58y6h,Proven Path To Becoming A Crypto Millionaire,Neutral,0.0
x59aew,bitcoinmarkets,naughtyharlot1,1662251594,1662306307,0,0,0,0,1,0,1,0,0,,1.0,1,0,0,0,0,default,https://redd.it/x59aew,Are you a software engineer looking for higher paying tech jobs to connect worldwide and improve your skills We have a higher paying job for you Drop a message on the comment section,Positive,0.2023
x5dcnh,bitcoinmarkets,AutoModerator,1662264013,1662351905,0,0,0,0,0,0,1,0,0,Daily Discussion,0.86,33,0,0,95,0,self,https://redd.it/x5dcnh,Daily Discussion Sunday September 04 2022 Thread topics include but are not limited to General discussion related to the days events Technical analysis trading ideas strategies Quick questions that do not warrant a separate post Thread guidelines Be excellent to each other Do not make posts outside of the daily thread for the topics mentioned above Other ways to interact Get an invite to live chat on our Slack group,Positive,0.838
x5dof6,bitcoinmarkets,Old-Dream-329,1662265040,1662322684,0,0,0,0,1,0,1,0,0,,1.0,1,0,0,0,0,default,https://redd.it/x5dof6,Is there a way to bet on BTC being a certain price on a certain date without having to worry about liquidations,Positive,0.6814
x5fvz7,bitcoinmarkets,kingzmarketing,1662272773,1662322684,0,0,0,0,1,0,1,0,0,,1.0,1,0,0,0,0,default,https://redd.it/x5fvz7,Proven Path To Becoming A Crypto Millionaire,Neutral,0.0
x5icdx,bitcoinmarkets,Alternative-Reason13,1662282077,1662351908,0,0,0,0,1,0,1,0,0,,1.0,1,0,0,0,0,default,https://redd.it/x5icdx,Mitologia e clima,Neutral,0.0
x5kc3i,bitcoinmarkets,BlackTroy300,1662289536,1662351908,0,0,0,0,1,0,1,0,0,,1.0,1,0,0,0,0,default,https://redd.it/x5kc3i,BTC wont move till Tuesday when the stock market opens Its so sad that BTC is acting like a tech stock You wont see anything till mid 2023 sorry too much going on BTC by December 31 21k22k,Negative,-0.4198
x5p2s1,bitcoinmarkets,Fabulous-Bid-5158,1662303741,1662351908,0,0,0,0,1,0,1,0,0,,1.0,1,0,0,0,0,default,https://redd.it/x5p2s1,You shouldnt miss this opportunity,Positive,0.571
x5v318,bitcoinmarkets,Alternative-Reason13,1662318792,1662373276,0,0,0,0,1,0,1,0,0,,1.0,1,0,0,0,0,default,https://redd.it/x5v318,Olhar em volta,Neutral,0.0
x65qzj,bitcoinmarkets,LackDramatic9179,1662348566,1662408324,0,0,0,0,1,0,1,0,0,,1.0,1,0,0,0,0,default,https://redd.it/x65qzj,hello,Neutral,0.0
