submission,subreddit,author,created,retrieved,edited,pinned,archived,locked,removed,deleted,is_self,is_video,is_original_content,link_flair_text,upvote_ratio,score,gilded,total_awards_received,num_comments,num_crossposts,thumbnail,shortlink,combined_text,sentiment,vader_score
rtbyi0,bitcoinmarkets,AutoModerator,1641013215,1641140473,0,0,0,0,0,0,1,0,0,Altcoin Discussion,0.72,3,0,0,6,0,self,https://redd.it/rtbyi0,Altcoin Discussion January 2022 Thread topics include but are not limited to Discussion related to recent events Technical analysis trading ideas strategies General questions about altcoins Thread guidelines Be excellent to each other All regular rules for this subreddit apply except for number 2 This and only this thread is exempt from the requirement that all discussion must relate to bitcoin trading This is for high quality discussion of altcoins All shilling or obvious pumpingdumping behavior will result in an immediate one day ban This is your only warning No discussion about specific ICOs Established coins only If youre not sure what kind of discussion belongs in this thread here are some example posts News TA and sentiment analysis are great too Other ways to interact Get an invite to live chat on our Slack group and check out the altcoins channel Daily Discussion for bitcoin only Daily Discussion Prior Altcoin Discussion Altcoin Discussion,Positive,0.5277
rtbyio,bitcoinmarkets,AutoModerator,1641013215,1641140473,0,0,0,0,0,0,1,0,0,Daily Discussion,0.92,49,0,2,259,0,self,https://redd.it/rtbyio,Daily Discussion Saturday January 01 2022 Thread topics include but are not limited to General discussion related to the days events Technical analysis trading ideas strategies Quick questions that do not warrant a separate post Thread guidelines Be excellent to each other Do not make posts outside of the daily thread for the topics mentioned above Other ways to interact Get an invite to live chat on our Slack group,Positive,0.838
rtgmma,bitcoinmarkets,MagnetoX2,1641032197,1641140473,0,0,0,0,1,0,1,0,0,,1.0,1,0,0,0,0,default,https://redd.it/rtgmma,Future Signals,Neutral,0.0
rtmsy2,bitcoinmarkets,wackdoodle59,1641054817,1641140473,0,0,0,0,1,0,1,0,0,,1.0,1,0,0,0,0,default,https://redd.it/rtmsy2,I created a Bitcoin dashboard streaming through YouTube for Bitcoin market traders and casual monitoring I cant post link but it can be found under the channel InfoDash Hope you all like it and Happy New Year to all Go Bitcoin,Positive,0.9331
rtortz,bitcoinmarkets,SollyHolly,1641060511,1641140473,0,0,0,0,1,0,1,0,0,,1.0,1,0,0,0,0,default,https://redd.it/rtortz,NFT Music Stream,Neutral,0.0
rtroe6,bitcoinmarkets,wolverinu_shiller,1641068745,1641140473,0,0,0,0,1,0,1,0,0,,1.0,1,0,0,0,0,default,https://redd.it/rtroe6,Things are about to explode over at the Wolverinu camp come and check it out wolverinutoken group ioappetherpairexplorer0xd860d2685b875ae34594caa3c44bc92231ee69d0 happynewyearfromwolverinu,Neutral,0.0
rts0yo,bitcoinmarkets,LaceyMacey143,1641069725,1641140473,0,0,0,0,1,0,1,0,0,,1.0,1,0,0,0,0,default,https://redd.it/rts0yo,NFT Music Stream,Neutral,0.0
rtt19d,bitcoinmarkets,LaceyMacey143,1641072542,1641140473,0,0,0,0,1,0,1,0,0,,1.0,1,0,0,0,0,default,https://redd.it/rtt19d,NFT Music Stream,Neutral,0.0
rtu0w0,bitcoinmarkets,[deleted],1641075281,1641140473,0,0,0,0,1,0,1,0,0,,1.0,1,0,0,0,0,default,https://redd.it/rtu0w0,The best Bitcoin Market Cycle Top Indicator is all of them,Positive,0.7184
rtxwx7,bitcoinmarkets,CryptoArnold1987,1641086484,1641140473,0,0,0,0,1,0,1,0,0,,1.0,1,0,0,0,0,default,https://redd.it/rtxwx7,Just made new bitcoin TA for today,Neutral,0.0
rtz9u5,bitcoinmarkets,-sureconnect,1641090631,1641140473,0,0,0,0,1,0,1,0,0,,1.0,1,0,0,0,0,default,https://redd.it/rtz9u5,How To Get Rich With Bitcoin Even If You Have No Clue About Technology,Positive,0.34
ru22zw,bitcoinmarkets,AutoModerator,1641099611,1641186427,0,0,0,0,0,0,1,0,0,Daily Discussion,0.9,37,0,3,309,0,self,https://redd.it/ru22zw,Daily Discussion Sunday January 02 2022 Thread topics include but are not limited to General discussion related to the days events Technical analysis trading ideas strategies Quick questions that do not warrant a separate post Thread guidelines Be excellent to each other Do not make posts outside of the daily thread for the topics mentioned above Other ways to interact Get an invite to live chat on our Slack group,Positive,0.838
ru6atk,bitcoinmarkets,Responsible_Clerk623,1641116134,1641186428,0,0,0,0,1,0,1,0,0,,1.0,1,0,0,1,0,default,https://redd.it/ru6atk,how to recover your lost fuds stolen by scams on line,Negative,-0.8519
ru721r,bitcoinmarkets,Used_Permission555,1641119465,1641186428,0,0,0,0,1,0,1,0,0,,1.0,1,0,0,1,0,default,https://redd.it/ru721r,The Most Expected ICO in the METAVERSE Platform BEST BOOM MetaFacebook META is ICO at PancakeSwap Contract 0xb9aebe0c931a13138a7b673f988b656e687878fb ONLY ICO AT PANCAKESWAP Name META ICO Metafacebook is at the forefront of the huge value Metaverse platform X10 x100 is super easy,Positive,0.9471
ruahwh,bitcoinmarkets,[deleted],1641133068,1641186428,0,0,0,0,1,0,1,0,0,,0.66,1,0,0,0,0,default,https://redd.it/ruahwh,BULLS vs BEARS using leverage,Neutral,0.0
ruar8a,bitcoinmarkets,SatsStacker69,1641133906,1641186427,1641169721,0,0,0,0,0,1,0,0,,0.8,22,0,0,45,0,self,https://redd.it/ruar8a,I built DCA Stack An Automated Dollar Cost Averaging Bot For Bitcoin and more Site love all the feedback nbsp Hey everyone I wanted to share an early look at a web app Ive been developing these past few months called DCA Stack Dollar Cost Averaging Stack DCA Stack is an automated dollar collar cost averaging bot that can purchase bitcoin and altcoins on over 100 exchanges Did I also mention that this is completely free to use nbsp I built this because I was fed up how difficult it was to Dollar Cost Average I wanted to use my favorite exchanges but found that they had outrageous fees for the recurring buy option The only options after that were costly services that would automate DCA or placing them manually like a peasant I figured there had to be a better way so I put some weekends into developing this web app to restore everyones purchasing power nbsp Its still a super early release of DCA Stack but its functional Id love to gather the communitys feedback thoughts and concerns so I can make this even better for everyone nbsp EDIT Just wanted to address one crucial detail on how this bot operates It works by API keys generated on the users exchange of choice It needs the ability to place orders and view account balances These permissions will allow it to place orders and display the portfolio dashboard We will NEVER need withdrawal permissions That is not necessary and should NEVER be allowed on crypto bots or in general for third party websites EDIT 2 Just wanted to thank everyone for their feedback I love all the issues the community has raised and totally understand the hesitancy with API keys Thank you everyone so much for the wonderful criticism,Positive,0.9938
rublhl,bitcoinmarkets,MotherFriendship9743,1641136503,1641186428,0,0,0,0,1,0,1,0,0,,1.0,1,0,0,0,0,default,https://redd.it/rublhl,Join JUMBO TICKET today and start earning,Positive,0.296
rue3i6,bitcoinmarkets,SongtapeDan,1641143447,1641194435,0,0,0,0,1,0,1,0,0,,1.0,1,0,0,0,0,default,https://redd.it/rue3i6,Lets rethink NFTs for music,Neutral,0.0
rufe46,bitcoinmarkets,[deleted],1641146903,1641194435,0,0,0,0,1,0,1,0,0,,1.0,1,0,0,0,0,default,https://redd.it/rufe46,Looking for Stoicai 6months to 1 year Experience,Neutral,0.0
rufg5u,bitcoinmarkets,[deleted],1641147051,1641194435,0,0,0,0,1,0,1,0,0,,1.0,1,0,0,0,0,default,https://redd.it/rufg5u,Looking Stoic account holders and their experience 6months to 1 year,Neutral,0.0
rutiis,bitcoinmarkets,AutoModerator,1641186023,1641272730,0,0,0,0,0,0,1,0,0,Daily Discussion,0.95,60,0,0,660,0,self,https://redd.it/rutiis,Daily Discussion Monday January 03 2022 Thread topics include but are not limited to General discussion related to the days events Technical analysis trading ideas strategies Quick questions that do not warrant a separate post Thread guidelines Be excellent to each other Do not make posts outside of the daily thread for the topics mentioned above Other ways to interact Get an invite to live chat on our Slack group,Positive,0.838
ruvnv4,bitcoinmarkets,Greatmarketer2002,1641193454,1641250184,0,0,0,0,1,0,1,0,0,,1.0,1,0,0,0,0,default,https://redd.it/ruvnv4,TheSolid PLATFORM IS HERE FOR YOU,Neutral,0.0
rv167o,bitcoinmarkets,Free_Bitcoin_Games,1641214769,1641271659,0,0,0,0,1,0,1,0,0,,1.0,1,0,0,0,0,default,https://redd.it/rv167o,Block escape,Negative,-0.296
rv1vkv,bitcoinmarkets,Ituglobal,1641216981,1641271659,0,0,0,0,1,0,1,0,0,,1.0,1,0,0,0,0,default,https://redd.it/rv1vkv,Cryptos Price Analysis January 1 January 7 2022 BTC XRP DOT LTC and LINK,Neutral,0.0
rv68vs,bitcoinmarkets,isitemjay,1641228993,1641272730,0,0,0,0,1,0,1,0,0,,1.0,1,0,0,0,0,default,https://redd.it/rv68vs,NFT Music Stream,Neutral,0.0
rv6se1,bitcoinmarkets,isitemjay,1641230376,1641280739,0,0,0,0,1,0,1,0,0,,1.0,1,0,0,0,0,default,https://redd.it/rv6se1,NFT Music Stream,Neutral,0.0
rve79p,bitcoinmarkets,The_Token_House,1641249630,1641295059,0,0,0,0,1,0,1,0,0,,1.0,1,0,0,0,0,default,https://redd.it/rve79p,The time has come 2022 I Satoshi Nakamoto reveal my identity,Neutral,0.0
rvf9ig,bitcoinmarkets,Novel_Association_64,1641252489,1641296714,0,0,0,0,1,0,1,0,0,,1.0,1,0,0,0,0,default,https://redd.it/rvf9ig,PokeMine inviting friends on discord has ended and we have selected the top 5 winners Congratulations Partying face For the winners contact us for the reward distribution within 5 to 7 business daysMoneymouth face Heco BSC PancakeSwap PlayToEarn Pokemon Metaverse,Positive,0.9633
rvgb0s,bitcoinmarkets,khaledbi,1641255383,1641308712,0,0,0,0,1,0,1,0,0,,0.6,1,0,0,0,0,default,https://redd.it/rvgb0s,Wise Review 2022 Cheap Money Transfers Fees Pros Cons,Positive,0.4767
rvlqky,bitcoinmarkets,Shrabonk3534,1641271066,1641317182,0,0,0,0,1,0,0,0,0,,1.0,1,0,0,0,0,default,https://redd.it/rvlqky,Uncommon Toads are growing up and learning to express themselves and are in the process of figuring out what theyre into and what works for them I love the idea of these Toads,Positive,0.7096
rvm5aa,bitcoinmarkets,AutoModerator,1641272411,1641319868,0,0,0,0,0,0,1,0,0,Daily Discussion,0.9,37,0,2,282,0,self,https://redd.it/rvm5aa,Daily Discussion Tuesday January 04 2022 Thread topics include but are not limited to General discussion related to the days events Technical analysis trading ideas strategies Quick questions that do not warrant a separate post Thread guidelines Be excellent to each other Do not make posts outside of the daily thread for the topics mentioned above Other ways to interact Get an invite to live chat on our Slack group,Positive,0.838
rvoh2n,bitcoinmarkets,Ituglobal,1641280448,1641329123,0,0,0,0,1,0,1,0,0,,1.0,1,0,0,0,0,default,https://redd.it/rvoh2n,Bitcoin Trades in a Tight Range a Price Breakdown or Rebound is Imminent,Neutral,0.0
rvp491,bitcoinmarkets,Jackery-Ashel,1641283026,1641329123,0,0,0,0,1,0,1,0,0,,1.0,1,0,0,0,0,default,https://redd.it/rvp491,Has anyone got back their lost Bitcoin beforeif no youre lagging behind,Negative,-0.6808
rvrx2p,bitcoinmarkets,The_Token_House,1641294491,1641342925,0,0,0,0,1,0,1,0,0,,1.0,1,0,0,0,0,default,https://redd.it/rvrx2p,Dismantling Freemasonry,Positive,0.0772
rvsckh,bitcoinmarkets,The_Token_House,1641296002,1641342925,0,0,0,0,1,0,1,0,0,,1.0,1,0,0,0,0,default,https://redd.it/rvsckh,BetU the bookmaker of the future,Neutral,0.0
rvsw3q,bitcoinmarkets,SoheilPakpour,1641297952,1641342925,0,0,0,0,1,0,1,0,0,,1.0,1,0,0,0,0,default,https://redd.it/rvsw3q,Drawing Support And Resistance Levels Explained For Beginners,Positive,0.4019
rvw2nh,bitcoinmarkets,Jackery-Ashel,1641307777,1641358981,0,0,0,0,1,0,1,0,0,,1.0,1,0,0,0,0,default,https://redd.it/rvw2nh,How can I recover my Bitcoin,Neutral,0.0
rvxj7j,bitcoinmarkets,Visual-Debate9657,1641311580,1641358981,0,0,0,0,1,0,1,0,0,,1.0,1,0,0,0,0,default,https://redd.it/rvxj7j,Start mining crypto today The best offer for Crypto mining equipment,Positive,0.6369
rvzhwr,bitcoinmarkets,cryptotalkbd86,1641316682,1641363601,0,0,0,0,1,0,1,0,0,,1.0,1,0,0,0,0,default,https://redd.it/rvzhwr,ALL THE SORROWS OF 2021 PLEASE SAY GOOD BYE IN 2022,Positive,0.516
rw06lc,bitcoinmarkets,Forward-Tap-4350,1641318462,1641363601,0,0,0,0,1,0,1,0,0,,1.0,1,0,0,0,0,default,https://redd.it/rw06lc,NEW NFT COLLECTION,Neutral,0.0
rw0nbh,bitcoinmarkets,PerspectiveFit4531,1641319647,1641445360,0,0,0,0,1,0,0,0,0,,1.0,1,0,0,0,0,default,https://redd.it/rw0nbh,Nice Read,Positive,0.4215
rw3yjf,bitcoinmarkets,Historical-Mission45,1641328335,1641386261,0,0,0,0,1,0,1,0,0,,1.0,1,0,0,0,0,default,https://redd.it/rw3yjf,STREAMER PROJECT OVERVIEW,Neutral,0.0
rw6dxa,bitcoinmarkets,Gips_jv,1641334708,1641386261,0,0,0,0,1,0,1,0,0,,1.0,1,0,0,0,0,default,https://redd.it/rw6dxa,Italy the new place to be for big cashouts from cryptocurrencies,Neutral,0.0
rw8yu2,bitcoinmarkets,Sfogle96,1641341936,1641386261,0,0,0,0,1,0,1,0,0,,1.0,1,0,0,0,0,default,https://redd.it/rw8yu2,ROLLERCOIN Passive Income,Positive,0.2023
rweo3r,bitcoinmarkets,AutoModerator,1641358809,1641445360,0,0,0,0,0,0,1,0,0,Daily Discussion,0.92,52,0,2,1175,0,self,https://redd.it/rweo3r,Daily Discussion Wednesday January 05 2022 Thread topics include but are not limited to General discussion related to the days events Technical analysis trading ideas strategies Quick questions that do not warrant a separate post Thread guidelines Be excellent to each other Do not make posts outside of the daily thread for the topics mentioned above Other ways to interact Get an invite to live chat on our Slack group,Positive,0.838
rwfyy5,bitcoinmarkets,Free_Bitcoin_Games,1641363180,1641410185,0,0,0,0,1,0,1,0,0,,1.0,1,0,0,0,0,default,https://redd.it/rwfyy5,Block escape,Negative,-0.296
rwluyf,bitcoinmarkets,Sfogle96,1641385886,1641445360,0,0,0,0,1,0,1,0,0,,1.0,1,0,0,0,0,default,https://redd.it/rwluyf,CryptoWin Passive Income,Positive,0.2023
rwubz5,bitcoinmarkets,Significant_Field575,1641409389,1641455372,0,0,0,0,1,0,1,0,0,,1.0,1,0,0,0,0,default,https://redd.it/rwubz5,TIP to make Millions Dollars BUY OTC TICKER PHIL ONLY interested a penny headed to 100 BY February BUY IT NOW U will thank me GET it while its A penny and become a Millionaire ticker is PHIL,Positive,0.6369
rwy6yk,bitcoinmarkets,AdThis4353,1641420721,1641467246,0,0,0,0,1,0,1,0,0,,1.0,1,0,0,0,0,default,https://redd.it/rwy6yk,The most profitable Crypto Mining Equipment on the market Huge discounts,Positive,0.6697
rx64hd,bitcoinmarkets,AutoModerator,1641445212,1641520202,0,0,0,0,0,0,1,0,0,Daily Discussion,0.96,52,0,1,708,0,self,https://redd.it/rx64hd,Daily Discussion Thursday January 06 2022 Thread topics include but are not limited to General discussion related to the days events Technical analysis trading ideas strategies Quick questions that do not warrant a separate post Thread guidelines Be excellent to each other Do not make posts outside of the daily thread for the topics mentioned above Other ways to interact Get an invite to live chat on our Slack group,Positive,0.838
rx84kr,bitcoinmarkets,SirCheeb,1641451956,1641500199,0,0,0,0,1,0,1,0,0,,1.0,1,0,0,0,0,default,https://redd.it/rx84kr,Crypto Domain Bought on a Whim Is it hot garbage or is it useable,Neutral,0.0
rx8ulr,bitcoinmarkets,nsboatengn,1641454773,1641500199,0,0,0,0,1,0,1,0,0,,1.0,1,0,0,0,0,default,https://redd.it/rx8ulr,All the Cryptos will never miss ruyiwallet Gems in the making The team is fully doxxed wallet beta version is already out lots of partnership ongoing Amazon Web Services Apple Google Cloud and lot bnb cryptowallet eth nft BSCGem btc ruyiarmy pancakcakewap,Positive,0.2833
rx921j,bitcoinmarkets,SilverLineSwap_,1641455579,1641500199,0,0,0,0,1,0,1,0,0,,1.0,1,0,0,0,0,default,https://redd.it/rx921j,We Need Your Valuable Votes,Positive,0.4767
rxazjy,bitcoinmarkets,MikeygoesCrypto,1641463228,1641508958,0,0,0,0,1,0,1,0,0,,1.0,1,0,0,0,0,default,https://redd.it/rxazjy,PARABOLIC CRYPTO AIRDROPS ETH ZKSYNC OPTIMISM AVAX MATIC CELO SOL XDAI V,Positive,0.5423
rxby6t,bitcoinmarkets,PaperProfit,1641466847,1641520203,0,0,0,0,0,0,1,0,0,,0.89,54,0,0,20,1,self,https://redd.it/rxby6t,I analyzed all RSI movements of the past 52 months and this is what I found I analyzed all RSI range movements 30 70 of BTC of the past 52 months on the daily chart and realised that each time the RSI drops near to or below 30 oversold the price of BTC reverses and rises again Currently BTC is at the bottom of the range again which begs the question whether the price will rise again Check my analysis,Neutral,0.0
rxceyv,bitcoinmarkets,toolboxreviewsnmore,1641468530,1641520203,0,0,0,0,1,0,1,0,0,,0.66,1,0,0,0,0,default,https://redd.it/rxceyv,Exynox Scalper Highly Converting Forex Product MT4 MT5 by Karl Dittman,Neutral,0.0
rxcpyy,bitcoinmarkets,Souzamari,1641469639,1641520203,0,0,0,0,1,0,1,0,0,,1.0,1,0,0,0,0,default,https://redd.it/rxcpyy,FOR ALL AND PAY ATTENTION TO THIS MESSAGE The solution to your problem has arrived,Negative,-0.368
rxelaj,bitcoinmarkets,AdaptiveStrike1,1641475651,1641520203,0,0,0,0,1,0,0,0,0,,1.0,1,0,0,0,0,default,https://redd.it/rxelaj,Its heartbreaking to see an industry overrun,Negative,-0.4588
rxfhxo,bitcoinmarkets,SoheilPakpour,1641478327,1641523053,0,0,0,0,1,0,1,0,0,,1.0,2,0,0,0,0,default,https://redd.it/rxfhxo,Dragon Pattern Trading Strategy,Neutral,0.0
rxhc1e,bitcoinmarkets,Due-Egg-8113,1641483273,1641531912,0,0,0,0,1,0,1,0,0,,0.17,0,0,0,0,0,default,https://redd.it/rxhc1e,Lbank is legit for your Bitcoin which gives you 609 APY,Neutral,0.0
rxhsln,bitcoinmarkets,Henrybizness,1641484521,1641531912,0,0,0,0,1,0,1,0,0,,1.0,1,0,0,0,0,default,https://redd.it/rxhsln,Get 10 in Bitcoin completely free,Positive,0.5563
rxjack,bitcoinmarkets,Many-Host7561,1641488445,1641548160,0,0,0,0,1,0,1,0,0,,1.0,1,0,0,0,0,default,https://redd.it/rxjack,NFT Music Stream,Neutral,0.0
rxjy7r,bitcoinmarkets,Nasir18018,1641490192,1641548160,0,0,0,0,1,0,1,0,0,,1.0,1,0,0,0,0,default,https://redd.it/rxjy7r,Los Pobres coin,Neutral,0.0
rxno66,bitcoinmarkets,BigTechBank,1641499701,1641548160,0,0,0,0,1,0,1,0,0,,1.0,1,0,0,0,0,default,https://redd.it/rxno66,Why Breaks Play An Important Role In Trading Career,Positive,0.4939
rxquhz,bitcoinmarkets,MikeygoesCrypto,1641508175,1641560676,0,0,0,0,1,0,1,0,0,,1.0,1,0,0,0,0,default,https://redd.it/rxquhz,20 MOONSHOT ALTS CRO AVAX ETH SOL ALGO DOT FACTR 5IRE GASDAO ICEDAO TIP,Neutral,0.0
rxv8p6,bitcoinmarkets,Themuzzman,1641519973,1641568744,0,0,0,0,1,0,1,0,0,"Removed - Belongs in /r/bitcoin, /r/btc or /r/BitcoinSerious",0.6,2,0,0,1,0,default,https://redd.it/rxv8p6,Bitcoin Conference UNCONFISCATABLE Now ON SALE March 3rd6th Las Vegas,Neutral,0.0
rxw36r,bitcoinmarkets,BitcoinBiskit,1641522351,1641568081,0,0,0,0,1,0,1,0,0,,1.0,1,0,0,0,0,default,https://redd.it/rxw36r,Avoid BITTREX like the plague,Positive,0.0772
rxz8ax,bitcoinmarkets,AutoModerator,1641531625,1641586659,0,0,0,0,0,0,1,0,0,Daily Discussion,1.0,51,0,4,785,0,self,https://redd.it/rxz8ax,Daily Discussion Friday January 07 2022 Thread topics include but are not limited to General discussion related to the days events Technical analysis trading ideas strategies Quick questions that do not warrant a separate post Thread guidelines Be excellent to each other Do not make posts outside of the daily thread for the topics mentioned above Other ways to interact Get an invite to live chat on our Slack group,Positive,0.838
ry3ip1,bitcoinmarkets,Electronic-Rice-9871,1641547516,1641592103,0,0,0,0,1,0,1,0,0,,1.0,1,0,0,0,0,default,https://redd.it/ry3ip1,The Forex system for success,Positive,0.5719
ry3ude,bitcoinmarkets,AlexWasTakenWasTaken,1641548811,1641595925,0,0,0,0,0,0,1,0,0,,0.86,66,0,3,27,0,self,https://redd.it/ry3ude,Were still in a wyckoff accumulation keep calm I posted this here a month ago Over a month ago when we flash crashed and wicked down to 42k I predicted we would enter a wyckoff accumulation phase with a rangebinding from 52k to 40k I also posted it here and its interesting to see the comments back then and the sentiment change to now I did chart this on December 5th on Tradingview and defined the upper range to be 52k the lower range to be 40k The prediction held up nicely so far click the play button on the chart Id love to know what the sentiment to this analysis is right now What do you think Is this prediction correct Are we having a spring phase or a secondary test right now Will we stay range bound above 40k Personally I stick to my predictions so I hedged shorted part of my portfolio at 52k and gradually unhedged my short positions down to 42k I can see how much fear and bearish sentiment were having right now and thats making me believe weve hit the bottom soon Most of retail has left and institutions have little supply to accumulate,Positive,0.6908
ry42b1,bitcoinmarkets,Alex3220,1641549697,1641595925,0,0,0,0,1,0,1,0,0,,1.0,1,0,0,0,0,default,https://redd.it/ry42b1,ALEXTECHIESS on WhatsApp707 4567172 WORDS ARE NOT ENOUGH TO EXPRESS MY GRATITUDE TOWARDS YOUR KINDNESS TO OUR FAMILY WE ALL SAY THANK YOU VERY MUCH FOR MAKING MY BITCOIN TO GROUP FROM 2K TO 5K I APPRECIATE YOUR KINDNESS TO MY FAMILY ILL TELL THE WORLD ABOUT YOU,Positive,0.9396
ry6t3y,bitcoinmarkets,Money_Difficulty6880,1641560239,1641606374,0,0,0,0,1,0,1,0,0,,1.0,1,0,0,0,0,default,https://redd.it/ry6t3y,Roar ROAR 7k Marketcap liquidity locked for 10 years,Neutral,0.0
ry7jmx,bitcoinmarkets,daviddme,1641562691,1641618316,0,0,0,0,1,0,1,0,0,,1.0,1,0,0,0,0,default,https://redd.it/ry7jmx,The BEST Indicator On TradingView Squeeze Momentum Indicator Strategy Lazybear,Positive,0.7125
ry7p3r,bitcoinmarkets,titsclitsntennerbits,1641563122,1641618315,0,0,0,0,0,0,0,0,0,,1.0,1,0,0,1,0,default,https://redd.it/ry7p3r,The only P2P nonID marketplace that lives up to Coinbase EToro etc,Neutral,0.0
ry97x0,bitcoinmarkets,SavingsJust5817,1641567403,1641618316,0,0,0,0,1,0,1,0,0,,1.0,1,0,0,0,0,default,https://redd.it/ry97x0,Fear Anticipation levels in BTCNotice anything interesting,Neutral,-0.0258
ry99pj,bitcoinmarkets,SteffieMeister,1641567540,1641618316,0,0,0,0,1,0,1,0,0,,1.0,1,0,0,0,0,default,https://redd.it/ry99pj,The Secret Order of Lumiiis A Web3 Tween ActionComedy Series Trailer,Neutral,0.0
ry9a4r,bitcoinmarkets,SteffieMeister,1641567571,1641618316,0,0,0,0,1,0,1,0,0,,1.0,1,0,0,0,0,default,https://redd.it/ry9a4r,The Secret Order of Lumiiis A Web3 Tween ActionComedy Series Trailer,Neutral,0.0
ry9kqa,bitcoinmarkets,SteffieMeister,1641568304,1641618316,0,0,0,0,1,0,1,0,0,,1.0,1,0,0,0,0,default,https://redd.it/ry9kqa,The Secret Order of Lumiiis A Web3 Tween ActionComedy Series Trailer,Neutral,0.0
