submission,subreddit,author,created,retrieved,edited,pinned,archived,locked,removed,deleted,is_self,is_video,is_original_content,link_flair_text,upvote_ratio,score,gilded,total_awards_received,num_comments,num_crossposts,thumbnail,shortlink,combined_text,sentiment,vader_score
uju7yd,bitcoinmarkets,WillGoNameless,1651862544,1651983603,0,0,0,0,0,0,1,0,0,,0.67,5,0,0,0,0,self,https://redd.it/uju7yd,LongShort Strategy AI Trading Strategy in Action A recent report published by CryptoHawk AI showcases their best strategy to trading Bitcoin Looks like that ideal strategy may be to use a stopGain and StopLoss With the report that they back tested the data it indicated that a Threshold at 12 4 was the best performing option that they saw Have a read of the article Might be an interesting strategy to follow if you use their predictive AI tools to notify you of their predictions,Positive,0.9517
ujxvp7,bitcoinmarkets,binary_option_survey,1651872703,1651917630,0,0,0,0,1,0,1,0,0,,1.0,1,0,0,0,0,default,https://redd.it/ujxvp7,Help graduate students with academic survey regarding crypto,Positive,0.4019
uk1ray,bitcoinmarkets,otmanfreeman,1651884649,1651949561,0,0,0,0,1,0,1,0,0,,1.0,1,0,0,0,0,default,https://redd.it/uk1ray,The price of bitcoin is down today to about 36K,Neutral,0.0
uk46jk,bitcoinmarkets,ABCchain,1651892859,1651949561,0,0,0,0,1,0,1,0,0,,1.0,1,0,0,0,0,default,https://redd.it/uk46jk,How to make 1 million fast in two years,Neutral,0.0
uk517n,bitcoinmarkets,AutoModerator,1651896009,1651983603,0,0,0,0,0,0,1,0,0,Daily Discussion,0.86,36,0,2,223,0,self,https://redd.it/uk517n,Daily Discussion Saturday May 07 2022 Thread topics include but are not limited to General discussion related to the days events Technical analysis trading ideas strategies Quick questions that do not warrant a separate post Thread guidelines Be excellent to each other Do not make posts outside of the daily thread for the topics mentioned above Other ways to interact Get an invite to live chat on our Slack group,Positive,0.838
uk8tib,bitcoinmarkets,hyperfreeto,1651911782,1651978091,0,0,0,0,1,0,1,0,0,,1.0,1,0,0,0,0,default,https://redd.it/uk8tib,Is Bitcoin below 30k coming,Neutral,0.0
uka1hf,bitcoinmarkets,Raphae1,1651917405,1651978091,0,0,0,0,1,0,1,0,0,,1.0,1,0,0,0,0,default,https://redd.it/uka1hf,Does anybody know why USDTTRY on Binance is 17 higher than USDTRY on Forex,Neutral,0.0
ukj08u,bitcoinmarkets,discoxelik,1651947195,1651995259,0,0,0,0,1,0,1,0,0,,1.0,1,0,0,0,0,default,https://redd.it/ukj08u,Did this really happen to Michael Saylor,Neutral,0.0
ukl2o5,bitcoinmarkets,Crypto_holder10384,1651953499,1652004292,0,0,0,0,1,0,1,0,0,,1.0,1,0,0,0,0,default,https://redd.it/ukl2o5,My group for crypto calls 1 free callmonth,Positive,0.5106
ukrxjt,bitcoinmarkets,JamFtw,1651975968,1652024286,0,0,0,0,1,0,1,0,0,,1.0,1,0,0,0,0,default,https://redd.it/ukrxjt,CryptoNFT Investment Portfolio Tracker Template for Excel Cryptocurrencies NFTs and more Live Data Calculations Including Scan Result Link,Positive,0.4588
uktngv,bitcoinmarkets,AutoModerator,1651982411,1652043977,0,0,0,0,0,0,1,0,0,Daily Discussion,0.9,38,0,2,403,0,self,https://redd.it/uktngv,Daily Discussion Sunday May 08 2022 Thread topics include but are not limited to General discussion related to the days events Technical analysis trading ideas strategies Quick questions that do not warrant a separate post Thread guidelines Be excellent to each other Do not make posts outside of the daily thread for the topics mentioned above Other ways to interact Get an invite to live chat on our Slack group,Positive,0.838
ukuk9f,bitcoinmarkets,yarrowy,1651986139,1652043978,0,0,0,0,0,0,1,0,0,,0.72,3,0,0,7,0,self,https://redd.it/ukuk9f,Is there a Bitcoin defi exchange Hey so with the bear market I want to convert some of my BTC to stable coins and wait for a good chance to rebuy I know I can send my BTC to a centralized exchange like Kucoin then sell for USDT but is there a defi exchange similar to uniswap that is available for bitcoin maybe on the lightning network or something,Positive,0.6059
ukwcha,bitcoinmarkets,elchino780,1651993907,1652043978,0,0,0,0,1,0,1,0,0,,1.0,1,0,0,0,0,default,https://redd.it/ukwcha,best cryptocurrency exchange that has the least got involvement of FINTRAC asking questions about what were using it for,Positive,0.6369
ukwkft,bitcoinmarkets,yawnsz,1651994904,1652043978,1651995100,0,0,0,0,0,1,0,0,,0.17,0,0,0,3,0,self,https://redd.it/ukwkft,Hi Im new to the live crypto market Hello Im yawnsz Ive worked with other coins such as BNB and XRP in the past via small trades done using ingame currencies Lately Ive been seeing quite some demand in Bitcoin and some of my mates told me that it was worth trying in the market So there I went got a bitFlyer account JP Legit and joined Lightning which is basically their rebrand of the live market x200B The dashboard looks like this Screenshot lightningbitflyercom The special section looks like this Screenshot localhost But Ive been having some issues with using SPECIAL purchases section which cover the following IFD If two orders are made at the same time and the first one is filled then the second order is automatically placed OCO When two orders are made at the same time and one is completed the other side is automatically canceled IFDOCO IFDOCO is a combination of the IFD and OCO patterns After an IFD order is filled the OCO order is automatically placed With those there are these certain options which I just simply didnt understand and are most likely an issue LIMIT MARKET STOP STOPLIMIT TRAILING I tried researching about those but I cant find anything about them please help The dashboard included this website with some definitions but I didnt fully understand it My brain got some context at stoplimit and market Im assuming stoplimit softlocks after the coin reaches a critical amount and market is the current market price but what on earth would be trailing x200B Edit URL Fix new information,Positive,0.9086
uky2tt,bitcoinmarkets,Steve_1982,1652002031,1652069085,0,0,0,0,1,0,1,0,0,,1.0,1,0,0,0,0,default,https://redd.it/uky2tt,Should you be buying Bitcoin on the 8th of May 2022,Neutral,0.0
ukyl3l,bitcoinmarkets,Prestigious201da,1652004411,1652069085,0,0,0,0,1,0,1,0,0,,1.0,1,0,0,0,0,default,https://redd.it/ukyl3l,NFT minting bot MintAIO,Neutral,0.0
ul3ja2,bitcoinmarkets,Careless-Anywhere-48,1652021999,1652069085,0,0,0,0,1,0,1,0,0,,1.0,1,0,0,0,0,default,https://redd.it/ul3ja2,New site that lets you mine Bitcoin from your phone,Neutral,0.0
ul50w6,bitcoinmarkets,Prestigious201da,1652026251,1652073185,0,0,0,0,1,0,1,0,0,,1.0,1,0,0,0,0,default,https://redd.it/ul50w6,NFT minting bot MintAIO 2022,Neutral,0.0
ulartt,bitcoinmarkets,LokiPokee,1652042721,1652122066,0,0,0,0,1,0,1,0,0,,0.44,0,0,0,0,0,default,https://redd.it/ulartt,Vital Energy VUXV going to explode by end of month Epic DD post Debt free trading at 1x cash flow Huge Q1 financials coming end of month,Positive,0.7506
uliqpv,bitcoinmarkets,AutoModerator,1652068852,1652122066,0,0,0,0,0,0,1,0,0,Daily Discussion,0.86,40,0,2,743,0,self,https://redd.it/uliqpv,Daily Discussion Monday May 09 2022 Thread topics include but are not limited to General discussion related to the days events Technical analysis trading ideas strategies Quick questions that do not warrant a separate post Thread guidelines Be excellent to each other Do not make posts outside of the daily thread for the topics mentioned above Other ways to interact Get an invite to live chat on our Slack group,Positive,0.838
uljdwe,bitcoinmarkets,Greatmarketers2002,1652071280,1652120056,0,0,0,0,1,0,1,0,0,,1.0,1,0,0,0,0,default,https://redd.it/uljdwe,HELLO GLOBAL AUDIENCE TARGET,Neutral,0.0
ulpdmf,bitcoinmarkets,Youright817,1652096841,1652149199,0,0,0,0,1,0,1,0,0,,1.0,1,0,0,0,0,default,https://redd.it/ulpdmf,Lets go mine some free bitcoins with me Join with the link,Positive,0.6705
ulrkse,bitcoinmarkets,cord0nbleu,1652103843,1652149199,0,0,0,0,1,0,1,0,0,,1.0,1,0,0,0,0,default,https://redd.it/ulrkse,Just x2 leverage trading current BTC prices is this such a bad idea,Negative,-0.5423
ulu5hz,bitcoinmarkets,Gomez3570,1652111110,1652156708,0,0,0,0,1,0,1,0,0,,1.0,1,0,0,0,0,default,https://redd.it/ulu5hz,CFXN worlds best Crypto and Fiat Exchange ll Next Generation Exchange CFXN,Positive,0.6369
ulwa6b,bitcoinmarkets,PeleMaradona,1652116798,1652172344,0,0,0,0,1,0,1,0,0,,1.0,1,0,0,0,0,default,https://redd.it/ulwa6b,During times of high volatility and uncertainty what bitcoin indicators and metrics do you check and follow,Negative,-0.34
uly7b5,bitcoinmarkets,o1pa1,1652122019,1652197495,0,0,0,0,0,0,0,0,0,,0.83,48,0,0,13,0,default,https://redd.it/uly7b5,If you didnt freak out at the May 2021 crash you shouldnt freak out now These are the same prices you missed during the May fall and the market is now providing you with another opportunity,Positive,0.4043
um0b21,bitcoinmarkets,Ok-Fisherman-9014,1652127652,1652180116,0,0,0,0,1,0,1,0,0,,1.0,1,0,0,0,0,default,https://redd.it/um0b21,In a strong consensusSafety is always the first prioritySince the White House issued Order No10 of the Security Memorandum on May 4 cryptocurrencies have been falling for six consecutive years It is obvious that large households are beginning to flee and the bottomless future is unpredictable,Positive,0.6249
um12ex,bitcoinmarkets,GabriellaSadie55,1652129678,1652197495,0,0,0,0,1,0,1,0,0,,0.74,5,0,0,1,0,default,https://redd.it/um12ex,BIS says 90 of Banks are trying to explore digital currencies like Bitcoin What do you think about this,Positive,0.3612
um1p9v,bitcoinmarkets,wannabechampfx,1652131331,1652180116,0,0,0,0,1,0,1,0,0,,1.0,1,0,0,0,0,default,https://redd.it/um1p9v,Crypto WHY What is a BEAR Market Are we in one WTF is happening,Negative,-0.6739
um2pk5,bitcoinmarkets,Remarkable_News2455,1652134065,1652188498,0,0,0,0,1,0,1,0,0,,1.0,1,0,0,0,0,default,https://redd.it/um2pk5,Looking at such a market when do you think BTC will reach 100000,Neutral,0.0258
um3fjn,bitcoinmarkets,kingalgernon74,1652136041,1652188498,0,0,0,0,1,0,1,0,0,,1.0,1,0,0,0,0,default,https://redd.it/um3fjn,GET FREE MONEY,Positive,0.5106
um75lc,bitcoinmarkets,Proud-Discipline9902,1652147193,1652197496,0,0,0,0,1,0,1,0,0,"Removed - Belongs in /r/bitcoin, /r/btc or /r/BitcoinSerious",0.76,2,0,0,1,0,default,https://redd.it/um75lc,SBIs Japanese ECommerce Site to Allow Crypto Payments With BTC XRP,Positive,0.2263
um9qsq,bitcoinmarkets,AutoModerator,1652155211,1652211547,0,0,0,0,0,0,1,0,0,Daily Discussion,0.91,41,0,0,316,0,self,https://redd.it/um9qsq,Daily Discussion Tuesday May 10 2022 Thread topics include but are not limited to General discussion related to the days events Technical analysis trading ideas strategies Quick questions that do not warrant a separate post Thread guidelines Be excellent to each other Do not make posts outside of the daily thread for the topics mentioned above Other ways to interact Get an invite to live chat on our Slack group,Positive,0.838
umd2ub,bitcoinmarkets,JaysEntrepreneurship,1652167696,1652245201,0,0,0,0,1,0,1,0,0,,1.0,1,0,0,0,0,default,https://redd.it/umd2ub,LEARN HOW TO BUILD YOUR WEALTH TODAY WITH CRYPTOCURRENCY USING OUR N1 MUST HAVE INDEPTH CRYPTO COURSE CRYPTOCURRENCY SECRETS,Positive,0.7269
umf6d5,bitcoinmarkets,Muddather,1652176952,1652245201,0,0,0,0,1,0,1,0,0,,1.0,1,0,0,0,0,default,https://redd.it/umf6d5,advice me experts,Neutral,0.0
umhivd,bitcoinmarkets,Effective_Research34,1652185591,1652245201,0,0,0,0,1,0,1,0,0,,1.0,1,0,0,0,0,default,https://redd.it/umhivd,NFT ART GENERATOR 2022,Neutral,0.0
umka9h,bitcoinmarkets,Vinzkittie06,1652193704,1652245201,0,0,0,0,1,0,1,0,0,,0.66,1,0,0,0,0,default,https://redd.it/umka9h,How Ethereum secretly became KING of CRYPTO and nobody noticed,Neutral,0.0
umli4h,bitcoinmarkets,wattumofficial,1652196968,1652245200,0,0,0,0,0,0,0,0,0,,0.5,0,0,0,1,0,default,https://redd.it/umli4h,Wattum Expands US Presence with 14 MW Bitcoin Mining Facility in Georgia,Positive,0.1027
umnvq9,bitcoinmarkets,MACKO-crypto,1652203385,1652263650,0,0,0,0,1,0,1,0,0,,1.0,1,0,0,0,0,default,https://redd.it/umnvq9,Bitcoin Exchange KuCoin Now Worth 10 Billion After 150 Million Investment,Positive,0.2263
umq2sv,bitcoinmarkets,Alayna476,1652209428,1652263650,0,0,0,0,1,0,1,0,0,,0.85,32,0,0,6,0,default,https://redd.it/umq2sv,As El Salvador Buys 500 Bitcoins Is now the best time to purchase Bitcoin Is Bitcoin really the currency of the future,Positive,0.6369
umq4cy,bitcoinmarkets,Open-Change-7775,1652209548,1652263650,0,0,0,0,1,0,1,0,0,,1.0,1,0,0,0,0,default,https://redd.it/umq4cy,NFT ART GENERATOR 2022,Neutral,0.0
un0gxw,bitcoinmarkets,StoneySwiper,1652239963,1652289644,0,0,0,0,1,0,1,0,0,,1.0,1,0,0,0,0,default,https://redd.it/un0gxw,Bitcoin Wallet Glitch on Exodus,Neutral,0.0
un0y3v,bitcoinmarkets,AutoModerator,1652241609,1652292075,0,0,0,0,0,0,1,0,0,Daily Discussion,0.94,43,0,2,585,0,self,https://redd.it/un0y3v,Daily Discussion Wednesday May 11 2022 Thread topics include but are not limited to General discussion related to the days events Technical analysis trading ideas strategies Quick questions that do not warrant a separate post Thread guidelines Be excellent to each other Do not make posts outside of the daily thread for the topics mentioned above Other ways to interact Get an invite to live chat on our Slack group,Positive,0.838
un630z,bitcoinmarkets,Ok-Distance-4521,1652262101,1652316281,0,0,0,0,1,0,1,0,0,,0.13,0,0,0,0,0,default,https://redd.it/un630z,Hello investors,Neutral,0.0
un78n7,bitcoinmarkets,Coinbaazar_Official,1652266859,1652316281,0,0,0,0,1,0,1,0,0,,1.0,1,0,0,0,0,default,https://redd.it/un78n7,How To Buy Bitcoin in Nigeria Using The Coinbaazar Bitcoin Wallet App,Neutral,0.0
un80ah,bitcoinmarkets,Vast-Boysenberry281,1652269794,1652316281,0,0,0,0,1,0,1,0,0,,1.0,1,0,0,0,0,default,https://redd.it/un80ah,Authenticity of GlobalWe Crypto Trading Platform,Neutral,0.0
undtv7,bitcoinmarkets,Call-me-Lucky,1652286599,1652333699,0,0,0,0,1,0,1,0,0,,1.0,1,0,0,0,0,default,https://redd.it/undtv7,This morning the price touched the bottom of the long term logarithmic chart that has proven to be a decent entry point in 2015 and 2020 Will history repeat or rhyme,Neutral,0.0
une2ap,bitcoinmarkets,Rosertom,1652287212,1652333699,0,0,0,0,1,0,1,0,0,,1.0,1,0,0,0,0,default,https://redd.it/une2ap,Trade BTC with gifts card,Neutral,0.0
unfodk,bitcoinmarkets,dayofshah,1652291475,1652336181,0,0,0,0,0,0,1,0,0,,0.81,6,0,0,4,0,self,https://redd.it/unfodk,why did bitboiio stop showing the premiumsdiscounts on BTC ETFs any alternatives Bitbo used to show the discount or premium on bitcoin ETFs but this info no longer appears for open ended ETFs eg the ones that trade on the toronto stock exchange it still does show this information for closed ended bitcoin ETFs but Im not interested in those Are there any other sites that consolidate this information and easily viewable way Bitbo used to thanks,Positive,0.1687
unhisp,bitcoinmarkets,DrNIki,1652296510,1652347845,0,0,0,0,1,0,1,0,0,,0.6,1,0,0,0,0,default,https://redd.it/unhisp,YOU ARE IN DANGER why,Negative,-0.6289
unj64s,bitcoinmarkets,elblodemarytc,1652300974,1652363860,0,0,0,0,1,0,1,0,0,,1.0,1,0,0,0,0,default,https://redd.it/unj64s,Does anyone know what this project is,Neutral,0.0
unnxt0,bitcoinmarkets,Vast-Boysenberry281,1652314557,1652363860,0,0,0,0,1,0,1,0,0,,1.0,1,0,0,0,0,default,https://redd.it/unnxt0,GlobalWe Trading Platform,Neutral,0.0
unny6f,bitcoinmarkets,Vast-Boysenberry281,1652314589,1652363860,0,0,0,0,1,0,1,0,0,,1.0,1,0,0,0,0,default,https://redd.it/unny6f,global we trading platform for cryto,Neutral,0.0
unogg3,bitcoinmarkets,CryptoAnarchyst,1652316184,1652381941,0,0,0,0,0,0,0,0,0,,0.44,0,0,0,16,0,default,https://redd.it/unogg3,We might not be out of the woods yet,Neutral,0.0
uns81y,bitcoinmarkets,AutoModerator,1652328011,1652381941,0,0,0,0,0,0,1,0,0,Daily Discussion,0.93,50,0,1,1005,0,self,https://redd.it/uns81y,Daily Discussion Thursday May 12 2022 Thread topics include but are not limited to General discussion related to the days events Technical analysis trading ideas strategies Quick questions that do not warrant a separate post Thread guidelines Be excellent to each other Do not make posts outside of the daily thread for the topics mentioned above Other ways to interact Get an invite to live chat on our Slack group,Positive,0.838
untmvu,bitcoinmarkets,Educational-Rope-546,1652332891,1652380143,0,0,0,0,1,0,1,0,0,,1.0,1,0,0,0,0,default,https://redd.it/untmvu,Stock Market Sweep Is Almost Over Which Stocks To Buy After The Sweep,Neutral,0.0
untpgs,bitcoinmarkets,AnnieTony,1652333150,1652380143,0,0,0,0,1,0,1,0,0,,1.0,1,0,0,0,0,default,https://redd.it/untpgs,As LUNA Price Free Falls Terra CoFounder Reveals a Recovery Plan,Positive,0.5106
unu6w0,bitcoinmarkets,gr8roshan,1652335037,1652381941,0,0,0,0,1,0,1,0,0,,0.52,1,0,0,32,0,default,https://redd.it/unu6w0,Is USDT next,Neutral,0.0
unwbuk,bitcoinmarkets,ARFASOFTECH,1652344078,1652393129,0,0,0,0,1,0,1,0,0,,1.0,1,0,0,0,0,default,https://redd.it/unwbuk,Why Use Ruby On Rails Top 5 Reasons,Positive,0.2023
uo0f3k,bitcoinmarkets,cain_sun,1652360112,1652415441,0,0,0,0,1,0,1,0,0,,1.0,1,0,0,0,0,default,https://redd.it/uo0f3k,BTC API NFT API web3 API Alliance activities in progress,Positive,0.4215
uo4qdp,bitcoinmarkets,Brief-Body7985,1652372132,1652426306,0,0,0,0,1,0,1,0,0,,1.0,1,0,0,0,0,default,https://redd.it/uo4qdp,The perfect time for Crypto mining with the 40 Reduced price,Positive,0.5719
uo6hny,bitcoinmarkets,wattumofficial,1652376939,1652426306,0,0,0,0,1,0,0,0,0,,1.0,1,0,0,0,0,default,https://redd.it/uo6hny,Bitcoin Worldwide How Years of Fluctuation Point towards A New All Time High,Neutral,0.0
uo7ssu,bitcoinmarkets,frode36,1652380490,1652472946,0,0,0,0,1,0,1,0,0,,0.79,16,0,0,1,0,default,https://redd.it/uo7ssu,With bitcoin price drop 40 of addresses are at a loss,Negative,-0.5267
uoap46,bitcoinmarkets,chh85,1652388350,1652438856,0,0,0,0,1,0,1,0,0,,1.0,1,0,0,0,0,default,https://redd.it/uoap46,Sign in and get free 25 usd,Positive,0.5106
uofq4m,bitcoinmarkets,Tiny-Detail4408,1652402897,1652453698,0,0,0,0,1,0,1,0,0,,1.0,1,0,0,0,0,default,https://redd.it/uofq4m,Join Now For Free,Positive,0.6705
uoj6tx,bitcoinmarkets,AutoModerator,1652414410,1652472947,0,0,0,0,0,0,1,0,0,Daily Discussion,0.95,45,0,0,338,0,self,https://redd.it/uoj6tx,Daily Discussion Friday May 13 2022 Thread topics include but are not limited to General discussion related to the days events Technical analysis trading ideas strategies Quick questions that do not warrant a separate post Thread guidelines Be excellent to each other Do not make posts outside of the daily thread for the topics mentioned above Other ways to interact Get an invite to live chat on our Slack group,Positive,0.838
uollz7,bitcoinmarkets,Crypto_Malta,1652423909,1652472947,0,0,0,0,1,0,1,0,0,,1.0,1,0,0,0,0,default,https://redd.it/uollz7,Bitcoin Price Prediction HOW TO TRADE THIS BOUNCE,Neutral,0.0
uombjv,bitcoinmarkets,Ituglobal,1652426987,1652472947,0,0,0,0,1,0,1,0,0,,1.0,1,0,0,0,0,default,https://redd.it/uombjv,Bitcoin Holds above 28000 Support as Bulls Have Temporary Bearish Break,Positive,0.4019
uooamk,bitcoinmarkets,ZEEBoiWays,1652436075,1652494681,0,0,0,0,1,0,1,0,0,,1.0,1,0,0,0,0,default,https://redd.it/uooamk,Get Ready METAG8 first look coming tonight METAG8 AG8 NFTCommunity NFT cryptocurrency Crypto Metaverse nftart BTC Ethereum nfts bnb Follow Us on Twitter,Positive,0.3612
uop0mx,bitcoinmarkets,Mikhail101001,1652439163,1652494681,0,0,0,0,1,0,1,0,0,,1.0,1,0,0,0,0,default,https://redd.it/uop0mx,StackOS,Neutral,0.0
uoswnt,bitcoinmarkets,LemonHazeNFTs,1652451847,1652502621,0,0,0,0,1,0,0,0,0,,1.0,1,0,0,0,0,default,https://redd.it/uoswnt,LEMONHAZE NFT INT 21 OF MAY,Neutral,0.0
uozuhf,bitcoinmarkets,emtiazmanna03,1652471480,1652533087,0,0,0,0,1,0,1,0,0,,1.0,1,0,0,0,0,default,https://redd.it/uozuhf,Chance to get free token SKG to join your dream gameguild is gonna expire,Positive,0.8176
up0ce5,bitcoinmarkets,Jaylah765,1652472872,1652557792,0,0,0,0,1,0,1,0,0,,0.82,21,0,0,0,0,default,https://redd.it/up0ce5,Bitcoin stabilizes at USD 29000 this Friday the 13th on rebound in purchases,Neutral,0.0
up1daa,bitcoinmarkets,Electrical_Horse_354,1652475754,1652533087,0,0,0,0,1,0,1,0,0,,0.66,1,0,0,0,0,default,https://redd.it/up1daa,The Directorycom Lawyer Get a FREE case review from a local attorney,Positive,0.6166
up69lw,bitcoinmarkets,mavisssss_1821,1652491079,1652540465,0,0,0,0,1,0,1,0,0,,1.0,1,0,0,0,0,default,https://redd.it/up69lw,FREE WEEKLY TOURNAMENT,Positive,0.5106
up8zm4,bitcoinmarkets,AutoModerator,1652500809,1652557792,0,0,0,0,0,0,1,0,0,Daily Discussion,0.91,36,0,1,115,0,self,https://redd.it/up8zm4,Daily Discussion Saturday May 14 2022 Thread topics include but are not limited to General discussion related to the days events Technical analysis trading ideas strategies Quick questions that do not warrant a separate post Thread guidelines Be excellent to each other Do not make posts outside of the daily thread for the topics mentioned above Other ways to interact Get an invite to live chat on our Slack group,Positive,0.838
upc1mz,bitcoinmarkets,PauloN3D82,1652513314,1652557792,0,0,0,0,1,0,1,0,0,,1.0,1,0,0,0,0,default,https://redd.it/upc1mz,Binance is smart if they take over the Luna structure and improve,Positive,0.6808
upfpxu,bitcoinmarkets,NFT_YT,1652529459,1652587582,0,0,0,0,1,0,1,0,0,,1.0,1,0,0,0,0,default,https://redd.it/upfpxu,Hey do you love Axieinfinity organization the battle PvP,Positive,0.3818
upi8ol,bitcoinmarkets,Radiant-Cow-1466,1652538017,1652587582,0,0,0,0,1,0,1,0,0,,1.0,1,0,0,0,0,default,https://redd.it/upi8ol,Hey do you love Axieinfinity organization the battle PvP,Positive,0.3818
upjp5s,bitcoinmarkets,Brief-Body7985,1652542427,1652587582,0,0,0,0,1,0,1,0,0,,1.0,1,0,0,0,0,default,https://redd.it/upjp5s,The perfect time for Crypto mining with the 40 Reduced price,Positive,0.5719
upmkvg,bitcoinmarkets,NFT_BTT,1652550827,1652607277,0,0,0,0,1,0,1,0,0,,1.0,1,0,0,0,0,default,https://redd.it/upmkvg,You wanna discover new platform Gameguilds,Neutral,0.0
upoj9o,bitcoinmarkets,Ezra765,1652556653,1652621777,0,0,0,0,1,0,1,0,0,,0.72,12,0,0,5,0,default,https://redd.it/upoj9o,Veteran Investor Mark Mobius Expects Bitcoin to Fall Further Cautions Crypto Traders Against Buying the Dip Even if Bitcoin goes to an Unimaginable Low Is buying the Dip a bad idea,Negative,-0.6808
uptbmj,bitcoinmarkets,verballysarcastic,1652571784,1652619913,0,0,0,0,1,0,1,0,0,,1.0,1,0,0,0,0,default,https://redd.it/uptbmj,Excel CryptoNFT Investment Portfolio Tracker Spreadsheet Cryptocurrencies NFTs and more Live Data Calculations Scan Result Link Included,Positive,0.4588
upxqz0,bitcoinmarkets,AutoModerator,1652587211,1652631051,0,0,0,0,0,0,1,0,0,Daily Discussion,0.97,28,0,0,94,0,self,https://redd.it/upxqz0,Daily Discussion Sunday May 15 2022 Thread topics include but are not limited to General discussion related to the days events Technical analysis trading ideas strategies Quick questions that do not warrant a separate post Thread guidelines Be excellent to each other Do not make posts outside of the daily thread for the topics mentioned above Other ways to interact Get an invite to live chat on our Slack group,Positive,0.838
uq1knl,bitcoinmarkets,ARFASOFTECH,1652602991,1652661556,0,0,0,0,1,0,1,0,0,,1.0,1,0,0,0,0,default,https://redd.it/uq1knl,How to Build AI based Personal Financial Assistant App,Neutral,0.0
uq544o,bitcoinmarkets,adigabusymind,1652617889,1652666737,0,0,0,0,1,0,1,0,0,,1.0,1,0,0,0,0,default,https://redd.it/uq544o,I think we have a HNS breaking up,Neutral,0.0
uq5ud3,bitcoinmarkets,Averi765,1652620357,1652666737,0,0,0,0,1,0,1,0,0,,0.62,7,0,0,6,0,default,https://redd.it/uq5ud3,What are the risks and benefits of holding bitcoin in a bank,Positive,0.128
uq644d,bitcoinmarkets,NFT_BT,1652621228,1652666737,0,0,0,0,1,0,1,0,0,,1.0,1,0,0,0,0,default,https://redd.it/uq644d,JOIN AND GET YOUR SLOT IDO RIGHT NOW TO OWN YOUR GUILD,Positive,0.296
uq7k3a,bitcoinmarkets,Pleasant-Explanation,1652625826,1652673871,0,0,0,0,1,0,0,0,0,,1.0,1,0,0,0,0,default,https://redd.it/uq7k3a,Bitcoin for President,Neutral,0.0
uq97lf,bitcoinmarkets,S00P3R-SL1M3Y,1652630710,1652732964,0,0,0,0,1,0,1,0,0,,0.78,16,0,0,1,0,default,https://redd.it/uq97lf,HSABANK 1000 BONUS TO OLD CUSTOMERS,Positive,0.6408
uq99gz,bitcoinmarkets,emtiazmanna03,1652630860,1652677439,0,0,0,0,1,0,1,0,0,,1.0,1,0,0,0,0,default,https://redd.it/uq99gz,JOIN AND GET YOUR SLOT IDO RIGHT NOW TO OWN YOUR GUILD,Positive,0.296
uqab02,bitcoinmarkets,SimpleSwapExchange,1652633867,1652732964,0,0,0,0,0,0,1,0,0,,0.75,13,0,0,10,0,self,https://redd.it/uqab02,Remember to be careful in the crypto world and beware of scams Here is the list of the most common scams and how to avoid them Imposter scam Scammers pretend to be moderators admins or developers message you and ask for your private key Remember to never share your private key to anyone Always check whether youre talking to the real admin Phishing fake website Scammers create fake websites of exchange platforms or crypto wallets Always carefully check the URL domain quality of the website design etc Fake app Fake apps can be placed in Google Play and the App Store Always check the reviews and number of downloads research the developer Giveaway scam Scammers promise to multiply the cryptocurrency sent to them Never send money to an unknown person or project Always research a project Trader scam Scammers can tell you about their return and ask to follow their advice Do not believe in unrealistic guaranteed returns always do your own research Avoid poorly written incomplete or nonexistent whitepaper,Negative,-0.9828
uqapyt,bitcoinmarkets,Tariiiixx,1652635022,1652682473,0,0,0,0,1,0,0,0,0,,1.0,1,0,0,0,0,default,https://redd.it/uqapyt,VeThor The Fuel To Fire VeChain,Negative,-0.34
