created_at,text,user,retweet_count,favorite_count,followers,is_verified
Tue Mar 22 18:04:17 +0000 2022,We changed the marketing game on a budget never replicated per impact in Crypto before Now you Vikings will have the chance to prove to the World just why we are the most powerful community in Crypto Marketing move 101 incoming,SabreEthereum,318,979,49273,False
Wed Mar 23 18:55:32 +0000 2022,TR3NDING: market cap has officially surpassed Bank of Americas. Ethereum: $360.155 Billion Bank of America: $348.60 Crypto is here to stay,themetav3rse,119,450,64553,False
Wed Mar 23 23:48:31 +0000 2022,"Ethereums Merge is coming Heres what you need to know, explained simply.",JackNiewold,2205,8841,117016,False
Fri Mar 18 21:09:56 +0000 2022,The Ethereum merge is *not* priced in. It will turn $ETH into one of the few liquid assets offering positive real yields. Few,krugermacro,99,1390,210312,False
Wed Mar 23 21:48:22 +0000 2022,"Newbie Skill Check: What is staking? What is slippage? What is Ethereum's ""The Merge""? How is a DEX different from a CEX? What does farming Pool 2 tokens mean? Why do people use Alt Layer 1s instead of ETH? What's the difference between Layer 0, 1, and 2?",thedefiedge,249,1147,299703,False
Tue Mar 29 12:53:58 +0000 2022,Some interesting DeFi plays: -Bastion Protocol: supply $ETH and borrow $USDC for 0.69% -Vires Finance: 21% APR on $USDC / $USDT -Astroport: stLUNA - $LUNA LP 20.6% APR (7 day avg.) -sAVAX as collateral on xAnchor to borrow $UST --&gt; buy $AVAX -Osmosis: $JUNO - $OSMO LP 128%,Route2FI,83,505,332042,
Wed Mar 30 07:30:35 +0000 2022,"Daily reminder to take some profit guys. $BTC is up, $ETH is up, our alts are up. This is where greed kicks in and reks you. Stay disciplined and take a bit out of the market.",LadyofCrypto1,26,600,617439,
Mon Mar 28 16:12:00 +0000 2022,My targets for the coming 2-4 months: $BTC $70k-$100k $ETH $6k-$10k $DOT $60-$100 $XRP $3-$5 $ADA $2-$3,rovercrc,597,5568,1222483,
Tue Mar 29 16:30:33 +0000 2022,Auction is over! And its time invest in talent artists! Shill the shit out of this tweet! Because I am on the hunt for my next piece to add to my  collection! Drop yours works Include FND link Up to 0.2 $ETH What are you waiting for?,exolorian,64,288,24667,
Sat Mar 26 14:43:00 +0000 2022,My 3 biggest holdings: - $BTC - $ETH - $VET,rovercrc,49,753,1222483,
Sun Mar 27 05:48:55 +0000 2022,Which one will happen first? $BTC - $100k $ETH - $10k,Ashcryptoreal,65,293,1812073,
Wed Mar 30 04:22:53 +0000 2022,"The Ronin Network suffers a $625 million hack, making it the largest crypto hack ever. The hacker found a gas-free RPC node to gain access to the additional validator and used hacked private keys to forge fake withdrawals, draining 173,600 $ETH and 25.5M $USDC from the bridge.",coingecko,77,350,2283856,
Wed Mar 23 18:16:11 +0000 2022,The AVE platform has included projects &amp; can directly query Thanks   ! $FEG  ,RTRcrypto,161,350,27048,False
Thu Mar 24 20:33:13 +0000 2022,The FEG Token Project is proud of our commitment to the Pan African Sanctuary Alliance!   $FEG,RTRcrypto,284,841,27048,False
Fri Mar 25 16:13:13 +0000 2022,"Punk 7971 bought for 235 ETH ($732,588.98 USD) by 0x1919db from 0x3e17fa.",cryptopunksbot,17,209,104513,False
Thu Mar 24 16:06:27 +0000 2022,Buckle up fam! Two MASSIVE product releases coming up shortly Hint: 's multi-chain ecosystem is about to EXPLODE RT to show love,0xPolygon,640,1673,2061848,False
Wed Mar 23 08:29:34 +0000 2022,The future of are here + they're powered by 's second layer Loopring L2 x  Power to the players. Power to the creators Power to the collectors.,loopringorg,2442,8191,223601,False
Wed Mar 23 12:47:50 +0000 2022,"A year ago we were a small crypto startup.. Now we have all these top-tier people joining our team, alongside some of the most brilliant tech teams and individuals who are already part of the  family. We're more ready than ever to bring the world to Ethereum.",MihailoBjelic,120,555,67039,False
Fri Mar 25 08:43:19 +0000 2022,"BREAKING: Israels largest bank, Bank Leumi, enables and ethereum trading!",LayahHeilpern,496,3651,709668,False
Fri Mar 25 14:43:53 +0000 2022,"JUST IN: Israel's biggest bank, Bank Leumi, will start to offer and Ethereum trading",Blockworks_,641,3742,418143,False
Thu Mar 24 17:09:53 +0000 2022,We love NFTs on Ethereum!,Poseidon_SF,24,460,62827,False
Sun Mar 27 13:24:15 +0000 2022,"JUST IN: founder, Vitalik Buterin says fees are a huge problem for Ethereums usability.",WatcherGuru,921,6909,3130287,False
Sun Mar 27 00:33:26 +0000 2022,"Top 10 Coins Mentioned on Twitter in March 1. 13,775,934 2. 3,951,647 3. 2,073,522 4. 1,829,107 5. 1,658,843 6. 1,286,917 7. Inu 1,223,742 8. 924,627 9. 845,931 10. 639,187 via ",WatcherGuru,480,1918,3130287,False
Fri Mar 25 10:41:21 +0000 2022,JUST IN: Israeli bank Leumi will offer crypto trading services starting with and,WatcherGuru,442,2424,3130287,False
Sun Mar 27 01:42:07 +0000 2022,"FUN FACT: Since 2019, has seen faster adoption than .",WatcherGuru,143,1114,3130287,False
Fri Mar 25 16:45:58 +0000 2022,"JUST IN: Italian luxury brand Michele Franzese Moda is now accepting , , , and other cryptocurrencies as a payment method.",WatcherGuru,287,1461,3130287,False
Tue Mar 22 11:57:33 +0000 2022,"The Ukrainian government has now raised more than $100 million in bitcoin, ethereum, and stablecoins for their defense efforts. When banks and other financial institutions ran from the conflict, crypto stepped in to support those in need.",APompliano,342,2533,1739396,False
Fri Mar 25 14:17:40 +0000 2022,"GM! I still stand on what I said last month, Bitcoin is going to hit $80k this year and Ethereum will hit 6k.",MsCryptomom1,15,191,58726,
Tue Mar 29 13:46:44 +0000 2022,"price rises to $48,000, on the cusp of $3,500.",BTCTN,48,175,3149640,
Fri Mar 25 20:43:58 +0000 2022,"1/6) Ethereum is in a race to scale onchain Competitors will overtake ETH if it does not deliver in time Block space is a valuable resource that is in no way exempt from the laws of the market There are several blockchains scaling onchain now, I will cover some in this thread:",Justin_Bons,58,197,61116,
Mon Mar 21 12:18:32 +0000 2022,"Apparently the new trend of creativity from some marketing folks in is brainwashing innocent investors into believing you are credible for success, with evidence to the contrary. Is that not begging for attention whilst in turn your current ?",SabreEthereum,188,805,49273,False
Mon Mar 21 13:55:09 +0000 2022,"Gm! You can now link up to 20 wallets to your profile and see your Ethereum, ,  and  NFTs in one place",rarible,25,126,615191,False
Wed Mar 23 18:29:33 +0000 2022,Spent the last 2 days in Barcelona at the Avalanche Summit and it was sooo pleasant to again feel the vibe of this industry we're building. Shoutout to  for the invite and the Ava Labs team for chatting with me 2 days straight. Felt like the early days of Ethereum!,peter_szilagyi,191,1606,70347,False
Mon Mar 21 17:06:47 +0000 2022,Oops.. Crypto Influencer self-owns Live Ethereum,mithcoons,372,2700,18344,False
Wed Mar 23 20:14:30 +0000 2022,"Migrating to Cardano. Integrating with  &amp;  to create a ERC20 bridge. ERC20 to CNT. Any Ethereum projects looking to migrate to Cardano, send a msg to contact.com or DM us. Release date: TBA",IagonOfficial,295,1015,24218,False
Sun Mar 20 15:41:11 +0000 2022,my gf bought a dog while i was at SXSW his name is ethereum,natealexnft,20,818,181241,False
Thu Mar 24 00:04:31 +0000 2022,"Multi-Chain Capital - Update: * Over $27.3M in the $MCC Treasury for LONG TERM Sustainability. * Over 5,600 MultiNodes Across the Ethereum and Binance Smart Chain.",MulChainCapital,91,417,31198,False
Thu Mar 24 21:07:01 +0000 2022,Introducing Starbridge a trust-minimized integration between Stellar and Ethereum.  gives a breakdown on the design and development behind the new project.,StellarOrg,137,458,826651,False
Wed Mar 23 18:42:41 +0000 2022,Ethereum has now a higher market cap than the Bank of America,Blockworks_,1089,7483,418143,False
Thu Mar 24 13:09:18 +0000 2022,MARKET CAP SURPASSES BANK OF AMERICA!,CryptoSavingExp,64,350,124791,False
Wed Mar 23 05:15:53 +0000 2022,"That feeling I get each time I hear ""Ethereum 2.0 will be ultra sound money!""",Leerzeit,27,271,85776,False
Wed Mar 23 11:42:40 +0000 2022,"SmithyDAO X AfterLife After Life is an 3D NFT project on Ethereum blockchain, revolving around dark themes of the afterlife, souls, death, horror, revenge etc. Join our discord to get a chance for one of the 10 WL spots for  ! $MAGIC",SmithyDAO,81,141,25538,False
Mon Mar 21 14:45:34 +0000 2022,"I am thrilled to announce that I'm joining  as the Chief Information Security Officer. Polygon is the leading Ethereum scaling platform, and I'm stoked about our upcoming ZK rollups. Security has been a priority at Polygon, and I will be pushing it to the next level.",Mudit__Gupta,279,3187,67747,False
Tue Mar 22 12:30:24 +0000 2022,welcome to ape hate vitalik,NeerajKA,41,578,157290,False
Thu Mar 24 02:37:21 +0000 2022,All NFT traders should have a goal to flip their way up to an Ethereum Validator. That's a lifetime of supplementary income. Maybe enough to live off some day.,corygabrielsen,15,239,11792,False
Fri Apr 29 18:42:20 +0000 2022,Just decided to move all my $ETH into $SOL... what floors we sweepin'?!,BrooksClifford,42,822,2066,
Fri Apr 29 08:18:14 +0000 2022,"This is slightly emotional for me but Ive been in NFTs since July 2021, started in $ETH, dont ask abt that bc Ill cry over how dumb I was . I moved to $SOL in sept. In the 9 months Ive been doing this Ive NEVER held an NFT that had a FP of 100+ SOL WAGBO ty ",mikasa_yaegar,70,990,9820,
Wed Apr 27 18:00:27 +0000 2022,4 EVER 4 EVER One of our co-founders  is spreading the love and giving 5 of our lucky beasts some ETH. Like+ RT + Tag some friends who are forever bullish on $ETH.,akidcalledbeast,1243,1796,110963,
Thu Apr 28 13:28:11 +0000 2022,"change price ...T ick-tock, meat-clock 0.55 $eth",maryamhasaniart,176,441,22216,
Wed Apr 27 18:29:14 +0000 2022,"Fresh $ETH , what we buying?",NFTMasun,35,284,18534,
Thu Apr 28 23:08:17 +0000 2022,Jim Cramer calling for a 40%+ gain on $ETH We are so fucked,MoonOverlord,669,7186,301647,
Fri Apr 29 08:59:01 +0000 2022,ONE OF THE BIGGEST WHALES IN THE $ETH NFT SPACE  HAS JUST JOINED $SOL NFTS TODAY. WHAT MANY OF YOU FAIL TO UNDERSTAND IS THAT  WASNT THE PUMP. HE GOT IN EARLY.,solposts,63,322,41563,
Thu Apr 28 21:26:51 +0000 2022,13/33 Check out the largest ever $ETH airdrop of ERC20 and NFT assets   ,HowtoPulse,282,380,17344,
Fri Apr 29 11:30:11 +0000 2022,"After a few flips today I'm itching to buy some beautiful work on  - DROP 1 PIECE ONLY - NO LINKS, NO TEXT - IMAGE, GIF, VIDEO - PRICE WITH $ETH SYMBOL - ENGAGE TO INCREASE EXPOSURE - RT OR QUOTE RT YOUR FAVORITES LET'S MAKE A SALE TODAY",NftSheikh,80,357,2978,
Thu Apr 28 13:26:06 +0000 2022,Collection Cuties power My girls are looking for home 0.06 $ETH Link in comments,ShuvaevaArt,66,223,7626,
Thu Apr 28 09:50:09 +0000 2022,Sold on a secondary market to anonymous collector. Thank you for keeping an eye on my very first collection! Floor price on secondary is 0.27 to 6.9 $ETH,woman_is_art,65,2038,25739,
Fri Apr 29 20:56:40 +0000 2022,Ethereum vs. PulseChain,rachellaub_,97,497,4889,
Thu Apr 28 21:00:24 +0000 2022,1/33 LARGEST for all holders! Receive a 1:1 copy of your favorite token on a Cheaper Faster |,HowtoPulse,1195,1722,17344,
Thu Apr 28 21:11:50 +0000 2022,4/33 WORLDS LARGEST AIRDROP This could be your opportunity to become a whale! Double your bags() Find out more: |,HowtoPulse,305,432,17344,
Fri Apr 29 23:24:24 +0000 2022,pov: you're solana nft's witnessing whats going on with ethereum nft's.,kmoney_69,339,1581,159871,
Fri Apr 29 13:24:22 +0000 2022,The big day has come! This Sunday we are launching our own amazing NFT platform! TO THE MOOOON!!,ApeborgToken,306,129,7550,
Thu Apr 28 19:14:50 +0000 2022,Horrible news for Ethereum &amp; crypto markets,CramerTracker,469,5215,351559,
Fri Apr 29 16:02:04 +0000 2022,Ethereum merge in ~100 days,ultrasoundmoney,112,1014,46773,
Thu Apr 28 12:25:45 +0000 2022,/ clearly shows ... It's almost time for takeoff,BTCfuel,165,986,68276,
Fri Apr 29 13:19:35 +0000 2022,Two book authors walk into  So great to finally meet you in person  !!,CamiRusso,19,501,91879,
Thu Apr 28 21:36:30 +0000 2022,19/33 ALERT Thousands of FREE tokens Learn more at |,HowtoPulse,264,390,17344,
Fri Apr 29 19:11:40 +0000 2022,"Everyone knows that the founders of  and those behind them are and wallets, so why should be surprised by the foolishness of their words and actions that are all corruption and prejudice?!",H_FinTech,105,525,29464,
Thu Apr 28 21:38:57 +0000 2022,"21/33 $LINK USERS : In case you haven ' t heard ! $PLS is airdropping every single ETH NFTs address on Ethereum the same coins they have in their wallets , And your community is included $SHIB $HEX",HowtoPulse,275,402,17344,
Tue Apr 26 20:39:51 +0000 2022,"I just bought  on SOLANA THESIS: Ethereum is the best, but is it so good that you should never try anything else ever? As more ppl realize ""no,"" the value of Okay Bears will increase! Thanks to  who held my hand through this emotional process",dumbnamenumbers,132,709,20928,
Thu Apr 28 03:05:54 +0000 2022,"80% of Institutional Investors Expect to Overtake Traditional Investments, Survey Shows $BTC $ETH",javaoio,120,2184,4312,
Tue Apr 26 13:55:52 +0000 2022,/ looks like it wants to move higher You know what that means ...,BTCfuel,105,738,68276,
Thu Apr 28 22:13:38 +0000 2022,32/33 LARGEST for all holders! Receive a 1:1 copy of your favourite token on a Cheaper Faster |,HowtoPulse,311,437,17344,
Fri Apr 29 13:17:40 +0000 2022,She's got more of an issue with  because he competes with Ethereum than finding out who the disguised whales were in the Ethereum ICO(which could prove Centralized ownership making the entire ETH decentralization narrative a Big Fat LIE),digitalassetbuy,85,426,440119,
Wed Apr 27 21:06:00 +0000 2022,IT'S !! We are thrilled to announce $AVAX as our Newest Addition to the Podz Collection 1 RT will get whitelist!,combfinancial,390,355,24060,
Thu Apr 28 21:20:12 +0000 2022,9/33 Hey  did you know that you will be receiving double your tokens that you hold on the blockchain when is released!? Checkout to learn more!!!,HowtoPulse,278,383,17344,
Tue Apr 26 20:35:29 +0000 2022,"On a scale of to how excited are you for The Highest of Stakes? Crypto started with Bitcoin, then Ethereumthen Hex. This is the actual Bitcoin mine used by  in the early days of crypto. And yall are in for one helluva movie",THoSdocumentary,81,513,29499,
Fri Apr 29 13:03:30 +0000 2022,The floor is lava! |,RichardHeartWin,327,1509,350420,
Wed Apr 27 18:47:43 +0000 2022,This is real life. Thank you to the   community for supporting this cause. Our T - Shirt donation bought many bullet proof vests for the Ukrainian people to save lives. Sent directly to the people using  Thank you ,shadows_eth,277,1702,92251,
Sun Apr 24 05:36:36 +0000 2022,Hop hop my little bunny you so sweet and very honey Special Little bunny0.03 eth (Ethereum) is available one OpenSea I hope so much for you support Happy Easter dear,Fractaldiva,14,77,2861,
Wed Apr 27 18:01:30 +0000 2022,"Fam, I have great news. The ""Cubist Ethereum Ninja"", a mixture of cubism and surrealism in my collection, was bought by my dear friend  . I am very happy to be included in your collection again. Thank you very much for supporting the full-time artist.",Sant0s_eth,10,59,4487,
Fri Apr 29 15:55:52 +0000 2022,"Remember when  had the circulating supply of XRP wrong for a week during May 2021? When Elon went on SNL, and it was super lucky by doing that because it altered the rankings, moving XRP down, but put Binance Coin (BNB) in the middle of Ethereum and Doge?",BCBacker,277,1700,330898,
Mon Apr 25 18:08:56 +0000 2022,"Tweeting daily until  reaches 1 Million $wrld holders, on Ethereum or Polygon. Day 43 Ethereum: 15056 (+75) Polygon: 27327 (+4617) Yep, this is the highest grow ever",PennTheProphet,83,234,2062,
Fri Apr 29 08:59:51 +0000 2022,I present to you a new art Neon dreams! I decided to try new colors for me and it inspired me a lot! I really like the result I will be glad for your support 0.06 $ETH,ShuvaevaArt,93,264,7626,
Thu Apr 28 09:33:57 +0000 2022,Drop your $ETH wallet and follow Dont ask why,lotta_NFT,282,367,219260,
Thu Apr 28 20:51:51 +0000 2022,A  for under .1 $ETH?! WHAT A STEAL LETS GET THIS FLOOR RISING *Zeuss will give this out during ZEUSS PRIVATE PARTY WHOS READY FOR THIS WEEKEND? ,ZeussCapital,74,219,12288,
Thu Apr 28 12:21:27 +0000 2022,"The new drop in Exomorphy. She's listed ""Revulsion"" Only true revulsion leads to revolution. 0.11 $ETH link in thread",dsgnnina,62,153,6918,
Fri Apr 29 09:58:55 +0000 2022,great day to share love and return support to the community DROP YOUR ART NO LINKS ONLY ART Price $ETH BE KIND retweet this tweet to find more artists So exciting to see,Kristina__po,44,313,6626,
Fri Apr 29 15:03:02 +0000 2022,"Drop your $ETH wallet, follow &amp; RT Dont ask why",CryptoMafia420,509,575,122891,
Thu Apr 28 10:21:05 +0000 2022,"Free NFT airdrop Drop your $ETH wallet, Follow &amp; RT",CryptoMafia420,482,537,122891,
Thu Apr 28 10:20:30 +0000 2022,"Hi Friends Happy to announce that I finally make my new collection ""Dark side"" A different concept art in my own style Floor price 0.22 $ETH Each retweet is highly appreciated",soliiiart1,160,402,16063,False
Fri Apr 29 07:00:00 +0000 2022,"""Spaced Out"" is UP on my  Reserve - 0.15 $ETH My best piece so far",nexokane,84,344,2300,False
Fri Apr 29 22:20:46 +0000 2022,"DARK ART THREAD DROP 1 TITLE &amp; PRICE ENGAGE WITH EACH OTHER RT, QUOTE RT YOUR FAVS My Image is Burning 0.5 $ETH ",theartofmann_,52,214,3489,False
Fri Apr 29 09:00:02 +0000 2022,Lolipop alien in leather jacket and his girl Available for 0.06 $ETH,lolipopnfts,53,166,14142,False
Thu Apr 28 02:07:47 +0000 2022,"Shrewd Shark was purchased for 11.5000 $ETH ($33,121.26 USD) by from Group: Admission Conference: Core Editions: 1 of 20 () Category: Fish",veefriendsbot,25,259,9755,False
Fri Apr 29 14:43:54 +0000 2022,"""Who are you?"" My new drop on  Buy now 0.45 $ETH Reserve 0.28 $ETH",MTroino,47,205,10848,False
Thu Apr 28 16:30:42 +0000 2022,"COMMUNITY THREAD Drop your unsold below I'll Retweet and promote my favorites! 11 PIECE ONLY 2 NO TEXT (Only photo/video/GIF) 3 Put the PRICE on $ETH, $XTZ etc. 4 RT and Engage to reach more people! LETS GROW TOGETHER! ART by ",PonseLakiva,82,327,22738,False
Wed Apr 27 17:08:18 +0000 2022,"The first 3Dprinted by , the factory that made the project . Bringing virtuality to reality!    $DUST",w3_surfer,44,311,2089,False
Thu Apr 28 21:41:09 +0000 2022,22/33 LARGEST for all holders! Receive a 1:1 copy of your favorite token on a Cheaper Faster |,HowtoPulse,251,352,17341,False
Thu Apr 28 13:20:06 +0000 2022,"You won't believe what I just found. JPMorgan, Alibaba, SWIFT partnered in 2017 to revolutionise cross-border payments with Ethereum. And which law firm represents both of them? That's right: Simpson Thacher. That's the tweet. Oh yes, before I forget: BOOOOMMMM",Leerzeit,1582,3637,85776,False
Fri Apr 29 21:14:02 +0000 2022,- 2018 vs 2022 well ... that's interesting.,KevinSvenson_,70,604,161333,False
Wed Apr 27 03:02:01 +0000 2022,BUY TAX SPECIAL 3% BUY TAX! 5% BUY TAX! THESE TAXES WILL BE SET FOR THE NEXT 24 HOURS!,CheemsInu,175,441,61408,False
Wed Apr 27 14:02:19 +0000 2022,The fantasy world available available on  0.1 $ETH 1/1 Edition,dvisualartist,32,96,926,False
Tue Apr 26 22:02:47 +0000 2022,I'm incredibly excited to share today that I'm becoming CEO of  to scale both Ethereum's technology and its values.,liamihorne,21,397,16283,False
Wed Apr 27 14:04:52 +0000 2022," is a brand new project, it's a collection of hand-drawn 3D wooden planks based on the Ethereum blockchain. The best part is, it's going to be free to mint, whats not to like. Go follow  and be ready for the free mint!!!",ImmoNFTS,33,54,4646,False
Wed Apr 27 23:23:17 +0000 2022,1/ Introducing...a brand new look for EtherThings Welcome to Planet Ethereum...,etherthings,79,181,3780,False
Wed Apr 27 13:23:41 +0000 2022,This frame has me - calls Ethereum a company hahaha - says itll switch to PoS (any day now!) - Source: Ethereum Bitcoin doesnt care. Source: Bitcoin.,samcallah,73,740,41847,False
Wed Apr 27 17:48:21 +0000 2022,FLOKI BANNED IN LONDON were the headlines defying the odds against the Anti-Crypto agenda A clear message in one of the most cosmopolitan cities in the World in $Floki will not be silenced  give us a Force feed News Fact option will ya?,SabreEthereum,263,813,49273,False
Tue Apr 26 18:35:30 +0000 2022,"Called it: Every subnet will eventually issue its own asinine token and try to cannibalize AVAX (except they wont pay a penny back to Avalanche, unlike rollups which will pay tons of fees back to Ethereum) lmao",jon_charb,36,635,23388,False
Wed Apr 27 17:36:22 +0000 2022,"Solana NFT project  had a huge launch day, topping all Ethereum projects over past 24H and apparently propelling  NFT market to record day. story at :",ahaywa,316,1200,11950,False
Sat Apr 23 20:39:21 +0000 2022,This isnt how I envisioned Ethereum going mainstream.,0xMaki,151,1841,79212,
Tue Apr 26 19:34:16 +0000 2022,Blessed to be part of the  family LFGGGGG,BlazeB77,64,237,77,
Tue Apr 26 02:44:48 +0000 2022,sorted by 1 year returns. | Kneel. DO it.,RichardHeartWin,326,1207,350420,
Tue Apr 26 01:37:06 +0000 2022,"Our friends at  are giving away 5 ALLOW LIST! FEET AND EYES GUYS is a unique, all-grayscale PFP project on the Ethereum blockchain from the mind of ! To enter: Follow  and  Like and rt Tag 3 frenz! GOOD LUCK!",meowomen_nft,84,92,6581,
Fri Apr 29 00:38:01 +0000 2022,"Holy shit, Ethereum about to crash hard.",iAnonPatriot,69,587,589656,
Tue Apr 26 05:34:48 +0000 2022,20 Ethereum Concepts thread.,FrancescoCiull4,152,632,194809,
Tue Apr 26 16:37:12 +0000 2022," Added 1 more Nerds to what I minted yesterday. I read about the NERDS Tools and their WL usage. Ngl , the concept have similarity to  (2.5 $Eth) which help you to manage White List on . Bullish on a WL tool on  because we need it.",JaysonCrypto,63,114,21056,
Fri Apr 29 00:35:51 +0000 2022,"Jim Cramer has said will climb 40%. Uh, oh.",unusual_whales,235,2973,2330459,
Thu Apr 28 05:16:09 +0000 2022,Good morning fam Wish you all a very great day today Song of my heart Available on  0.1 $ETH,dvisualartist,14,65,926,
Sun Apr 24 21:02:01 +0000 2022,"Reddit compared to Doge, Ethereum, Shiba, Cardano &amp; Bitcoin. (Credit IllLong200)",SafemoonWarrior,118,551,84771,
Wed Apr 27 12:38:01 +0000 2022,ATH Incoming  3% Buy tax on &amp; 5 % on,Cryptic_Maestro,142,283,158107,
Wed Apr 27 20:44:28 +0000 2022,Wanted: an Ethereum logo in the style of those elaborate and almost incomprehensible black-metal logos,0xstark,12,130,25666,
Thu Apr 28 13:27:44 +0000 2022,"""When the time is right, all eyes will return to stilton""  $STILT $SHIB $DOGE $FLOKI $FCC $MRI $GENOS $CULT $APE $CAW $SANI $ELON $MUSK",CryptoMatt87,39,77,46170,
Fri Apr 29 16:13:56 +0000 2022,"XRP IS NOT LIKE THE OTHERS, Media Hypes Ethereum and Bitcoin Price Chart Bubble Tops, Market Holding",BCBacker,124,1209,330898,
Tue Apr 26 02:51:08 +0000 2022,"Oh, I forgot to post the losers.",RichardHeartWin,96,558,350420,
Fri Apr 29 15:15:12 +0000 2022,"FRIDAY ART THREAD: NFT $ETH $XTZ ENGAGE, SHARE, LIKE FEATURED ART ",aRRO_eth,30,265,6532,
Wed Apr 27 19:13:58 +0000 2022,Rare NFT airdrop Drop your $ETH address Follow with Like &amp; RT,CryptoMafia420,489,566,122891,
Fri Apr 29 11:31:23 +0000 2022,"Hey fam , I hoped to share with you my genesis FND piece still available ''Ghost Ship Beach''. It comes with a story in the description and the reserve price is .1 $Eth. Really hope you all like it",Nightcafe_Art,72,192,9744,
Fri Apr 29 13:58:36 +0000 2022,"Drop here your art! JUST art! Price on $ETH NO LINKS ""Elephant in the Room""  meme, by me Follow me and retweet to have more engagement!",Parafinas1,30,229,20682,
Thu Apr 28 17:12:29 +0000 2022,"ART SHARE THREAD - DROP 1 PIECE ONLY - NO LINKS, NO TEXT - IMAGE, GIF, VIDEO - PRICE WITH $ETH or $XTZ SYMBOL - RT FOR EXPOSURE, ENGAGE/RT ART YOU LIKE! LETS GO TO THE MOON",KlawMachineArt,66,381,40052,
Mon Apr 25 03:57:42 +0000 2022,Mutant Ape sells for 95 $ETH ($275K),ape_g4ng,30,463,69080,
Wed Apr 27 13:00:03 +0000 2022,"NEW drop  : ""Goddess of Night"" reserve: 0.66 $ETH",meowgress,130,571,14017,
Tue Apr 26 14:52:23 +0000 2022,Will $eth be the currency of the internet? Or could it be something else... ,LayahHeilpern,22,143,709682,
Tue Apr 26 17:11:07 +0000 2022,"Guardian Angel sold for 0.7326 $ETH to an anonymous collector! Thank you so much!!! And, of course, thanks to  and  for the bids!",albertsoloviev,53,533,31098,
Tue Apr 26 17:05:00 +0000 2022,"ART THREAD Let's support others I'll be giving rt to my favorites DROP ONLY 1 NO LINK, PRICE ONLY ENGAGE WITH EACH OTHER RT YOUR FAVORITS REMEMBER LOVE WITH LOVES IS PAID ART by:  0.3 $eth Aviable in ",Rodolfodelaluz2,64,312,18034,
Sun Apr 24 14:46:00 +0000 2022,100 more Discord invites will be dropping on the instagram account when it hits 1k followers. Click the link to follow.,akidcalledbeast,195,580,110963,
Mon Apr 25 06:07:18 +0000 2022,"To celebrate the artwork of  bridging the NFT communities of Solana, Ethereum and Near. We are giving away this  Fracture worth over 30 Sol. $3000 USD. Like, Retweet &amp; Follow Tag 3 Frens Tag your favourite Sol DAO. Cartel is Life",ElCafeCartel,674,807,9997,
Tue Apr 26 17:58:12 +0000 2022,Ada Brew NFT bottle cap on  Digi Caps bottlecaps start at 0.03 ETH on Ethereum,digi_caps,51,76,8055,
Tue Apr 26 13:39:54 +0000 2022,This investor just bought 5.38 worth of tokens! WOW! They must know how early they are!,CheemsInu,214,564,61404,
