created_at,text,user,retweet_count,favorite_count,followers,is_verified
Thu Sep 29 19:44:59 +0000 2022,$HEX developer on why is taking so long: $ETH,HviidHEX,231,969,44581,False
Tue Sep 27 18:05:16 +0000 2022,"MEGA MUTANT sells for 1000 $ETH / $1,314,010",ape_g4ng,218,1740,69081,False
Wed Sep 28 12:02:09 +0000 2022,"New Drop My new piece ""Inside"" is now available on  Reserve 0.2 $ETH Link below",Triz_Draw,101,254,2471,False
Wed Sep 28 05:47:11 +0000 2022,Gm 0.2 $ETH,OdysseyHeart,50,197,20056,False
Wed Sep 28 22:09:35 +0000 2022,"2 JPEGS... 4300 $ETH / $5,809,300 NFTs ARE DEAD!!!!!!",ape_g4ng,90,581,69081,False
Tue Sep 27 19:00:37 +0000 2022,"THE DROP IS LIVE  Debut/Genesis/LFG Reserve 0.969 $ETH Bidders get free art (wowsers!) Link and other things in thread Love, Robot",onerob0t,142,287,15703,False
Wed Sep 28 09:41:10 +0000 2022,"Minted this cake almost an year ago and thought this will sell immediately After a year and 40 nfts sold, this beauty has not found a home yet and its ok.. im not a fan of burning pieces, so ill just leave it there for years if necessary Roses Cake 0.2 $ETH",Rifkas_cake_,58,101,10552,False
Tue Sep 27 10:46:34 +0000 2022,"Reminder about $ETH you only have to worry about slashing when you actually receive rewards. $ADA pumps out rewards every 5 days with no slashing, no risks, or lock ups",AnthonyCardano,44,275,9361,False
Wed Sep 28 13:15:00 +0000 2022,"Midweek ART SHILL thread. I'll RT what I can (24 hrs thread) NFT (1 per person) PRICE $ETH $XTZ NO TAGS NO LINKS Plz RT, LIKE, &amp; SHARE at least 3 other works BE KIND 0.35 $ETH (Secondary) on KO",harshitdave,72,253,23166,False
Wed Sep 28 09:51:09 +0000 2022,51 editions of PERSPECTIVE were claimed by my existing collectors. This collectors edition is now available for all to collect for 0.01 $ETH I always have perks for all my collectors - JOIN IN NOW. Story below,harshitdave,178,278,23166,False
Tue Sep 27 17:51:16 +0000 2022,In the past 24 hours $ETH supply went deflationary with 195 ETH ($258K) taken out of supply,CryptoGucci,53,334,43805,False
Thu Sep 29 13:21:38 +0000 2022,$ETH - NOW vs 2016,moonshilla,178,929,153668,False
Thu Sep 29 15:25:56 +0000 2022,New drop Adelle 0.02 $ETH 10/10 editions Princess Adelle with her beloved Bunny,mersenaria_art,41,123,6270,False
Tue Sep 27 04:06:56 +0000 2022,"Hey Fam Meet my new AI collection The Serenity of Love Love is the feeling that excites our consciousness.Yes,sometimes its not easy, but when we love-we are alive 0.03 $ETH Link I'm so excited and I need your support",ArtVikkyFoto,72,193,7189,False
Thu Sep 29 16:56:59 +0000 2022,New Drop on  Dim Wanderer 0.16 $ETH,DNA_NOT_ALIEN,137,308,8096,False
Wed Sep 28 02:11:20 +0000 2022,"1.Turn on &amp; visit Polkadot Pavilion in the metaverse!  - fast-speed internet of blockchains is the brainchild of , the co-founders of Ethereum and the inventor of the Solidity smart contract. Co-produced by  ",BitDotCountry,92,372,179045,
Wed Sep 28 20:36:57 +0000 2022,"After merged to Proof of Stake, I asked CFTC Commissioner Christy Goldsmith Romero () if this will have any policy implications for . This was her response ",PerianneDC,64,210,54553,
Wed Sep 28 16:51:29 +0000 2022,NEW DROP My entry to   contest Inspired by Crypto Legend 0.05 $ETH,Julia_Preskurel,25,61,702,
Thu Sep 29 18:45:31 +0000 2022,REVEAL IS HAPPENING,DonnieBigBags,86,289,149286,
Thu Sep 29 16:29:31 +0000 2022,"I came, I Klawed, I conquered... ! Look at the NFT I won from ,  newest experience in Play &amp; Kollect! --&gt;",1einst,44,156,896,
Thu Sep 29 13:05:47 +0000 2022,"Hi guys im a new NFT artist. My drop is  by collection ""day and dark"" Price: 0.08 $ETH",fantasticartk,25,62,316,
Thu Sep 29 12:01:54 +0000 2022,Tribe Odyssey has sold for 4.0 WETH,TribeSalesBot,26,66,486,
Thu Sep 29 09:46:14 +0000 2022,Penguin 3446 bought for 24ETH ($32117.76) by 0xFb19bd from 0x9aA90A,pudgypenguinbot,31,187,1181,
Wed Sep 28 10:46:45 +0000 2022,"I came, I Klawed, I conquered... ! Look at the NFT I won from ,  newest experience in Play &amp; Kollect! --&gt;",alico_eth,55,218,6811,
Thu Sep 29 12:05:11 +0000 2022,"Metaoasis Artwork AIRDROP CAMPAIGN REWARDS POOL : Airdrop : 50 NFT !! RT, LIKE , 3TAG Ends: 3rd Oct 22:00 PM  ",MetaOasisVR,630,533,87759,
Thu Sep 29 17:22:33 +0000 2022,NEW DROP Mythical Maiden 0.07 ETH on OS Link,arty_mo_na,82,229,1196,
Wed Sep 28 16:58:50 +0000 2022,"Creature Sold for 10 ($13,302.50)",CreatureWorldOS,29,218,233,
Thu Sep 29 15:28:12 +0000 2022,Our collaboration with  Timeless eye 0.15 $ETH,sakaewaira,22,99,14239,
Thu Sep 29 08:22:18 +0000 2022,NEW DROP Monster tamer There are a lot of monsters live on the other side of the cyber universe. This girl catches these monsters and tames them. Available on OpenSea :,ArtyKola,39,107,750,
Thu Sep 29 14:59:16 +0000 2022,Someone stole this one from me don't buy it... via ,PorScherb991S,15,39,2722,
Thu Sep 29 03:37:35 +0000 2022,5K Discord members and  will drop a teaser 73 to go,SamuelRunnacles,51,57,59580,
Thu Sep 29 20:57:53 +0000 2022,NEW Collection Drop by  The Beasts of The Dreadlands is now on OpenSea. Energy Beetle is now available for 0.01 ETH on Ethereum!,digi_caps,50,57,8055,
Fri Sep 23 23:53:02 +0000 2022,The only piece from my genesis collection still available Real handmade cake (link below) 0.2 $ETH,Rifkas_cake_,49,76,10552,False
Mon Sep 26 17:09:13 +0000 2022,Demons Inside You collection comes back! 15/27 sold Every demon is unique Hand draw NEW DROP Meet Astrid! Price : 0.03 $ETH Link,Stafurskaya_Art,28,61,1678,False
Thu Sep 29 17:00:18 +0000 2022,FINAL RAFFLE500 WL+5 NFT (worth 2.5 $ETH) 1  1  Karma 1  1  1  Results: Oct 3rd WL Sale: Oct 4th 11:00 AM EST Tag 3 friends &amp; follow link to take part:,xquieth,1875,2178,11807,False
Wed Sep 28 06:02:28 +0000 2022,"GM, MY FAM! Completed the fanart for the contest   Collection ""Magical atmosphere and anime"". 3/*** LISTED 0.07 $eth ""Katsumi...",Katty_proarty,34,89,1972,False
Sun Sep 25 22:13:59 +0000 2022,LEGENDA my artwork for contest of   Buy now 0.14 $eth Reserve 0.12 $eth Thanks for this amazing opportunity to take part in this wonderful contest,ZilovaArt,29,74,2394,False
Thu Sep 29 21:18:10 +0000 2022,NEW DROP Silvaia Sea. It attracts with its mystery. What is it hiding? Price: 0.05 $ETH You can see the original art on  Link,Stafurskaya_Art,37,85,1678,False
Thu Sep 29 04:50:21 +0000 2022,Last available item of collection BITCOIN GIRL 0.07 $eth was createdas fan art for contest of Benjamin Bitcoin,ZilovaArt,27,56,2394,False
Wed Sep 28 10:02:54 +0000 2022,Demons inside you collection A demon lives in each of us and you have the opportunity to choose your... 0.02-0.03 $ETH I really appreciate your support Link,Stafurskaya_Art,23,45,1678,False
Thu Sep 29 01:42:34 +0000 2022,Hi Fam My new AI collection The Serenity of Love available on  0.03 $ETH Im so grateful to everyoneOn the first day 4 artworks found their home with wonderful peoplethank you so much Please support me Fam Link,ArtVikkyFoto,58,168,7189,False
Thu Sep 29 10:44:50 +0000 2022,Im happy to present my entry to  and  Fan art contest Legendary Mask inspired by 0.08 $ETH Description,Alina_ilina_art,31,72,2925,False
Thu Sep 29 07:20:28 +0000 2022,GM from The Heat 0.15 $ETH,umutsezerkoc,19,63,5579,False
Thu Sep 29 07:25:20 +0000 2022,GM fam HOPE Available on  7/7 editions 0.0129 $ETH Only,ayaz_psd,13,43,3188,False
Thu Sep 29 16:25:23 +0000 2022,"Wow, I received a 2.00 $ETH bid from  !Thank you so much my friend! Thanks a million to   and  for the insane start! You guys are the best",AllielChris,42,208,12201,False
Thu Sep 29 20:55:02 +0000 2022,"GN, fam!!! 12 hours left!! Current bid for Survivor is 0.666 $ETH!!!",albertsoloviev,39,206,31095,False
Tue Sep 27 07:41:49 +0000 2022,EL Monsters Tale  MINT IS LIVE FOR EVERYONE 3333 1/1 NFTS 0.0099 $ETH for 1 0.0199 $ETH for 3 0.0349 $ETH for 6 0.0499 $ETH for 9 Monsters are waiting their owners MINT UR MONSTER HERE Story,el_nuaaa,229,555,7046,False
Thu Sep 29 15:52:24 +0000 2022,My new drop Aquarius for my zodiacal collection 0.07 $ETH Available on OpenSea Link,a_marsart,27,86,6508,False
Tue Sep 27 08:50:41 +0000 2022,Gainers by social mentions: $BTC  $ETH  $TTC  $LUNC  $SOL  $QUACK $HYP  $UNI  $RBXS  $USDT ctto: ,TrendsGem,50,55,27527,False
Sun Sep 25 16:31:34 +0000 2022,TESTNET ROLES INCOMING Raffling off 3 spots tomorrow! How to enter: -RT and Tag 3 frenz -Follow  -DM us your Discord name Interaction w/  TestNet = $eth $honey $op  ,GumBallProtocol,95,115,11373,False
Thu Sep 29 09:44:28 +0000 2022,"Gm, fam!! Just listed my new BTFL DNGR piece: Survivor Dont know if I was right but Im the only one left Auction already started but one of my favorite artist of the space  ! Thank you so much my friend! Current bid is 0.45 $ETH!",albertsoloviev,184,667,31095,False
Tue Sep 27 07:04:12 +0000 2022,Good morning fam New art Minted via my own ERC721 smart contract using  With airdrop to every bidder. *Cyber Station 3098* Price- 0.2 $eth Rt/Qt appreciated .,heavens1522,37,71,3809,False
Thu Sep 29 21:31:05 +0000 2022,"Hope everyone caught all the GREAT INFO that was given by DEV KYLE on today's stream! If you haven't watched it yet, you should, it was pretty awesome!",Hexologist31,220,928,61478,False
Thu Sep 29 13:04:01 +0000 2022,"Yes, the MVP is coming: co-founder and former CEO of Ethereum,  will hit the stage in Toronto/CA this November 8-9 to talk about the next generation of blockchain systems. I'm excited about this one. Go get your tickets!",w3b_world,73,415,290,False
Thu Sep 29 14:00:22 +0000 2022,"Hey fam! I want to remind you that I don't just draw cats. Collection ""Jennifer's Travel Diary"". 1/10 In the world of butterflies 0.04 $ETH OpenSea:",ostrovskaya_art,24,65,3795,False
Wed Sep 28 23:01:08 +0000 2022,"Punk 4513 has a new bid of 900 ETH ($1,206,737.95 USD) placed by 0x0232d1.",cryptopunksbot,65,740,104513,False
Wed Sep 28 21:53:08 +0000 2022,"Punk 5944 has a new bid of 800 ETH ($1,079,183.98 USD) placed by 0x0232d1.",cryptopunksbot,70,678,104513,False
Tue Sep 27 13:56:33 +0000 2022,New Drop Alert Meet Kimberly! 0.1 ETH My fan art for  Read about her superpowers below. I will be very glad of your support,artkuzi,63,158,2437,False
Thu Sep 29 04:50:21 +0000 2022,Last available item of collection BITCOIN GIRL 0.07 $eth was createdas fan art for contest of Benjamin Bitcoin,ZilovaArt,27,56,2394,False
Thu Sep 29 10:44:50 +0000 2022,Im happy to present my entry to  and  Fan art contest Legendary Mask inspired by 0.08 $ETH Description,Alina_ilina_art,31,72,2925,False
Thu Sep 29 23:27:37 +0000 2022,New drop My entry   contest Inspired by Crypto Legend 0.06 ETH,PoleonovaA,33,73,779,False
Thu Sep 29 16:56:59 +0000 2022,New Drop on  Dim Wanderer 0.16 $ETH,DNA_NOT_ALIEN,137,308,8096,False
Thu Sep 29 19:23:13 +0000 2022,Good night my dear fam,MerinMiler,25,55,5708,False
Wed Sep 28 17:54:34 +0000 2022,"Here is evidence that the SEC deliberately gave incomplete evidence. From Hinman's deposition &amp; from the documents requested by Ripple, we know that in addition to the 7 meetings (!) with ConsenSys &amp; Ethereum, there are at least 2 other meetings that are not listed! ",Leerzeit,278,779,85776,False
Wed Sep 28 16:47:03 +0000 2022,Fantastic news from  at OPv1 is live on public testnet!. Hard work and patience paying off. Fantastic work team . Article: See quoted tweet below for video &amp; tread $SYS,Hayess5178,24,82,72568,False
Thu Sep 29 00:10:03 +0000 2022,NEW DROP White Sheep 0.03 ETH. Link White Sheep,betti_arti,33,76,1375,False
Tue Sep 27 06:00:45 +0000 2022,Gm 0.5 $ETH,OdysseyHeart,70,225,20056,False
Thu Sep 29 13:12:09 +0000 2022,IT'S ON Wish Upon A Rose 42 eds 0.008 $ETH Watch the cute animation  A special pre-celebration token for a irl anniversary! The total number of edition has a special meaning to me. I'd love everyone to celebrate with me Link &amp; desc,FloLady_Ochie,63,87,4400,False
Thu Sep 29 07:12:02 +0000 2022,"Gm/Ga lovelies Despite all the sadness happening in this world, I'd still like to share love with everyone as I'll be celebrating my wedding anniv in October! Wish Upon A Rose 42 eds 0.008 $ETH  In less than 6 hours from now! You can watch some details",FloLady_Ochie,45,72,4400,False
Wed Sep 28 13:43:51 +0000 2022,My new collection Welcome to Fairy Land 0.07 $eth Check it,eFRESH_arty,63,124,4150,False
Thu Sep 29 04:12:38 +0000 2022,"GM IT'S BEEN 2 MONTHS SINCE I MINTED MY BELOVED ""INTO THE MIST"" I'M SUPER SAD THAT SHE'S STILL HERE. HELP ME FIND HER A NEW HOME INTO THE MIST RESERVE=0.08 $ETH",ByRedReaper,40,73,2526,False
Thu Sep 29 15:42:26 +0000 2022,"FAM, I have a new drop ""White hope "" RESERVE PRICE: 0.15 $ETH on  THANK YOU FOR SUPPORT LINK BELOW",Dariella_art,62,164,10078,False
Tue Sep 27 12:17:23 +0000 2022,"ARTSHARE - ONLY PRICE IN $ETH / $XTZ + LINK ONE POST/ARTIST - Like &amp; RT (for more exposure) - Interact! Make connections! Please read and follow the rules above ~ RT my pinned if you wish Art by , follow her if you like it!",MisterTW_Art,77,185,1947,False
Wed Sep 28 20:14:23 +0000 2022,One Hour To Go on the Auction of Grease Lightning Current bid : 0.15 $ETH LFG,Milibooo,31,71,4306,False
Thu Sep 29 13:00:11 +0000 2022,"Thursday art share: OPEN FOR 1 HOUR ONLY! Price in $ETH | $XTZ Use hashtag One piece per artist No text! No links! Do show love to other fellow artists in the thread, I definitely notice! Art by  (owned by me)",lilkooky32,116,429,17318,False
Thu Sep 29 13:06:53 +0000 2022,Working Hands 2 pieces Left Edward Scissorhands Time Traveller 0.15 $ETH each 1/1 Link,Milibooo,38,59,4306,False
Wed Sep 28 03:50:14 +0000 2022,Top Trending on Today: $QUACK $LUNC $BTC $FLOKI $ETH $SOL $UNI $XRP $APE       Get them here: : :,BitKanOfficial,105,146,55305,False
Tue Sep 27 06:40:25 +0000 2022,GM fam ''Shut up!'' 9 editions left-0.03 $eth on ,gulbakanozge,44,108,9416,False
Tue Sep 27 14:06:53 +0000 2022,"NEW MINT ""ART of SPLENDOUR"" 0.2 $ETH on  (manifold contract)",Parafinas1,55,131,20682,False
Wed Sep 28 07:47:02 +0000 2022,"Gm friends! ""Don't forget about me Available on  Reserve 1 $ETH",SurrealReality6,31,112,15988,False
Wed Sep 28 17:37:57 +0000 2022,"Show me your Best Art Art + Links Price $ETH/ $SOL / $XTZ Follow, RT, Comment for more exposure Let's support each other Art by ",maytoyoart,52,218,12213,False
Thu Sep 29 11:49:41 +0000 2022,new drop on  FORBIDDEN SIGHT DONT SEE DONT HEAR DONT TALK 10/10......0.04 $eth,shahparism,113,186,23309,False
Mon Sep 26 20:43:17 +0000 2022,GN fam NEW DROP! Primavera ''Let your soul bloom.'' 15/15-0.03 $eth on ,gulbakanozge,45,91,9416,False
Thu Sep 29 05:30:57 +0000 2022,"Gm fam ! slowly getting close to the week end, have a delightful day In the picture: ""Self - An experiment"", my entry to 's comp, now available on FND. Reserve: $ETH 0.75 Buy now: $ETH 1",PtiteAngele,102,279,19691,False
Tue Sep 27 06:30:55 +0000 2022,Gm Picked up a  yesterday. Making moves to have nft collections on both $sol and $eth,PickleXBT,23,63,11470,False
Thu Sep 29 09:40:22 +0000 2022,Hi my ! Add bright colors to your autumn mood! 0.05 eth,Katerinika_,24,34,1786,False
Thu Sep 29 15:18:07 +0000 2022,FREE.. I mean Sappy Seals was purchased for 13 ETH,SappyBot,56,215,614,False
Wed Sep 28 09:29:32 +0000 2022,"Just sad. Hours before Hinman announces the SEC's position on Bitcoin &amp; Ethereum to the public, he met with crypto investment managers. Institutionalised insider trading. Or does someone want to explain me that Billy didn't tell these private companies about his upcoming speech?",Leerzeit,157,629,85776,False
Wed Sep 28 20:18:41 +0000 2022,"damn.eth bought for 4.69 ETH (6,323.62 USD) on Opensea",EnsSalesBot,10,144,25455,False
Thu Sep 29 18:23:04 +0000 2022,"Punk 4472 has a new bid of 700 ETH ($930,089.97 USD) placed by 0x0232d1.",cryptopunksbot,42,429,104513,False
Wed Sep 28 18:08:29 +0000 2022,.eth bought for 15 ($19932.45)!!!,ENSEmojiSales,15,75,985,False
Thu Sep 29 15:25:56 +0000 2022,New drop Adelle 0.02 $ETH 10/10 editions Princess Adelle with her beloved Bunny,mersenaria_art,41,123,6270,False
Thu Sep 29 12:03:08 +0000 2022,MY FIRST EDITIONS! WOW! Why so upset? Only 8 editions! Only 0.055 ETH Let's make this day bright and beautiful!,yu_artist,110,298,12774,False
Thu Sep 29 02:00:11 +0000 2022,New drop Collection Echoes of Hidden Desires Ren 0.1 eth The atmosphere of autumn and the beauty of youth,Liliyaarts,47,118,6672,False
Thu Sep 29 07:17:43 +0000 2022,"Gooood morning all of you! Have a good day!! It's time to have one graf, a unique piece, something different to have on one wall!! Don't hesitate my friend! Let's gooooo Embrasse-moi 0.05eth",Hp24224664,33,49,6970,False
Thu Sep 29 10:19:41 +0000 2022,GM Get Wet Keep calm and love rainy days.,johnhoneyy,12,170,2475,False
Tue Sep 27 08:01:04 +0000 2022,"Hi, my NEW DROP Collection Eazy Halloween Witch 5/5 0.02 ETH We invite you to plunge into the mysterious world of the game and go through this difficult path, defeat all the monsters, and conquer the sacred ether. The game begins!!!",lototskaja_nft,40,83,1063,False
Tue Sep 27 14:28:45 +0000 2022,Decided I needed to diversify my Nft collection! Picked up a  This morning. My first 1Eth purchase.,ARNIE81ETH,45,287,2659,False
Wed Sep 28 07:18:30 +0000 2022,"""We at the  can't see any third party promoter for Ethereum.""",Leerzeit,209,683,85776,False
Tue Sep 27 08:50:41 +0000 2022,Gainers by social mentions: $BTC  $ETH  $TTC  $LUNC  $SOL  $QUACK $HYP  $UNI  $RBXS  $USDT ctto: ,TrendsGem,50,55,27527,False
Tue Sep 27 11:22:17 +0000 2022,"New drop Girl 42 in my collection ""200 shades of femininity"" 42/200 list 16/42 sold 0.03 ETH",Bikiteeva_art,34,71,2109,False
Tue Sep 27 12:26:46 +0000 2022,Yesterday DROPPED 10 Mutants DROP including a FLASH DROP Never imagine have such a support That's why I always telling you PATIENCE is the KEY for success. Stay HUMBLE AND RESPECT OTHERS. love you,jhjcripto,55,82,9105,False
Thu Sep 29 01:57:21 +0000 2022,I have just acquired a Core  Her name is Shimmer and she is coming to JPEGLAND!,TAYL0RWTF,29,217,41617,False
Wed Sep 28 12:06:31 +0000 2022,I'm mentally exhausted. I am overloaded with information. I am desperate and afraid. I now look exactly as shown in the art below. I need your hugs. Thank you! Available 15 editions on  Price 0.015 ETH,Gordioks_art,52,138,8477,False
Thu Sep 29 13:43:19 +0000 2022,"GM ""fall."" by ",Giga_Chad_Pepe,26,283,29783,False
Wed Sep 28 09:13:28 +0000 2022,Hi guys Small details of my crypto legend fanart for the contest from  and ,NAnastasiay,23,57,1395,False
Wed Sep 28 00:57:44 +0000 2022,Just swooped up my first  LFG I love the art and community Ive been wanting one for a long time not feels good to be apart of the toonz,Andrewdamfer,24,88,3571,False
Wed Sep 28 05:43:45 +0000 2022,"Good morning, my friends! Meet the next Little Muse on  ""Erato"" 1/1 NFT 0.05 ETH Have a pleasant day and let Love fill your heart!",Rinnka_kartinka,56,197,5506,False
Wed Sep 28 08:14:29 +0000 2022,Look at me again Nura 0.06 eth Ends in 8 hours Echoes of Hidden Desires Yoko 0.1 eth Ends in 7 hours,Liliyaarts,17,64,6672,False
Wed Sep 28 17:13:48 +0000 2022,Editions Never be afraid to try new things! Hazy Dreams Price - 0.03 Available in 4 pieces Link,Arty_Anny,61,142,8529,False
Mon Sep 26 15:55:15 +0000 2022,NEW DROP Secret recipe  Meow gets to know witchcraft Who wants an Ethereum from a cutie? A special talisman - a magnet for Etherium in your collection! Price: 0.032 $ETH Minted: 4 Sold: 2/4 Link,Yulia_Rossan,18,51,4559,False
Thu Sep 29 15:28:05 +0000 2022,Have a nice day !!! My new collection Biomechanical Goddess 0.025eth I would love your love and supportThank you,irinasketch,34,83,2319,False
Thu Sep 29 16:42:03 +0000 2022,"new drop NEON SPLASH Bright light, bright life, neon mood. Neon lights of city streets - in our eyes. I look at you through neon lenses. price: 0.05 ETH",BoeingMarina,46,102,237,False
Tue Sep 27 07:27:00 +0000 2022,This is what happens when Ugonzo smokes Eth to his dome goodnight community.  ,Ugonzo_art,52,148,16751,False
Tue Sep 27 12:50:01 +0000 2022,"This is what dedicated buy the dip looks like. ,",RichardHeartWin,300,2329,350421,False
Tue Sep 27 14:03:44 +0000 2022,Otherdeed was purchased for 200.0 WETH,OtherdeedBot,123,329,1565,False
Mon Sep 26 11:21:05 +0000 2022,"NEW DROP Alien Queen Price: 0.07 $eth My inspiration is a Crypto Legend She lives on the Nft planet. She has a magic crystal - Ethereum. With it, she can control the human mind. Thank you for such an amazing contest.  ",HelenaART23,53,153,2618,False
Mon Sep 26 22:40:16 +0000 2022,This is nine sign in our collection Guardians of the Zodiac Fire Aries 0.04 ETH,YankovayAarty,38,87,516,False
Thu Sep 29 05:24:41 +0000 2022,"Good Morning, fam I present to you my very dangerous and beautiful lady I hope you don't make friends with the panther either Zoe 0.08 ETH I hope for your support",octobersof,37,103,4100,False
Tue Sep 27 06:43:46 +0000 2022,"Gooooood morning my super friends!! Have a super thursday, all gooooood things will arrived! Just see 'my love' in my feminine beauty graf collection!! 0.035eth",Hp24224664,51,78,6970,False
Tue Sep 27 06:42:02 +0000 2022,"Good afternoon . Friends, I would like to remind you about my drop ""Insolent rebel"" This girl with a bold character is waiting for her collector. Link:",gordova_art,26,78,1512,False
Thu Sep 29 17:06:02 +0000 2022,"NEW DROP NEW EDITION When life gives you 6 white horses and you get yourself a big black horse, will you just stand there? You have to make your move. SHADOW CHESS Edition 15/15 0.023 Eth Rt&amp;Qt Please",karafilm_mehmet,48,115,4274,False
Wed Sep 28 12:31:59 +0000 2022,"Yep!! In agreement with my dear friend , I am selling my Metavixens graf created for the Vixens Contest!! Here is the superb result of the crossing of 2 pure styles!! 0.03eth",Hp24224664,60,89,6970,False
Wed Sep 28 05:17:41 +0000 2022,GM Fam! Its ok not to be ok. Much love Fella,Emilmto,20,79,4561,False
Wed Sep 28 23:00:00 +0000 2022,Kinshu-Hub ARCHM 2x WL Spots 1666 Archemists entering Ethereum. Engineers team lead. To enter: 1 Follow    2 Like and RT 3 Tag friends 24 HRS,Kinshu_Hub,64,62,11322,False
Mon Sep 26 18:06:41 +0000 2022,"There could be a drop for wallets that bought at least 50 $More between Sept 25 and Oct 2nd so like, retweet, then put your Ethereum address down below if you did!",BuyMoreTokens,30,58,5533,False
Mon Sep 26 17:42:02 +0000 2022,So  picked up the second Edition of Blossom. Much love brother One of the best community builder and community supporter i have seen in the space 8 /10 Editions left,Prashanth_art,13,36,4195,False
Tue Sep 27 17:23:46 +0000 2022,We have 24 hours until The Hopeful collection goes live on . Mint Details Price: FREE Chain: Ethereum Time: 28 SEP @ 17:22 UTC Supply: 5555 Limit: 1 per wallet,AzraGames,58,207,63203,False
Thu Sep 29 14:14:46 +0000 2022,"Migration is migration, but no one cancelled the addition to the collection Dead Lake is already available for sale 0.07 $ETH P.S. I got the idea from my watercolor painting ""Don't believe my beauty.",mayrafreemanorg,26,104,12426,False
Thu Sep 29 07:11:47 +0000 2022,"GM gm GM Hey friends I have NEW DROP Duck Stories Inside the artist collection 0,2 $ETH 1/1 art Thanks for supporting Link",o_zzy,44,88,4304,
Thu Sep 29 15:22:19 +0000 2022,"DROP There's nothing complicated . Just relax and Colour your demons Is available on FND Reserve- 0.16 $ETH Id glad your support, my friends",Maroo_u,126,332,8613,
Mon Sep 26 10:48:53 +0000 2022,GM GM GM friends Have a great week And remember that Defensive is still available on  0.2 $ETH Link in comments,Barbiares,32,83,3654,
Thu Sep 29 04:30:38 +0000 2022,"GM GMIt doesnt matter how slow we go, as long as we dont stopLFG A Silent Morning on film 0.05 $ETH 1/1",Janej666,18,73,2429,
Wed Sep 28 07:39:08 +0000 2022,"Gm/Ga beautiful souls! My internet access is still very limited, so please bear with me if I'm sloww on Twitter. Good news is, tomorrow I'll have a new SPECIAL drop to pre-celebrate an irl event!  42 editions 0.008 $ETH!! Animated Here's a full preview",FloLady_Ochie,61,97,4399,
Tue Sep 27 14:27:03 +0000 2022,"About to get sold out, Only one edition left. 1/5 for 0.05 $ETH Listed on KO Link",SanndyCreationz,48,80,7075,
Thu Sep 29 16:59:40 +0000 2022,"SOLD on  Crowded Thoughts 0.095 $ETH Endless thank you &amp; gratitude to the one &amp; only  for collecting this piece!Gosh, i still can't believe it! Truly grateful no word could describe To have you believed in my art, it's just tremendous. I'm humbled",FloLady_Ochie,40,91,4399,
Tue Sep 27 12:07:37 +0000 2022,Good morning. always trust your instinct. always. Instinct 0.30 $eth,Aqueous_WC,42,78,8430,
Tue Sep 27 05:55:11 +0000 2022,Gm Missed out on a Boogeyman by  and me? One has now been listed on secondary for 0.1 $ETH Have a nice Monday!,Amydoodles_,39,55,5430,
Tue Sep 27 18:20:41 +0000 2022,"Show me your Best Art Art + Links Price $ETH/ $SOL / $XTZ Follow, RT, Comment for more exposure Let's support each other Art by Jason Balducci",maytoyoart,60,240,12213,
Thu Sep 29 16:28:10 +0000 2022,"ok fam, an auction has started by ""Tyler - EnterpriseSaaS"" geometry of nature current bid 0.35 $ETH link below",rzsnn_,25,71,4739,
Mon Sep 26 15:48:56 +0000 2022,We made a sale yesterday so this is the only piece available in the collection Its a real handmade cake 0.1 $ETH (link below),Rifkas_cake_,57,89,10551,
Thu Sep 29 05:53:26 +0000 2022,NFT Sale HUGE thanks to  &amp;  for grabbing editions of my piece!! Really appreciate it! Only ONE edition left at 0.017 $ETH Hurry to get it before its gone,__Maya_S__,27,63,7235,
Thu Sep 29 20:42:49 +0000 2022,"AUCTION ALERT A little less than 2 hours left until the end of the auction! With a bid of 0.244 $ETH,  is in the lead again! Thank you all for participating in one of my biggest auctions yet!",LePro_1,40,70,21266,
Tue Sep 27 00:40:38 +0000 2022,We will build a wall between ethereum and cardano!,wabdoteth,39,393,109711,False
