created_at,text,user,retweet_count,favorite_count,followers,is_verified
Sat Nov 26 11:33:29 +0000 2022,"2013 - You missed $BTC 2014 - You missed $DOGE 2015 - You missed $XRP 2016 - You missed $ETH 2017 - You missed $ADA 2018 - You missed $BNB 2019 - You missed $LINK 2020 - You missed $DOT 2021 - You missed $SHIB In 2022, dont miss $MEE Which one did I miss?",TheMoonCarl,135,758,1502362,False
Sat Nov 26 08:46:14 +0000 2022,"Solana is dead folks. Im sorry there no other way around it. The NFT community may be the last stand. I hate it for those folks. And the people who built on it.  will be launching with $ETH, $MATIC, $ADA, &amp; $SOL so we hope the NFT community fairs decent here.",DiscoverCrypto_,141,1107,1028323,False
Sat Nov 26 20:03:01 +0000 2022,Crypto Correction... Binance $BNB: -55% Tron $TRX: -71% Polygon $MATIC: -71% Ethereum $ETH: -75% Bitcoin $BTC: -76% XRP $XRP: -80% Litecoin $LTC: -82% Dogecoin $DOGE: -88% Uniswap $UNI: -88% Cardano $ADA: -90% Polkadot $DOT: -90% Solana $SOL: -95% FTX $FTT: -98% Terra $LUNA: -99%,charliebilello,257,940,651662,False
Mon Nov 21 15:41:46 +0000 2022,"Drop on ! ""The magic of story"". Open edition. 0.03 $ETH. Until 24 Nov. Link &amp; description",subwwaym,56,176,10026,
Wed Nov 23 17:39:13 +0000 2022,DELUSIONAL - 24.11 -  - OPEN EDITIONS - 0.02 $ETH - 12PM EET/ 10AM UTC / 5AM EST LINK BELOW.,cartist00,45,77,33847,
Thu Nov 24 10:00:44 +0000 2022,First ever  open edition drop is LIVE! DELUSIONAL - 100 EDITIONS - 0.02 $ETH - LINK IN COMMENTS All RT's is highly appreciated! Let's freaking gooo!!,cartist00,172,302,33847,
Thu Nov 24 12:01:44 +0000 2022,GM Degenerati! I'm celebrating reaching my ATH with a sale yesterday by... looking for more jpegs If you have any badass art around 0.1 $ETH (ideally 1/1) show meeee! (Here's a crazy cool edition I picked up already by my friend  ),rocketgirlART,22,64,20135,
Fri Nov 25 12:16:41 +0000 2022,"As part of our ongoing commitment to transparency, we have provided new updates on Proof of Reserves. Further updates for $ETH, $USDT, $USDC, &amp; will be coming in the near future. Stay tuned.",binance,640,2034,14373515,
Fri Nov 25 16:34:40 +0000 2022,NEW CAP NFT DROP! Crap Market Soda is available at floor price of 0.02 $ETH on Ethereum Find a link below in the thread and take this chance to ride with us to the moon!,digi_caps,71,87,8139,False
Fri Nov 25 13:00:44 +0000 2022,FOXY DROP Connect with your spirit animal with the new  collection 2 works are also hiding TICKETS for free NFTs Join my Mother of Cats in the fluffy coziness Cats will warm you up and protect you with cat magic 0.07 eth,artncraftbyjul,54,112,2048,False
Thu Nov 24 17:17:54 +0000 2022,Soldier of love Editions available 5/10,emiillustrate,29,48,1746,False
Fri Nov 25 18:33:32 +0000 2022,"Omg... it's so special to me that the first collector of ""Pain of desire "" is my best fam ever  So lucky n blessed I am to have u as my fam 34/35 .06 $ETH",hamidehhos,29,49,7060,False
Sat Nov 26 03:02:46 +0000 2022,"Hex Crowdfund Ethereum Address for Declarative Statement from SEC regarding Hex NOT being a security: 0xbcf306Cd55638a0dd822501E091D0eEA539206b4 And nobody roast  anymore. I wish we could have come out sooner, but he paid for the legal defense of 10 TY!!!!",TheRealKNTX,286,1107,10977,False
Fri Nov 25 13:45:51 +0000 2022,MAKE FIAT GREAT AGAIN Say hello to my new  made me do it lol What a project! One of the strongest communities out here LFG!,Biel,78,183,1793235,False
Sat Nov 26 00:26:00 +0000 2022,Which wallet would you like to see integrate with Quai upon mainnet launch? Tag your favorite wallet in the comments below to let us know!,QuaiNetwork,9647,10125,316887,False
Mon Nov 28 11:36:13 +0000 2022,To make it crystal clear: WETH is a very simple smart contract - think of it like an adapter. You will ALWAYS be able to convert ETH into WETH and WETH into ETH at a 1:1 rate without any risks. This will be true as long as Ethereum exists.,koeppelmann,302,1282,53693,False
Mon Nov 28 20:18:16 +0000 2022,You could be down money if you bought or 5 years ago.,RichardHeartWin,99,978,350421,False
Sun Nov 27 18:58:36 +0000 2022,Ethereum payments will be standardized across retail POS systems and online checkouts within five years.,chriscantino,14,212,134179,False
Sun Nov 27 12:33:04 +0000 2022,1/ The $ACX token will go live tomorrow. The token will launch on L1. These are the confirmed token addresses for each chain: Ethereum: 0x44108f0223A3C3028F5Fe7AEC7f9bb2E66beF82F Optimism: 0xFf733b2A3557a7ed6697007ab5D11B79FdD1b76B,AcrossProtocol,191,642,124348,False
Fri Nov 25 07:33:22 +0000 2022,"Honest question, is there any Ethereum or Solana maxi here to explain it to me why do you believe Cardano is not gonna make it? Tnx",_AskNemo,15,116,16178,False
Sat Nov 26 15:41:51 +0000 2022,"Richard Heart could have forked Ethereum, airdropped some tokens to a bunch of HEX holders and launched Pulsechain in the time it takes to complete a trip to the Louis Vuitton store.",ercwl,18,435,165649,False
Sat Nov 26 20:03:01 +0000 2022,Crypto Correction... Binance $BNB: -55% Tron $TRX: -71% Polygon $MATIC: -71% Ethereum $ETH: -75% Bitcoin $BTC: -76% XRP $XRP: -80% Litecoin $LTC: -82% Dogecoin $DOGE: -88% Uniswap $UNI: -88% Cardano $ADA: -90% Polkadot $DOT: -90% Solana $SOL: -95% FTX $FTT: -98% Terra $LUNA: -99%,charliebilello,257,940,651662,False
Sun Nov 27 10:53:22 +0000 2022,does anyone know whats backing wrapped ethereum? im hearing this is widely used as collateral in the ethereum ecosystem- could be the next tether. some big hedge funds might start shorting soon,dystopiabreaker,16,212,49935,False
Sat Nov 26 07:24:05 +0000 2022,Men cant get pregnant &amp; Ethereum is a security.,TylerDurden,81,1094,185661,False
Thu Nov 24 16:38:17 +0000 2022,Gm!! My first ever  open edition drop is LIVE! On the other side talks about my healing journey. Editions 0.015 $ETH Link and Story All RTs are highly appreciated. Hope you resonate with this Artwork (:,maheenblues,334,607,19249,
Mon Nov 21 17:39:07 +0000 2022,"$ETH macro bottom is $300-$400, IMO. Key horizontal level + multi-year ascending channel support + golden pocket of the March 2020 - ATH range.",JustinBennettFX,161,868,115439,
Thu Nov 24 17:38:35 +0000 2022,"30 EDITIONS MINTED If you missed my manifold drop, this is your chance! 70 EDITIONS / 0.02 $ETH LINK BELOW.",cartist00,31,44,33847,
Tue Nov 22 23:00:03 +0000 2022,The auction for my genesis piece on  just got its first bid of 1.317 $ETH by  collector!!! Thank you for starting the auction!,delta_sauce,56,162,55503,
Wed Nov 23 02:11:42 +0000 2022,"A new bid of 1.449 $ETH on my genesis piece, ""Beach Walk"" was just placed by !!! Currently ~ 20 Hours remaining on the auction!!",delta_sauce,29,105,55503,
Thu Nov 24 14:12:13 +0000 2022,"vitalik.eth( ) transferred 40,000 $ETH($48M) to the address starting with 0xd04d just now.",lookonchain,78,510,588943,
Wed Nov 23 11:15:04 +0000 2022,"So. $GMX, $QNT, $BNB, $AVAX and $ETH. Buy those now, hold for 2 years, become a millionaire. That's the tweet.",AltCryptoGems,81,642,475942,
Sat Nov 26 14:20:11 +0000 2022,"GM Fam Install your artwork below, I need it. Must be: 1/1 - have a price tag in $eth $xtz $sol - one piece (Artists remember to see others posts before u go 4 support ) *\(^o^)/*",DialerOnX,12,97,5767,
Mon Nov 21 23:24:14 +0000 2022,One of the smartest and wealthiest people I have looked up to my entire life who had zero interest in $BTC and crypto since I started trading crypto whos made millions through real estate and other businesses is now looking to become a buyer of $BTC &amp; $ETH long term,CryptoGodJohn,36,777,828189,
Thu Nov 24 11:00:16 +0000 2022,"My wife has a ""no Ethereum talk"" rule.",coinfessions,134,2781,217748,
Fri Nov 25 08:16:52 +0000 2022,"NEW DROP Pinky Pay 0,09 ETH ",allinaarty,20,74,2717,
Sun Nov 27 12:26:36 +0000 2022,Most-mentioned Projects on Twitter in The Last 7 Days $SHIB  $FLOKI  $BABYDOGE  $AXS  $MARVIN  $CULT  $KIBA  $RISE  $SAND  $BONE ,ETH_Daily,105,252,114991,
Thu Nov 24 07:14:14 +0000 2022,"NEW DROP Amazing Cyber Forest Collection ""My Pet"" 6/12 sold 0.1 ETH",alexandra_yet,27,45,1278,
Wed Nov 23 13:14:00 +0000 2022,Midweek shill thread. Drop your NFT below. I'll RT as many as I can. (24hr Thread) NFT PRICE BE KIND RT at least 3 NO LINKS NO TAGS RAVERYN - 0.25 $ETH on FND,harshitdave,42,147,23166,False
Wed Nov 23 12:48:06 +0000 2022,SOLD 0.03 $ETH Edition   Thank you so much for support Like it buy it Thank youuuu,pichwish,46,86,12615,False
Thu Nov 24 03:56:26 +0000 2022,One-click RPC servers are coming to  next month. Non-custodial. Permissionless. Open-source. Does NOT collect IP addresses. Does NOT collect transaction info. 80% Cheaper than the competition. $ETH $AKT,gregosuri,120,472,49370,False
Wed Nov 23 19:10:25 +0000 2022,"I didnt accept the offer of 2.22 $ETH for ""Master of Mystery"", for one reason: respect for my previous collector. Never sell lower than your previous sale",HoizonArt,41,286,59913,False
Sun Nov 20 21:46:27 +0000 2022,"$ALGO has built a phenomenal protocol - but because the marketing isnt there; and by marketing I mean education for the normie, it hasnt received the same level as others with a weaker project. Its right up there with $ADA and $ETH, but you wouldnt know it.",davidgokhshtein,78,478,801743,False
Fri Nov 25 20:08:03 +0000 2022,Logarithmic Regression - we should be home soon enough,intocryptoverse,151,1628,1014635,False
Mon Nov 21 23:34:39 +0000 2022,"Why do I not like Ethereum? Centralization. I don't have to go any deeper, nor do I care too. It stops there.",bitcoinbrian2,56,780,658,False
Wed Nov 23 07:55:51 +0000 2022,GM fam 'Dance with my colors' is now listed on  with a reserve of 0.40 $ETH!,gulbakanozge,68,132,9416,False
Tue Nov 22 17:04:17 +0000 2022,In celebration of (almost) 10k lovely friends I'll be collecting art from my followers Please share: Art $ETH &amp; Link Price Editions Retweeting my is appreciated,atefehsadr,41,214,14652,False
Fri Nov 25 12:59:31 +0000 2022,"The new  collection has started! We hid 2 golden tickets in two random artworks!Interesting? Or maybe the golden ticket is hidden in my work? Through worlds 0,08 $ETH LINK:",SvetlanaMellin,44,103,2154,False
Mon Nov 28 09:17:37 +0000 2022,"The last days of autumn and I wanna remind you about one of my flower fairies GM autumn $ETH 0.1 Passionate fairy woke up in her cozy bed from red and orange autumn leaves: Good morning, new day! Gm autumn",Lilitaart,35,90,7912,False
Fri Nov 25 15:38:00 +0000 2022, You are hereby King of Ethereum.,VitalikButerin,107,1063,5766287,False
Tue Nov 22 10:23:52 +0000 2022,NEW DROP on  PARTY 0.15 $ETH Link,juliasiutkina,69,153,3324,False
Mon Nov 21 07:27:37 +0000 2022,"Hello fam thank you for your support ""Right Decision"" Sometimes no one really knows what they want to do with their life... Available on  0.30 $ETH Link",nahidabedi,70,132,7660,False
Sun Nov 27 15:52:35 +0000 2022,"""Room 251"" Auction started Thx to  for kicking off the auction Actual bid 0.27 $ETH 24 hrs to go",TheBlack_Void_,34,98,21088,False
Tue Nov 22 07:24:21 +0000 2022,Gm world UNA NOCHE EN EL OBSERVARORIO 0.02 $ETH per minting Open editions on manifold Link below,anothersigma0x,34,63,32850,False
Sun Nov 27 09:31:51 +0000 2022,"GM NFT Family I hope today brings you something sweet ""Brown Sugar"" 47/50 .005 $ETH",akaFoley,45,65,15527,False
Tue Nov 22 10:48:22 +0000 2022,Drop your NFTs under 0.90 $ETH,anothersigma0x,29,225,32850,False
Tue Nov 22 12:38:53 +0000 2022,What chain should we support next? ChainPort Supported Chains - Ethereum - BNB Chain - Polygon - Avalanche - Fantom - Moonriver - Fuse - Cardano - Dogechain - Aurora,chain_port,26,104,48312,
Tue Nov 22 10:52:50 +0000 2022,NEW DROP . BOOM . Price: 0.08 ETH . Link,AnkaraNFT,37,108,13586,
Mon Nov 21 23:39:57 +0000 2022,"Are you prepared for $1,000,000 BTC and $500 ETH? Ethereum ppl ran out of money in 2019/2020. If it werent for VC DeFi yield farm ponzis in 2020 &amp; the FED/Treasury pumping asset bubbles, ETH would be $500 max. 2023 everyone realizes DeFi/NFTs/ALTs are overvalued garbage ICOs.",bradmillscan,50,648,77997,
Thu Nov 24 06:22:00 +0000 2022,MetaMask wallet belongs to consensus. Consensus said they keep IP and Ethereum address of all the users. Where is decentralization???? Are they different from any Web-2 application??,simplykashif,74,574,163740,
Thu Nov 24 18:29:34 +0000 2022,"Last call for Whitelist (Pre-Sale) If you didn't register, you can do it here Just 4 days for minting...",DogeHeroes,461,386,13657,
Thu Nov 24 14:15:37 +0000 2022,$50 IN 5 HOURS RT &amp; Follow  Join Discord: (Post Proof) ________________________ Whoever finds one of two Red belt (Grandmaster) Grapple Beasts will be Airdropped 2 Ethereum. When both are found.,CryptoKing4Ever,532,95,924842,False
Sun Nov 20 09:54:55 +0000 2022,Ethereum can't scale Bitcoin can't scale Cardano scaled 5 times in 1 year and has already released the Input Endorsers CIP for the next Scalability event! Cardano will flip everything and everyone!,LucidCiC,130,882,45699,False
Thu Nov 24 06:04:51 +0000 2022,. said that it collects the IP and Ethereum wallet address of users by default when they use its digital wallet service . By ,CoinDesk,151,331,3360161,False
Mon Nov 21 00:44:56 +0000 2022,Next 3 years. Which blockchain has the best chance to supplant Ethereum?,marc_tbh,173,431,6087,False
Thu Nov 24 19:31:34 +0000 2022," Bitcoin's energy usage is what makes it valuable and decentralized. Ethereum's shift towards using less energy is what made me discount it as being less useful tech in the very long run. Instead of energy, it needs more governance.",LynAldenContact,16,324,760497,False
Thu Nov 24 06:46:19 +0000 2022,"A terrific photographer,  chief &amp; Community builder  Cryptogod's World 2.0 : Fusion of Photography x Art Collaboration of 120+ Artists &amp; Photographers from the NFT space CG WORLD 2.0 ETH",CryptogodsWorld,29,53,592,False
Tue Nov 22 09:49:09 +0000 2022,"GM I wish you a great and positive day! Cosmo-Girls Aiza is still looking for her home, she is so mysterious, I am sure her future owner will be special too! Thank you all for your support! Aiza",Arty_Anny,20,50,8529,False
Wed Nov 23 13:04:58 +0000 2022,"On-chain activity is thriving Fantom, Arbitrum &amp; Optimism now have more active addresses per day than they had in a week 7 months ago 1.27M 834K 457K 420K (Wallet accounts) 299K 74K 42K C-Chain 35K",nansen_ai,178,655,330731,False
Thu Nov 24 16:51:13 +0000 2022,NEWS:  to start collecting user IP addresses and Ethereum wallet addresses during on-chain transactions.,coingecko,118,400,2283841,False
Mon Nov 21 17:00:17 +0000 2022,Staking v0.1 Early Access launches on Ethereum mainnet December 6th at 12PM ET. This blog update covers: Pool design Alerting mechanism Auto-Delegation Staking rewards Reputation system And more. Explore the latest below,chainlink,404,1269,1314992,False
Wed Nov 23 11:31:47 +0000 2022,Approximately 48% of Ethereum transactions in October were fake (wash trading).,WhaleFUD,330,2027,456238,False
Thu Nov 24 22:06:00 +0000 2022,isn't going away (tell grandma).,AltcoinDailyio,81,759,1893137,False
Thu Nov 24 13:02:00 +0000 2022,Normalize talking on Thanksgiving,AltcoinDailyio,30,281,1893137,False
Wed Nov 23 19:13:56 +0000 2022,. is more bullish on Ethereum than Bitcoin.,AltcoinDailyio,11,191,1893137,False
Fri Nov 25 02:08:56 +0000 2022,"Fam, I find my Apple Pencil Kind person wrote me I want to make a Black Friday for 3 days! I have 2 available works on Opensea Ethereum Cheerledear and TON cheerleader 1/1 collection. 2/6 available (will be more) 1/5 continue",Krisbow_art,18,142,12981,False
Thu Nov 24 05:29:54 +0000 2022,"Good morning, this is a NEW DROP! Don't ask, I have no idea what's going on here maybe if babies are brought by a stork, little devils are brought by a pelican, what do you think? The birth of the devil 1/1 art 0.08 ETH",amber_umber_art,41,124,2913,False
Mon Nov 21 13:09:34 +0000 2022,"NEW DROP Collaboration with  on  ""Rise up and keep going | scribble by riyad"" Edition 10/10 Price: 0.02 $ETH Description below",ypopova_art,55,160,767,False
Wed Nov 23 11:58:08 +0000 2022,"terry.eth bought for 15.5 ETH (18,197.78 USD) on Opensea",EnsSalesBot,7,70,25455,False
Sat Nov 26 00:06:38 +0000 2022,"Gn my dear SOLD SOLD I am so happy to be included in your amazing collection. Thank you, my dear friend,  You made my day. Im grateful to you",KhadijehMohseni,13,37,6571,False
Mon Nov 21 00:39:55 +0000 2022,Rumours circulating on Wall Street that Satoshi has started moving his coins and is negotiating a bailout with the real Ethereum founder - Barry Shillbert.,TylerDurden,146,2087,185661,False
Fri Nov 25 13:05:57 +0000 2022,"Wow wow wow New collection from  Totem animal of this beautifully girl- fish.This girl is mysterious and has a good intuition, maybe it's about you? Koi girl 0.05 ETH Two works include GOLD TICKETS for extra NFTs",Anasstasiart,23,54,641,
Thu Nov 24 11:35:25 +0000 2022,"My last animation for  1/1 Cyber Rank 6, . I'm looking for a great project to animate on Ethereum. Or maybe should I make some other animations with NFTs on . Chill me your stuff. ",TheChainograph,28,79,283,False
Tue Nov 22 02:31:17 +0000 2022,current ethereum and avalanche trading volumes are nearly 1:1 on  are devs doing something?,jayks,85,365,32356,False
Thu Nov 24 09:08:52 +0000 2022,My interpretation of the movie City of Angels Fall of an Angel 4/5 available 0.025 eth Support the love of an angel,dreamhelenarts,41,84,5673,False
Thu Nov 24 01:20:16 +0000 2022,"Just listed my ape 6 ETH below FP floor Goodluck all I'm out enough is enough! Checkout whole Portfolio being listed as i speak! Lots of Deeds, Kodas, A Suit Mutant and more!",StonedBAYCApe,18,129,5952,False
Thu Nov 24 03:09:49 +0000 2022,"ConsenSys announced an update to its privacy policy on November 23 (including metamask infura and more): When you use Infura as your default RPC provider in MetaMask, Infura will collect your IP address and your Ethereum wallet address when you send a transaction.",WuBlockchain,642,1633,531962,False
Thu Nov 24 01:36:28 +0000 2022,Ethereum core devs have a call coming up this Thursday to discuss getting EIP-4844 to be considered for inclusion (CFI). This is a huge moment for the many teams that have been working on getting this EIP to production this year! Here is why I think it's time for CFI,liamihorne,289,1204,16283,False
Thu Nov 24 12:03:36 +0000 2022,Your personal information is valuable. You need to take your privacy seriously. You have many options to ensure no one is collecting your IP address along with your Ethereum wallet address when you send a transaction Here are a few options,alpha_pls,247,774,127294,False
Thu Nov 24 13:42:15 +0000 2022,"40,000 (47,942,000 USD) transferred from Vitalik Buterin to unknown wallet",whale_alert,84,584,2750999,False
Fri Nov 25 02:25:45 +0000 2022,"An address with a balance of 1,127,269 (1,126,593 USD) has just been frozen!",whale_alert,63,423,2750999,False
Thu Nov 24 19:46:22 +0000 2022,"Which of these will happen first? : $70,000 : $8,000 : $1,000 : $500 : $80 : $80 : $5 : $4 : $3 : $1 : $1 : $0.01 : $1 : $1",CoinHubCC,145,890,53035,False
Wed Nov 23 13:44:12 +0000 2022,It's been 69 days since The Merge and the Ethereum network has been running on Proof of Stake without issue Nice,sassal0x,71,1173,278407,False
Thu Nov 24 02:07:17 +0000 2022,"Think I need to make this clear :) I've never sold any ETH and never plan to (only ETH I've ""disposed of"" is for gas fees) Of my rewards from staked ETH, I plan to sell only what I need to in order to cover taxes So why do I ""pump"" ETH? Because Ethereum is fucking awesome",sassal0x,30,563,278407,False
Fri Nov 25 00:34:57 +0000 2022,When you show your amazingly talented friend a photo and she asks to paint it. If that friend is  you need to say yes! Thank you so much for doing this amazing piece. It's something we will treasure forever Soulmates 0.012 $ETH 4/8,growthrev,32,43,4915,
Thu Nov 24 16:20:53 +0000 2022,My Top100's picks to fill my portfolio's L1 allocation for next bull market: (Besides Ethereum OC) - $NEAR - $FTM - $EGLD Based on the combo of: Good TECH + Favorable TOKENOMICS + Low hype (UNDERRATED). Which one am I missing? (meeting those requirements).,0xDegenz,23,183,8927,
Thu Nov 24 14:05:02 +0000 2022,"New MetaMask policy: ""Infura will collect your IP address and your Ethereum wallet address when you send a transaction."" Source:",conraddit,31,152,12986,False
Sat Jan 29 10:29:12 +0000 2022,The Bored Ape Yacht Club 100 $ETH FLOOR LETS GO FUCKING APESHIT!!,ape_g4ng,32,336,69081,False
Sun Jan 30 23:22:36 +0000 2022,Bored Ape sells for a record high 1080 $ETH ($2.75M) The first ape to sell for 4 figures (ETH),ape_g4ng,180,1653,69081,False
Fri Jan 28 22:26:37 +0000 2022,"In this NFT bull cycle, if you want to explore, I suggest checking  NFTs out. Volume is picking up, still tons of upside, and great communities. I've been accumulating  and  (both under 1 $ETH equivalent).",NickJames2021,143,470,12234,False
Sat Jan 29 21:47:12 +0000 2022,Justin Bieber apes in to the Bored Ape Yacht Club with a 500 $ETH ($1.3M) purchase Welcome to the Yacht Club Biebs!,ape_g4ng,42,399,69081,False
Sun Jan 30 09:09:09 +0000 2022,Drop your art! no links Price + $xtz or $eth like RT and follow,metalisanft,38,183,14754,False
Sun Jan 30 12:44:07 +0000 2022,'Burnout' Coming soon to Known Origin  5/5 0.05 $eth,ScottBatemanArt,173,725,6665,False
Sat Jan 29 18:00:01 +0000 2022,Free AirDrop! - RT &amp; Follow Me to Enter! Drop Your $ETH Address Below!,NFTGifting,291,351,41433,False
Sat Jan 29 10:01:30 +0000 2022,GM OH MY PART 2  And I just received out third bid! This time its up to 1 $ETH THANK YOU SOSOSOSO MUCH  YOU ARE THE BEST! Mae is in charge of Economics and shes off the grid atm. Big thank you to  and DJ for previous bids!,NoCreative_eth,20,110,37205,False
Sat Jan 29 07:42:27 +0000 2022,this is the 420.69 $ETH ultra secret club ONLY MINT if you can HODL the floor by ,mentalist420,21,84,59277,False
Sun Jan 30 21:29:13 +0000 2022,Just tried minting on Back to I go,BigCryptoSam,228,1489,1938,False
Sun Jan 30 18:59:37 +0000 2022,"is a joke, $13k for a transactionThis same transaction on costs pennies, and unlike $SOL, the VeChain network has NEVER gone down. First mover advantage will only last so long if Ethereum 2.0 keeps getting delayed. There's simply better tech out there. $VET",DEEvCrypto,84,373,4404,False
Sat Jan 29 17:36:10 +0000 2022,Whale Concentration: 1) Cardano 2) Ethereum 3) Fantom 4) Polygon,DeansEpoch,106,529,11564,False
Sun Jan 30 19:00:25 +0000 2022,Folks check this out! Two weeks before the Hinman speech Lubin already announces that Ethereum is a commodity and that the regulators allow him to issue securities and not securities based on Ethereum! TWO WEEKS BEFORE HINMAN GAVE HIS SPEECH! It just doesn't stop!,Leerzeit,376,904,85776,False
Sat Jan 29 15:20:47 +0000 2022,Finish these bears off part 2 Stand with me bulls - bring back that f****** energy Bitcoin Ethereum Altcoins I dont even care just run it back,TraderNJ1,145,741,74520,False
Fri Jan 28 16:03:11 +0000 2022,You need ethereum to buy your  especially because we just broke 1eth floor. Hows business? BOOMING,hu99id,63,126,278,False
Sun Jan 30 13:49:21 +0000 2022,"My lovely work I drew it for several days, incredible texture and colors ",psi_lira,30,247,220,False
Fri Jan 28 19:02:27 +0000 2022,"BR3AKING: Steve Aoki is launching an Ethereum NFT membership club called A0K1VERSE. Holders will gain access to various benefits, including live and metaverse concerts and events.",themetav3rse,47,274,64553,False
Sat Jan 29 16:04:15 +0000 2022,BIG NEWS! MegaBaby INFT will have Staking Live Today! MegaBabies are COMING! Each holder of a on gets a free MegaBaby on A final snapshot of holders will be taken at 4:55pm Today 01/29!,MegaBabyInft,383,364,1260,False
Sun Jan 30 18:06:28 +0000 2022,"Punk 7121 bought for 1,180 ETH ($3,083,870.94 USD) by 0xebc428 from 0xbf2842.",cryptopunksbot,201,1604,104513,False
Sun Jan 30 15:23:19 +0000 2022,$FREE will burn 9% of the total supply tomorrow. This will bring the total burned supply to 20%. $FREE has 5.9 MILLION holders on &amp; offers a solution on $FREEyourFinance,THE_FREE_COIN,196,445,93580,False
Fri Jan 28 08:14:41 +0000 2022,"The SEC is basically saying, ""None of this would have been a problem if you had remained an ER20 token on the Ethereum blockchain. But as soon as you use something other than Ethereum, or even try to build a competing network, we're going to destroy you.""",Leerzeit,190,645,85776,False
Sun Jan 30 10:21:44 +0000 2022,"Dude lost 195 worth $511,000 by sending to the wrong address",SafemoonWarrior,69,470,84772,False
Sun Jan 30 06:25:42 +0000 2022,"ART SHARE THREAD - DROP 1 PIECE ONLY - NO LINKS, NO TEXT - IMAGE, GIF, VIDEO - PRICE WITH $ETH or $XTZ SYMBOL - RT FOR EXPOSURE, ENGAGE/RT ART YOU LIKE - TAG A BUNCH OF FRIENDS!!! LETS GO TO THE MOON",KlawMachineArt,60,269,40052,
Fri Jan 28 19:46:45 +0000 2022,"Discord has doubled in a week, you deserve this 3 whitelist spots available - rules below 1 Follow Us 2 RT This Post 3 Tag 3+ friends (no celebs or fake accounts) 4 Join $UNDEAD $ETH $ZIL",UndeadBlocks,269,320,57775,
Sat Jan 29 08:46:48 +0000 2022,"I just list ""Amour"" in  , imaginary illustration inspired by my whole time favorite book ""The little Prince"" Just for 0.4 $ETH look at the details please from the link below",soliiiart1,78,246,16064,
Sun Jan 30 10:25:48 +0000 2022,"""Midnight"" is already on the ! 0.18 $ETH The only time when thoughts are clear is when night envelops the sky, the stars shine and fall from the sky. You see and realize everything clearly, feel yourself and your desires, and slowly dissolve into a haze of sleep.",SolovyovaArt,96,339,7996,
Sun Jan 30 09:59:18 +0000 2022,"Big SHILLL Thread The rules are simple as always: DROP YOUR BEST IMAGE, GIF, VIDEO NO LINK, NO TEXT PRICE IN $ETH",o_zzy,17,109,4304,
