created_at,text,user,retweet_count,favorite_count,followers,is_verified
Tue Aug 30 17:56:46 +0000 2022,NEW RESERVE PRCE The Dreamer Reserve Price: 0.19 $ETH who follows their dreams like me!?,avaaaaart,94,148,19303,False
Mon Aug 29 09:04:22 +0000 2022,Gooooood morninggggg FAM! have a beautiful monday ONLY 3 editions left of Ponder on Life for 0.035 $ETH,avaaaaart,32,121,19303,False
Mon Aug 29 09:24:52 +0000 2022,"My new Cyberpunk piece is on the way, but before that lets make this one sold out. Only 3/5 remaining 0.05 $ETH Link below",SanndyCreationz,32,53,7075,False
Mon Aug 29 13:44:40 +0000 2022,"Auction started!! By the lovely  A wonderful surprise, thank you Current bid 0.05 $ETH",Uzzi_Art,34,88,34364,False
Sat Aug 27 03:23:57 +0000 2022,RAW ETHEREUM,beeple,638,5953,823265,
Sat Aug 27 15:13:43 +0000 2022,Friendly reminder: $ETH and the rest of the market likely has a long way to go. Wash. Rinse. Repeat.,JustinBennettFX,99,699,115440,
Sun Aug 28 19:06:36 +0000 2022,Dream come true!  via ,noblesnft,14,88,5956,
Tue Aug 30 18:57:31 +0000 2022,"So  just announced a few updates a quick 1/ Moonbirds will now be fully on-chain. Theyve taken a page out of the  . Each Moonbird attribute will now be coded into the Solidity smart contract. They will exist as long as Ethereum does, rather than IPFS",nftsupply,36,275,9336,
Sat Aug 27 17:19:05 +0000 2022,New drop For the contest from  Thank you so much for the inspiration Mary Price: 0.05 $ETH,Julia_Preskurel,36,90,702,
Mon Aug 29 08:14:18 +0000 2022,"AUCTION STARTED GM , Omg thank you so mouch my dear collector  for starting my AUCTION, I'm so happy... you made my day. current bid is : 0.05 $ETH link:",saeideart_tez,35,101,5138,
Sun Aug 28 19:38:20 +0000 2022,"I bought 60 5 digits yesterday when price was around .04 and today I wake up and floor price is at .075 and it's the collection in volume, this space is wild, it changes dramatically in one day ",armyrock_eth,19,165,12548,
Tue Aug 30 08:31:42 +0000 2022,"is up a legit 10% today because of Vitalik's hard fork! Hey, whatever gets the community going...",julianhosp,29,235,100181,
Sun Aug 28 12:56:40 +0000 2022,SOMEBODY CORRECT ME IF I AM WRONG BUT WHY IN THE HELL WOULD ANYONE INVEST IN ETHEREUM EVEN WITH A MERGE IF ITS NOT GOING TO BE FASTER OR FEEs WILL STILL BE HIGH WTH IS GOING ON PEOPLE !!!!!,XRPCryptoQuebec,65,589,4742,
Mon Aug 29 18:14:26 +0000 2022,Wondering what Ethereums merge means for the Polygon network? Weve got you covered,0xPolygon,376,1212,2061848,
Tue Aug 30 10:13:38 +0000 2022,Vitalik is trending - when I first met him he was 16 year old Bitcoiner working as a writer for Magazine. He came up with a Bitcoin paywall for articles - made hundreds of dollars. When he announced Ethereum/ Eth in Miami I was there. His Dad is a super cool guy also.,brucefenton,31,429,125447,
Sun Aug 28 21:01:37 +0000 2022,To Celebrate the upcoming launch of my new podcast  Ill be giving away a starter kit 1. 1 Ethereum 2. IPad Air 3. MacBook Air Rules. Follow my new page  retweet and like this post. 2 Weeks to enter,dontforgetsauce,465,526,4919,
Sun Aug 28 12:11:10 +0000 2022,"Hi, dear friends NEW DROP Gloria",MaryShuNFT,28,71,475,
Mon Aug 29 12:28:04 +0000 2022,Faaaam NEW DROP NEW collection Cheerful aster ETH 0.065,Lilitaart,41,96,7912,
Sat Aug 27 18:38:19 +0000 2022,"NIGHT DROP Meet the new Born in Darkness Belle 0.12 ETH For a seed to sprout, it needs darkness. To make it bloom - light. Thus the flower unites these opposites in itself",nnvincentt,38,121,4113,
Sat Aug 27 18:54:22 +0000 2022,Textbook copy on the Justin Mamis sentiment cycle! Now it is at the aversion stage. Up soon,Crypto_N_B,186,749,21359,
Mon Aug 29 13:54:00 +0000 2022,ETH mainnet: ~14 tps ETH with L2s today: ~4k tps ETH with sharding (~2023): 100k+ tps is scaling and will soon be known as the global settlement layer of the world Prepare accordingly,CryptoGucci,41,285,43805,
Mon Aug 29 20:46:07 +0000 2022,Omg  started the auction for Piece of Peace Thanks a lot Raph Current bid: 0.35 $Eth The second rare trait is going to be revealed The half that grows ~Splitted Soul,BizzarroBiz,31,78,9204,
Mon Aug 29 07:45:08 +0000 2022,Good Morning Creative Meta Flower (20 Editions) 4 Collected by Amazing Friends     16/20 left $ETH: 0.009 Who's Next???,smm_aryan,20,45,4815,
Tue Aug 30 14:23:02 +0000 2022,"Just place a bid on this by  , it reminds me where we will all be when $ETH hits $10K next year ! Such a vibe , amazing!",__DigitalDealer,25,112,6687,
Tue Aug 30 18:00:01 +0000 2022,"Art share time! Last time I did this, I picked something up Art Price in $XTZ, $ETH, $USDC Check my RT, engage, follow One entry per artist",pax_art,34,140,5438,
Sun Aug 28 17:02:45 +0000 2022,It's my turn to give back to the community. I'm going shopping. Show me your art with a price of 0.03 or less. One post for one artist. Artwork Price in $ETH Description Tag friends if you want (3 max) No links I close comments after 24 hours Art by ,vesnita_bonita,44,169,2010,
Mon Aug 29 09:23:52 +0000 2022,Picking a few followers who interact with this tweet for a surprise $ETH or $SOL DM,web3ree,103,159,34581,
Tue Aug 30 10:04:12 +0000 2022,NEW DROP Who loves corgi that much like me and my Dumpling?  animated 0.03 - 0.035 $ETH Link,jacky_irkart,45,103,12565,
Sun Aug 28 03:17:25 +0000 2022,"GM Fam !! are you the guy in the middle or the side ones? ""Middle man"" is available on  for 0.35 $ETH",dhilkrishnadk,45,143,6981,
Mon Aug 29 14:52:55 +0000 2022,NEW DROP I promised ull be surprised Cuties Dumpling ever! Watch the animation  animated 0.03 - 0.035 $eth Link,jacky_irkart,38,98,12565,
Mon Aug 29 20:52:49 +0000 2022,Drop your $ETH wallet and follow Dont ask why,JUST_NFTVERSE,165,220,156456,
Tue Aug 30 19:06:35 +0000 2022,Gn only 2 Left 3/5 editions 0.05 $ETH ,saharrococo,19,53,10159,
Thu Aug 25 09:50:01 +0000 2022,"Art is the future! I bought this  x  collab artwork back in April 2022 for 0.3 $ETH. It received multiple offers, like right now  bid 1 $ETH for it, much appreciated! But I believe it's worth at least 10 $ETH in the near future, holding tight!",unchained_ninja,78,286,31997,
Tue Aug 30 09:15:31 +0000 2022,"A bid on my Piece means a bid for another artist, as usual. Could you spot who? 12 h left on my Last piece on  before SOLD OUT Every +0.1 $Eth on Piece of Peace (Splitted sould collection on Lynktree) i will start another auction",BizzarroBiz,19,72,9204,
Mon Aug 29 14:19:08 +0000 2022,"NEW FOUNDATION DROP Two-faced We may be two-faced, but what is our true identity? 0.15 $ETH reserve GIF",arsenkulmakhan,115,269,870,
Mon Aug 29 04:11:09 +0000 2022,Gm Gm FamLets stay positive and hopefulHappy Monday Butcher on film 0.05 $ETH 1/1,Janej666,13,77,2429,
Sun Aug 28 17:34:24 +0000 2022,B U B B L E S L I M E S New drop on ! Open up your mind Let your monsters float away Carrying your worries 0.2 $ETH reserve Link below!,Amydoodles_,81,134,5430,
Tue Aug 30 12:01:00 +0000 2022,"Staking takes away your property rights and you commit to accept slashing, penalties, and total loss through soft-forks (UASF). This isn't the future of staking nor sound money. PoW doesn't slash. And neither does modern PoS like , , and .",StakeWithPride,56,302,21086,
Mon Aug 29 10:46:46 +0000 2022,Hello everyone Support the Angel Person 57 - Sera. She is waiting for her owner. The demon's persona has already been bought,artistrosali,29,64,1217,
Mon Aug 29 16:50:13 +0000 2022,"Evening my dear fam its a new drop letter ""N"" i hope this Nnnnice and Nnnnifty girl will be Nnnumber-one for you please support me, it will be very pleasure",baleririnka,23,88,5071,
Sun Aug 28 12:04:27 +0000 2022,Egyptian cat,sa_liluna,43,89,1295,
Mon Aug 29 08:47:36 +0000 2022,Blue Cat for Lia Price 0.02 ETH,sa_liluna,28,64,1295,
Tue Aug 30 06:47:51 +0000 2022,"NEW DROP Colorful is already waiting for its owner on Baby Muna loves to fly in the clouds To get to know her, you need to go upstairs, she will show you the colorful world from her cloud Links",valerealll,43,201,2549,
Tue Aug 30 02:18:41 +0000 2022,"666666.eth bought for 10.0 ETH (15,290.90 USD) on Opensea",6DigitsBot,22,149,1360,
Mon Aug 29 09:15:25 +0000 2022,"New drop in collection  Billiards party 0.08ETH Billiards, a very interesting game It affects many different particles of a person, mind, logic, physical movements and at the same time playful, sexy, sensual So, let's play a game?)",Ann_Sawyer_S,26,80,3608,
Tue Aug 30 01:53:53 +0000 2022,Gutter Cat has been purchased by 0xaa45f for 5 WETH,GutterBot,8,71,7876,
Sun Aug 28 12:28:52 +0000 2022,NEW DROP Kevin 0.02 ETH available on  I want giraffes to find their owners All NFTs are draw by hand Welcome to the club,Stepanovvvvvaa,27,58,1798,
Mon Aug 29 14:17:08 +0000 2022,"Bright and juicy nft can be yours All Eyes on You"" Timeline 14 hrs. 44 min. Price 0.12 ETH Link",o_sofy_arty,28,76,5242,
Mon Aug 29 13:11:22 +0000 2022,"Powered by StarkWare! Myria has partnered with  to create our ZK STARKs-based Ethereum Layer 2 scaling solution, which powers our gaming platform, marketplace, and wallet. Get an in-depth view into our L2 at here:",Myria,119,404,227275,
Sat Aug 27 08:28:39 +0000 2022,Load the node FUD... I wonder why they are taking this decision just before the $ETH merge,coinbureau,100,564,968030,
Tue Aug 30 04:51:04 +0000 2022,morning lovelies show me your latest or any of your work links price in eth/xtz todays feature the very talented  0.13 $ETH please retweet and engage,lisamartinart,39,146,8920,
Tue Aug 30 16:18:00 +0000 2022,"A dip isn't enough for you? Here you go a tax free dip For the next 24 hours, every buy of 0.2+ $ETH will receive the 13% tax back in at the end of the event $VOLT",VoltInuOfficial,207,339,140463,
Tue Aug 30 02:00:35 +0000 2022,"When I love this piece by  . In the meanwhile ,I hope someone will place more bid for his photograph. 0.05 $ETH is a steal for this stunning piece",haningwaslost,41,77,29261,
Tue Aug 30 17:11:50 +0000 2022,"Secondary Sale An edition of Astonishment, from  collection, was sold to  for 0.35 $ETH Congrats to all",HoizonArt,42,215,59914,
Mon Aug 29 11:43:49 +0000 2022,OMG!!!! Another edition of Ponder on Life was picked up by dear  and now!!!! only ONE edition left! 0.035 $ETH Last call for Last one!!,avaaaaart,48,86,19308,
Mon Aug 29 15:13:19 +0000 2022,""" Carchitecture "" is listed and available on  Reserve price 0.25 $ETH",cartist00,74,172,33847,
Tue Aug 30 01:54:07 +0000 2022,"Let's do this again because i found 13 nft's that i bought last time..... Drop your bad a$$ work down below, but you have to follow me.... Drop, Drop, Drop, Drop.... $eth only for today....",akachambo,19,80,12760,
Mon Aug 29 18:21:39 +0000 2022,I haven't shilled this collab I made alongside  in a while. Idk if you're aware but we make art that you can buy and you should buy it. Also eat a banana. K bye. 1/1 - 0.666 $ETH,line_art_murder,56,87,25020,
Tue Aug 30 16:43:01 +0000 2022,"THE FIRST AI-ILLUSTRATED COMIC IS HERE! ""Derelict Leviathan"" Page 1 20 Editions 0.05 $ETH Each purchase will help fund the next page and so forth; 1//5 Please continue reading for more information",Inner_Sanctum__,93,200,10522,
Mon Aug 29 06:08:38 +0000 2022,Good morning dear friends! Have a great Monday! Meji collab with amazing  Visit Meji Elicular who comes from future Reserved just at 0.2 $ETH Link,FereshtehFarma3,52,83,7546,
Mon Aug 29 08:26:15 +0000 2022,""" CARCHITECTURE "" Available 30.08.2022 (Tomorrow) 5 AM EST / 2 AM PST / 9 AM GMT 1/1 on  Reserve price - 0.25 $ETH Set your reminders!!",cartist00,66,118,33847,
Fri Aug 26 12:59:49 +0000 2022,Many expect a new bull market to begin any day. But are you mentally prepared for something like this? $TOTAL $BTC $ETH,JustinBennettFX,59,405,115439,
Tue Aug 30 07:02:16 +0000 2022,Vitalik is very excited about the $ETH merge,crypto_bitlord7,45,665,410847,
Tue Aug 30 02:00:05 +0000 2022,when I show her how much $ETH I own,LilMoonLambo,184,2752,215110,
Sat Aug 27 11:21:09 +0000 2022,$ETH Short squeeze to 1800 is still likely. Then new lows.,CryptoCapo_,174,2037,959560,
Sat Aug 27 20:38:18 +0000 2022,I just added 50 $ENS 5 digit from the floor to my digit portfolio $5/year registration fees + visually great looking (odd number of digits) I just swept the ENS: Ethereum Name Service floor with  Bought: 50 items for 2.3825 ETH Gas savings: $31.73,008_eth,41,303,10512,False
Sat Aug 27 01:59:18 +0000 2022,Head and Shoulders,MatthewHyland_,29,301,160513,False
Mon Aug 29 00:41:15 +0000 2022,"Sneak Peek Alert ""Crisvond DeFI Elitism Fire Animation"" WL CLOSE in 24H, Mint Date 31th Aug WL registration at Official website RT++FL  and  tag Friends 1x DE NFT",cris_vond,237,189,18680,False
Sun Aug 28 14:12:51 +0000 2022,Wait until everyone realizes that is Instant millionaires,lowkeyrich_,50,179,363033,False
Tue Aug 30 04:24:51 +0000 2022,"My wife doesn't really care about crypto, but for some reason she's suddenly really interested in Ethereum.",TheJackForge,23,593,240123,False
Tue Aug 30 02:18:28 +0000 2022,666666.eth bought for 10.00 ETH on OpenSea $ENS,EnsSales,16,85,17541,False
Tue Aug 30 14:53:05 +0000 2022,"Thank you  It is amazing to see that our art *moves* you Find this awesome on the wonderful blockchain at the link below Thank you for this fantastic technology, we would not be here without you With love,  and Monika",MonikaNFT,24,74,13891,False
Mon Aug 29 12:30:04 +0000 2022,The triple halving might be a bigger event than the halving in 2024!,TheCryptoLark,65,307,1392809,False
Mon Aug 29 11:44:53 +0000 2022,"I repay the debt to the community when sales happen. This month I got a little, but I want to buy Be sure to follow the rules: - Up to 0.025 ETH on Opensea - Ethereum/Polygon - Subscribe to me Throw as much as you want and RT pls",Evanikart,47,109,7187,False
Fri Aug 26 04:10:20 +0000 2022,Gm GmHappy Friday Fam Allure on film 0.05 $ETH 1/1,Janej666,19,124,2430,False
Mon Aug 29 08:12:06 +0000 2022,"GM fam I wish you a wonderful colorful week Aphrodite 1/1-0,17 $eth on ",gulbakanozge,34,99,9416,False
Tue Aug 30 07:32:57 +0000 2022,"NEW DROP Good morning, friends! Im happy to show you my new artwork! Purple mystery Price 0.1 $ETH",DariaNFTartist,33,141,9874,False
Sat Aug 27 04:19:10 +0000 2022,Gm GmHave a nice weekend Fam A Silent Morning on film 0.05 $ETH 1/1,Janej666,25,115,2430,False
Mon Aug 22 12:07:32 +0000 2022,Do you know who I've made a collab with? This 1/1 piece I've created with . The Artist featured by  and  The Lighthouse available for 0.2 $ETH,dsgnnina,57,90,6918,
Tue Aug 23 10:21:17 +0000 2022,drop your newest NFT Price on $ETH RT &amp; QT your Favourites Ill RT my Favourites Engage ech other if you need to make more friends for your comunity masterpiece by  3.12 $ETH,farnaz_dashti,97,285,15356,
Sun Aug 28 08:27:44 +0000 2022,For those always hungry for more... We created the INFINITY PIZZA (Could an NFT become a Currency as well? ) Just COMMENT your $ETH address and engage with this tweet to be the first to receive one,RareDough,361,426,7874,
Tue Aug 23 10:31:45 +0000 2022,"GM , Like  and me promised we are using our $ETH from the sale of Queen of the damned So we have both 0.15 $ETH to spend Show us your amazing works please",leaf_swan,103,344,61670,
Sat Aug 27 11:15:38 +0000 2022,Another milestone for  20 amazing artworks collected from  owners. You see your work on here ? Current floor just over 0.01 $ETH,leaf_swan,81,196,61670,
Mon Aug 29 17:01:16 +0000 2022,"I just created a new collection on  called Flesh And Blood and the first featured piece is called Accismus! To induct the collection the right way, I've decided to set this one's reserve to just 0.05 $ETH !!! Go bid on it now!",ReeceSwanepoel,65,108,19107,
Tue Aug 30 07:13:52 +0000 2022,Woke up to some fantastic mail!! Thank you so much Ninja for your bid!! LET'S GOOOOOO!! Top bid: 0.0999 $ETH With 10 hours left Can we get this over 0.15 eth??? Thank you so much ,ReeceSwanepoel,52,119,19107,
Tue Aug 30 13:48:53 +0000 2022,"I have decided that I will make collection with  This is a collection of my collages in editions, in an affordable price. Paradise Lost 25/25 0.01 $ETH Better to reign in hell, than to serve in heaven...",MagdaGangsta,104,193,16262,
Tue Aug 30 18:31:16 +0000 2022,Time No Links Share your Art and Price! Tag 2 People Like/RT Favorites! Let's get some eyes on some art! 'Crossroad' 0.20 $ETH Reserve Would love to see the work of  and !,delta_sauce,88,320,55503,
Tue Aug 30 14:24:00 +0000 2022,"Top 10 Coins by Weekly Search Popularity on (Aug 30, 2022) $CULT $MFT $MOVR $OXT $LUNC $ETH $BTC $SHIB $CAKE $ADA",kucoincom,217,424,3558891,
Mon Aug 29 06:20:15 +0000 2022,GM! Our life is a great gift. Everywhere we are surrounded by the magic of creation. Our main task is not to miss it and appreciate it. Enjoy your life! Happy to present you my new drop. Pure Magic ERC 1155  10/10 0.02 $ETH I will be grateful for support Link,PeterArt18,69,158,25464,
Tue Aug 30 00:31:32 +0000 2022,How do you think payment in-kind works? Based on balance sheet they have 79% $ETH &amp; 8% $BTC. I dont think some lose 21% &amp; others 92%. They sell all &amp; buy BTC/ETH/USDC? Which base currency? or we all get a basket of stuff we never wanted including $CEL &amp; race to sell?,SimonDixonTwitt,38,328,192310,
Tue Aug 30 11:44:20 +0000 2022,Are the bears in control? $ETH got rejected from a long-term trend line on the 2H timeframe. We could expect a pull-back to $1446.,TheMoonCarl,29,251,1502401,
Mon Aug 29 13:53:25 +0000 2022,Drop your $ETH address Follow Rt and ($ETH ONLY),lotta_NFT,291,347,219260,
Fri Aug 26 13:10:23 +0000 2022,"NEW DROP I want to introduce you to a new artwork from the ""The Future of Humankind"" collection at  ""Cybergirl "" Price 0.032 $ETH Hope you like it! Link below",VasiawOw,143,362,2868,
Sun Aug 28 16:45:28 +0000 2022,A THREAD OF MY COLLECTIONS My work on  consists of collaborations along with my original artwork. Prices are a mix of lower costed editions starting at 0.02 $ETH and 1/1 auctions with reserves starting at 0.1 $ETH.,line_art_murder,331,497,25020,
Wed Aug 24 06:56:10 +0000 2022,"GM fam I have started to work on a new foundation collection, i want to take my time and create something very cool.. In the meantime, I have lowered the reserve for these two pieces. You can now start the auction at 0.10 $ETH",reverse_visuals,31,125,28757,
Sat Aug 27 17:57:30 +0000 2022,OMFG!!! An edition of I M P U L S E collab with  sold to  Thank you so much There are 6/8 ed. left at 0.05 $ETH on ,00point1,48,74,13622,
Sat Aug 27 08:35:19 +0000 2022,"$XRP was $0.023 when $BTC was $317 in 2014. $ETH didnt even exist. Today, $XRP is $0.33, only 14X since 2014. holders, its time to count your losses, sale and look for a better investment. I know youre emotionally attached to it but thats not how we invest.",greybtc,75,393,86001,
Sat Aug 27 07:53:23 +0000 2022,I'm buying Drop your editions or 1/1 nft $ETH chain only,INTACTarts,45,466,3000,
Sun Aug 28 15:29:36 +0000 2022,"1/ While the days of 3-digit  fetching 20 $ETH may be over, ENS is still here. So what growth prospects does ENS have moving forward?",MessariCrypto,23,78,420324,
Sat Aug 27 16:49:42 +0000 2022,Will be nice to buy $eth around $600-700,AlgodTrading,79,1712,197722,
Sat Aug 27 15:16:20 +0000 2022,"As promised Ill be giving away one worth 0.5 $ETH ($750) to someone who Likes, RTs &amp; Shows me ON!",andrewtalksdefi,397,488,95885,
Mon Aug 29 10:52:49 +0000 2022,Drop your best NFTs under 1 $ETH DROP RT LIKE,nft_finley,73,298,36479,
Mon Aug 29 17:16:42 +0000 2022,"Who hasnt won anything yet?! Drop your $ETH wallets &amp; RT, I'll send in some",andrewtalksdefi,370,426,95885,
Tue Aug 30 12:05:00 +0000 2022,$eth literally omegapumped the moment Vitalik showed his size Simulation confirmed,AlgodTrading,30,786,197722,
Tue Aug 30 18:56:46 +0000 2022,Halving: process reducing the issuance rate of crypto coins. Triple Halving: community-coined term for the 3 factors aiming to lower $ETH supply after 's Merge: New ETH issuance to drop by ~90% Staked ETH locked up for 6-12 months Transaction base fee burn,binance,193,668,14373515,
Mon Aug 22 19:06:58 +0000 2022,A new Ethereum block being forged (: ),tomuky,18,134,6630,
Wed Aug 24 10:26:35 +0000 2022,"""On the Wave"" Surfing like the mafia. Once you're in - your in. There's no getting out. Price 0.06 Link",o_sofy_arty,36,99,5242,
Fri Aug 26 11:02:50 +0000 2022,"The new drop! 1/1 ""All Eyes on You"" Mysterious floral art just waiting for you! Can you count all the eyes on this art? Timeline 14 hrs. 44 min. Total number of barcodes 15,984 Price 0.12 ETH Link",o_sofy_arty,45,116,5242,
Mon Aug 29 04:11:09 +0000 2022,Gm Gm FamLets stay positive and hopefulHappy Monday Butcher on film 0.05 $ETH 1/1,Janej666,13,77,2429,
Tue Aug 30 04:16:20 +0000 2022,Gm Gm Fam Hope your Tuesday is off to a fantastic startLFG Lost in Paris on film 0.05 $ETH 1/1,Janej666,21,72,2429,
Tue Aug 30 12:48:50 +0000 2022,Calling all the elves from across the world! After the imense succes on is now launching on today at 2 PM UTC. We have 4 lined up so join our telegram and be part of the This is just the beginning,AlveyChain,175,317,37065,
Tue Aug 30 06:44:00 +0000 2022,2 days left Just because you haven't seen mermaids doesn't mean they don't exist Did you see me?,Alexandra_Saula,32,80,5915,
Mon Aug 29 09:10:50 +0000 2022,"Fire in the eyes, a cold head, this is what determines victory. You are deeply mistaken if you think that this girl will not be able to defeat you in the fight LFGGG! Fire Kickboxing Sport Arena from  0.08 ETH Link:",daryarts_,33,95,2020,
Sun Aug 28 09:07:49 +0000 2022,"Once the pain subsides, but the scars on the soul do not heal. In my life, I urge people not to say hurtful words to each other. It really hurts and can make a person close off from the world Doll Elizabeth 0.03 ETH",Evanikart,79,147,7188,
Tue Aug 30 15:04:15 +0000 2022,Just picked up this fabulous piece from my friend and art mentor  . So happy to have something of yours in my collection &amp; thanks for all the help and advice,lotsofnfts,23,130,29528,
Mon Aug 29 05:23:23 +0000 2022,Good morning fam Have a great week ahead! Sometimes you have to leave to find yourself! Departure Last 3 pieces 0.027 $ETH,ErdemKuybulu,21,66,5596,
Sun Aug 28 21:27:35 +0000 2022,I just opened my email to the best surprise!!  collected Spiral from FLY by ParraDeSys! I have loved this shot since I captured it and I am so grateful that Stacey now owns it! Thank you for believing in me &amp; this collection!,ParraDeSys,10,40,6282,
Tue Aug 30 05:52:25 +0000 2022,Good morning! Let your most important dream come true! This raccoon is still waiting for its collector He believes in his dream and knows for sure that it will come true soon,GoryachayaG,19,99,3587,
Mon Aug 29 16:24:58 +0000 2022,"The Merge is coming: UPGRADE YOUR CLIENTS! The Bellatrix upgrade is scheduled for epoch 144896 on the Beacon Chain 11:34:47am UTC on Sept 6, 2022 The TTD value triggering The Merge is 58750000000000000000000, expected between 10-20 Sep 2022 MORE:",ethereum,2999,7248,3808905,
Tue Aug 30 04:53:22 +0000 2022,"Ethereum killers: ""We have cheap fees"" Ethereum: ""We have a Vitalik""",sassal0x,60,1029,278417,
Sun Aug 28 13:08:18 +0000 2022,"NEW DROP with love Im going to create 100 Dumplings, and they are all soooo cool and cute and funny! He lives on  Animated 0.03 - 0.035 $eth",jacky_irkart,33,109,12565,
Sat Aug 27 14:11:23 +0000 2022,"OMG Dear  , listed UNITY on secondary Market for 6.942 $ETH",saharrococo,14,70,10159,
Sun Aug 28 10:18:44 +0000 2022,"This is the logic of the majority of $XRP investors. I was victim to this too. Years ago, I sold $BTC for $XRP only to regret later. Thankfully, I sold the $XRP for $ETH and did well. investors think high token count = More value. WRONG!!",greybtc,24,106,86001,
Sat Aug 27 09:44:52 +0000 2022,NEW DROPS Collection Bubble dream on  Reserve 0.05 $ETH Thank you for your support my famiii,alyonitaa,74,195,22948,
Sat Aug 27 11:13:49 +0000 2022,Decided I'm calling it quits with $ETH NFT's Selling these apes to buy . What traits should i get!?!,Linkkzyy,42,292,39371,
Mon Aug 29 07:20:22 +0000 2022,"Gm gm gm!!! Happy Monday and lets do it awesome [Me patiently waiting for my work to do itself, 0,3 $ETH + original canvas 100/73 cm, link below]",MJuventa,20,67,14965,
Tue Aug 30 13:27:50 +0000 2022,"One of my most incredible collaborations Work from the ""Meji"" Collaboration Series by  Available for only 0.2 $ETH",cryptorenya,42,86,9880,
Tue Aug 30 13:11:48 +0000 2022,"Gm my Friends ONLY THIS TUESDAY OPERATION ""ATTIC collection"" Discovery For Every purchase of a 1/1 of the Attic collection such as ""Toads"" (0.15 $eth) I will AIRDROP You a Doodle of your choice Valid until Midnight GMT link",JeffRolandMagic,78,144,17928,
Mon Aug 29 12:27:30 +0000 2022,Pure Magic Let's color our lives a little! ERC 1155  10/10 0.02 $ETH Link,PeterArt18,38,69,25464,
Mon Aug 29 17:07:18 +0000 2022,Drop your $ETH wallets,JUST_NFTVERSE,99,152,156456,
Sun Aug 28 19:41:25 +0000 2022,Which one would you pick? $ETH $QNT $XRP,TheDustyBC,78,1140,272031,
Tue Aug 30 07:13:14 +0000 2022,First edition sold to dear  Thank you so much ser Im so glad you like my messy lines Waves 9/10 editions left 0.03 $eth,shahparism,45,93,23305,
Sun Aug 28 00:55:47 +0000 2022,Dumping 1 $ETH into a random wallet Follow Rt and Drop your addresses ($ETH ONLY),koinswap_io,525,631,35615,
Sun Aug 28 07:32:04 +0000 2022,825$ (0.28 ETH) among the first 500 Retweets. Retweet; Follow me! Let's go! Drop your $ETH wallet address,6avid_eth,368,349,127110,
Sat Aug 27 08:58:58 +0000 2022,"Broken Clown ""Rainbows"" now listed for .12 $ETH Floor rises after every sale Signed by 2 artists   10 piece 1/1 collection - 2 sold Accepting .12 $ETH offers on any until the next one is sold, so pick your favorite!",akaFoley,79,112,15528,
Mon Aug 29 20:54:06 +0000 2022,"800$ in $ETH | 11h Retweet, Follow and Like",miky_NFT,181,203,97909,
